user_input,retrieved_contexts,response,reference,faithfulness,context_recall,answer_correctness
Quel concert a lieu Place de la Bastille à Paris le 21 juin 2026 ?,"[""L'événement MF Room a lieu au Place de la Bastille dans la ville de Paris. Date : le 21/06/2026 (juin 2026) de 14h00 à 21h00. Description : Découvrez un concert où l’électronique live, de l’ambient à la techno, rencontre la puissance des instruments acoustiques – saxophone, guitare et synthétiseurs analogiques, conçus maison. Porté par un sound system haut de gamme, conçu sur mesure, ce voyage sonore vous plonge dans une immersion où chaque fréquence, chaque nuance, est restituée avec une précision envoûtante. Entre mélodies planantes, beats énergiques et improvisations audacieuses, le concert offre une expérience où l’électronique et l’acoustique s’entrelacent pour créer une ambiance à la fois immersive et vivante. Une fusion rare où la musique devient une aventure sensorielle."", 'L\'événement VOYAGE le concert interactif a lieu au Place de la Bastille dans la ville de Paris. Date : le 21/06/2026 (juin 2026) de 15h30 à 16h00. Description : ""VOYAGE, le concert Interactif"" est un spectacle musical et visuel d\'une durée de 1 heure et 15 minutes, conçu par l\'artiste Gabriele pour offrir au public une expérience immersive et participative. Le répertoire mêle le français et l’italien dans 12 chansons originales écrites par l’artiste Gabriele et d’autres plus connues, avec une forte interaction entre la scène et le public. Les spectateurs reçoivent à l’entrée un « kit de voyage ». Ceci est une enveloppe qui contient des gadgets que Gabriele demandera d’utiliser au fur et à mesure pour s\'immerger dans l\'ambiance de chaque chanson. L\'objectif de Gabriele est de créer un', ""L'événement Basement is even still here! a lieu au 69 boulevard de belleville dans la ville de Paris. Date : le 21/06/2026 (juin 2026) de 17h00 à 20h00. Description : Ce n'est pas un festival de musique comme les autres. Ce n'est pas une réunion de groupe habituelle. Basement est toujours là ! pour leur unique concert de 2026. Sortez du trou (pour nos fans de la première heure 😉 ) et venez nous rejoindre pour un moment que nous espérons mémorable ! On vous promet (ou pas) : que la batterie de Denis sera accordée, qu'Emiliano réussira son entrée difficile à expliquer, que Charles réussira ses déboires et que Flo chantera 😘 ! Rendez-vous devant le 69 Bd de Belleville vers 17h pour une soirée inoubliable ! Invitez vos amis et ennemis, votre famille et tous ceux qui veulent applaudir, chanter"", ""L'événement Du (Très) Bon Rock en plein air ! a lieu au Les insouciants, 116 boulevard saint germain 75006 Paris dans la ville de Paris. Date : le 21/06/2026 (juin 2026) de 17h00 à 23h55. Description : Du (Très) Bon Rock en plein air ! Nous sommes Ira Mundi - Retrouvez nous pour vibrer au son de tubes Pop Rock planétaires : ### Beatles, Kinks, Rolling Stones, Led Zep, AC/DC, U2, Nirvana, Oasis, Radiohead, The Hives, Arctic Monkeys, Jack White, Kings of Leon, Muse ... dans le style original ou en prenant parfois quelques libertés ... Nous espérons que vous aimerez le shOw et chanterez avec nous jusqu'à la tombée de la nuit ! Nouveauté 2026 : nous accueillons dans notre voyage musical une nouvelle recrue : Valentine ! Fifi (Chant), Valentine (Chant)(New!!) , Pej (Batterie), Joe (Guitare),"", ""L'événement l'ACAGL14 fait son show en chantant et en dansant a lieu au Place Victor et Hélène Basch dans la ville de Paris. Date : le 21/06/2026 (juin 2026) de 17h00 à 23h59. Description : Des 17h00, une chorale viendra chanter sur le parvis de l'église Saint Pierre de Montrougede 17h à 17h30 et nous puisuivrons avec de la danse hip hop et Zumba de 17h45 à 19h15pour enchainer sur soirée musicale de chansons fransaises et varietes 19h30 à 23h00"", 'L\'événement VOYAGE le concert interactif a lieu au Place de châtelet dans la ville de Paris. Date : le 21/06/2026 (juin 2026) de 17h30 à 18h00. Description : ""VOYAGE, le concert Interactif"" est un spectacle musical et visuel d\'une durée de 1 heure et 15 minutes, conçu par l\'artiste Gabriele pour offrir au public une expérience immersive et participative. Le répertoire mêle le français et l’italien dans 12 chansons originales écrites par l’artiste Gabriele et d’autres plus connues, avec une forte interaction entre la scène et le public. À l\'occasion de la Fête de la Musique le 21 juin, VOYAGE, le concert Interactif, se transforme en un voyage itinérant. Gabriele vous propose de partir d\'un point A et de marquer plusieurs étapes pour arriver au point final. Tout au long du parcours, vous', ""L'événement Musique du monde a lieu au Placette Louis Loucheur (angle Louis Loucheur/boulevard Bessière) dans la ville de Paris. Date : le 21/06/2026 (juin 2026) de 18h00 à 23h45. Description : 18h à 20h : danse africaine 20h à 22h : musique Maroc / Tunisie / Algérie / Kabyles / raï 22h à 23h : autres"", ""L'événement Culture Rapide a lieu au Place Fréhel 75020 dans la ville de Paris. Date : le 21/06/2026 (juin 2026) de 08h30 à 23h59. Description : Que de la bonne musique live et du spoken word"", ""L'événement La Fanfare Clandestine fête la musique place de l'Odéon a lieu au 2 Place de l'odéon 75006 Paris dans la ville de Paris. Date : le 21/06/2026 (juin 2026) de 16h30 à 19h30. Description : Venez vibrer au son des cuivres et des percussions ! Dans un répertoire varié mêlant blues, jazz, funk, pop, rock, musiques de films et plus encore !"", ""L'événement PAAFclash2.0 a lieu au 5 rue Jean Poulmarch, 75010 Paris dans la ville de Paris. Dates : le 21/06/2026 (juin 2026) ; le 22/06/2026 (juin 2026). Description : Nous organisons un concert de musique électronique, une soirée rythmée et immersive dédiée au son et à l’énergie du live."", 'L\'événement L\'Unité d\'archéologie de Saint-Denis s\'invite place de la Bastille ! a lieu au Village de l\'archéologie dans la ville de Paris. Dates : le 13/06/2026 (juin 2026) ; le 14/06/2026 (juin 2026). Description : Du samedi 13 juin au dimanche 15 juin , venez rencontrer et échanger avec les archéologues de l\'Unité d\'archéologie de Saint-Denis, et participer aux ateleirs proposés : reconstitution de la rosace nord de la basilique, présentation de copies d\'objets archéologiques.. et d\'autres activités ""made Saint-Denis"" !', ""L'événement Live Music & Dj Set 2k26 a lieu au Place de Thorigny dans la ville de Paris. Dates : le 21/06/2026 (juin 2026) ; le 22/06/2026 (juin 2026). Description : En collaboration avec @Petite Place À l’occasion de la Fête de la Musique, nous t’invitons à un concert 💯% gratuit pour découvrir 🔥JORDVN RAY & THE BOYZZ🔥 et danser au rythme AFRO, FUNK, RNB mais aussi de la MUSICA LATINA 💃🕺 Pour cette édition, nous avons l’honneur d’accueillir GIGI et DJ Dusta 🔥 Au programme du jour : - deux sets du grand DJ Dusta 🎧 - deux sets du live band 🥁🎸🎹🎤 - un set de clôture de l’incroyable GIGI 🪩 Alors nous t’attendons à la #FDLM2k26 le : 🗓️ DIMANCHE 21 JUIN 🕕 à partir de 18h 📍PLACE DE THORIGNY, PARIS 3 #fdlm26 #jordvnrayandtheboyzz #fdlm2k26 https://www.instagram.com/p/DZSzmBQou-b/""]","Voici 2 événements :

1. **MF Room** | 21/06/2026 de 14h00 à 21h00 | Place de la Bastille, Paris | Découvrez un concert où l’électronique live, de l’ambient à la techno, rencontre la puissance des instruments acoustiques – saxophone, guitare et synthétiseurs analogiques, conçus maison. Porté par un sound system haut de gamme, ce voyage sonore vous plonge dans une immersion où chaque fréquence, chaque nuance, est restituée avec une précision envoûtante.

2. **VOYAGE le concert interactif** | 21/06/2026 de 15h30 à 16h00 | Place de la Bastille, Paris | Spectacle musical et visuel d’une durée de 1 heure et 15 minutes, conçu par l’artiste Gabriele pour offrir au public une expérience immersive et participative. Le répertoire mêle le français et l’italien dans 12 chansons originales et d’autres plus connues, avec une forte interaction entre la scène et le public.","""Perreo En Seine"" a lieu à Paris le 21 juin 2026.",0.9523809523809523,0.0,0.20851755173628994
Quand se tient l'exposition d'arts plastiques d'artistes méditerranéens à Paris ?,"[""L'événement Exposition d’arts plastiques d’artistes méditerranéens a lieu au Cité internationale universitaire de Paris dans la ville de Paris. Événement récurrent : 16 occurrences du 16/10/2026 au 31/10/2026. Mois concernés : octobre 2026. Description : Plusieurs artistes méditerranéens présentent leurs créations à la Cité internationale universitaire de Paris. Des propositions qui permettent de repenser les territoires de la Méditerranée à partir des perspectives artistiques de jeunes créateurs. A la maison de la Tunisie, la maison du Maroc et la Fondation Lucien Paye."", ""avec les sociétés qui les pratiquent et les idéologies qu’elles véhiculent. L'exposition s'accompagne d’une programmation culturelle et de médiation foisonnante, inaugurée le 4 juillet 2026 par une grande parade placée sous la direction artistique de Mohamed Bourouissa."", ""L'événement Penser la Méditerranée avec les jeunesses méditerranéennes d’aujourd’hui a lieu au Cité internationale universitaire de Paris dans la ville de Paris. Date : le 17/10/2026 (octobre 2026) de 10h00 à 17h00. Description : Parcours de lectures en différentes langues au sein de différents espaces de la Cité internationale (Maisons : Maroc, Egypte, Tunisie, Lucien Paye, Liban, Italie, Portugal et Théâtre de la Cité internationale) ; Concours de poésie, littérature ou essai ; Ateliers de calligraphie ; Exposition collective avec des peintres et photographes des différents pays de la Méditerranée; Soirées avec des musiques de différents pays."", 'Une occasion originale de croiser regard artistique et réflexion citoyenne. Les visiteurs pourront également profiter de médiations flash proposées par l’équipe de médiatrices pour découvrir les coulisses du travail de l’artiste et approfondir leur lecture des œuvres. Dernière occasion de visiter l’exposition avant sa fermeture le 20 septembre.', ""Exposition visible aux horaires d'ouverture de la Mairie du 10ème arr. de Paris : lundi au vendredi, de 8 H 30 à 17 H 00 (nocturne jusqu'à 19 H 30 le jeudi) et samedi matin de 9 H 00 à 12 H 30. Entrée libre et gratuite. Vernissage 26 novembre à 18 H 00 (entrée libre)."", ""L'événement Menart Fair 2026 a lieu au Galerie Joseph dans la ville de Paris. Dates : le 23/10/2026 (octobre 2026) ; le 24/10/2026 (octobre 2026) ; le 25/10/2026 (octobre 2026). Description : Labellisée « Saison Méditerranée » et placée sous le patronage du Ministère de la Culture, Menart Fair est aujourd’hui l’unique foire d’art en Europe consacrée aux scènes artistiques du Moyen-Orient, d’Afrique du Nord et de leurs diasporas. Le Project Room 2026 est dédié à la scène contemporaine algérienne sous le commissariat de Wassyla Tamzali avec une selection d'une dizainne d'artistes. Cette édition réunira également plus d’une trentaine de galeries internationales avec la participation d'une centaine d'artistes venus faire dialoguer leurs regards avec le public parisien. Le thème de cette année,"", ""L'événement Exposition d'oeuvres d'artistes coréens a lieu au Église luthérienne de Bon-Secours dans la ville de Paris. Dates : le 19/09/2026 (septembre 2026) ; le 20/09/2026 (septembre 2026). Description : Exposition d'oeuvres réalisées par des artistes coréens de l'église coréenne presbytérienne de Paris. Venez découvrir une sélection exclusive d'œuvres d'art créées par des artistes coréens au cœur de ce lieu historique. Nos guides seront à votre disposition pour vous accompagner tout au long de l'exposition. Une belle opportunité de célébrer l'échange culturel et la création artistique dans un espace d'exception."", ""L'événement Salon Fine Arts Paris a lieu au Le Grand Palais dans la ville de Paris. Dates : le 19/09/2026 (septembre 2026) ; le 20/09/2026 (septembre 2026). Description : Les chefs-d’œuvre de l’Antiquité à nos jours s’exposent sous l’imposante verrière du Grand Palais, au salon Fine Arts Paris. Retrouvez, dans la plus emblématique nef de la capitale, une centaine de galeries prestigieuses, françaises et internationales, mais aussi en avant-première la présentation de quelques œuvres majeures du futur Musée du Grand Siècle, invité d'honneur de l'édition 2026 de la foire. Dans le cadre des Journées européennes du Patrimoine, Fine Arts Paris ouvre ses portes gratuitement les 19 et 20 septembre 2026 aux 200 premiers inscrits via le lien de réservation ci-après. Bonne visite !"", 'et de la banlieue parisienne pour Rayane Mcirdi. Par-delà les différentes cultures, les deux expositions tendront vers la transmission d’une histoire universelle.', ""L'événement Exposition des travaux des élèves des lycées professionnels et des écoles d’art de l’académie de Paris a lieu au La Sorbonne dans la ville de Paris. Dates : le 19/09/2026 (septembre 2026) ; le 20/09/2026 (septembre 2026). Description : L’académie de Paris compte plusieurs lycées professionnels et écoles d’arts, spécialisés dans les métiers de la mode et de l’élégance, des arts décoratifs, de la photographie et de l’image, du design, du bois… offrant un riche catalogue de formations exigeantes, de la plumasserie à la chaudronnerie en passant par l’ébénisterie, la maroquinerie, la bijouterie, la verrerie, etc. Il s’agit notamment du lycée des métiers Lucas de Nehou (5e et 14e), de l’INJS (Institut national des jeunes sourds de Paris, 5e), du lycée des métiers Marie Laurencin"", ""L'événement Penser la Méditerranée avec les jeunesses méditerranéennes d’aujourd’hui a lieu au Cité internationale universitaire de Paris dans la ville de Paris. Dates : le 16/10/2026 (octobre 2026) ; le 16/10/2026 (octobre 2026). Description : Colloque avec des jeunes chercheurs et des résidents de la Cité internationale sur « Jeunesses, mobilité et migration » ; interventions en différentes langues de la Méditerranée, en particulier en arabe. Les participants abordent les thématiques suivantes, en lien avec la Méditerranée : Mémoire, patrimoine et matrimoine ; Environnement et durabilité ; Jeunesses et mobilité ; IA : emploi et création. De 9h à 13h à la Maison du Maroc De 14h30 à 18h à la Fondation Lucien Paye"", ""L'événement BMW ART MAKERS 2026 - Exposition « Le corps vitré » - Paris Photo a lieu au Le Grand Palais dans la ville de Paris. Dates : le 12/11/2026 (novembre 2026) ; le 13/11/2026 (novembre 2026) ; le 14/11/2026 (novembre 2026) ; le 15/11/2026 (novembre 2026). Description : Mécène des arts depuis plus de 50 ans, BMW Group France affirme un engagement constant en faveur de la création artistique. À travers son programme BMW ART MAKERS et ses partenariats avec des rendez-vous majeurs tels que Les Rencontres Internationales de la Photographie d’Arles, Paris Photo ou encore Art Basel Paris, BMW soutient activement l’innovation et les talents contemporains dans le champ des arts visuels. Cet engagement se prolonge naturellement dans le 7ᵉ art en tant que partenaire officiel du Festival de""]","Voici 1 événement :

1. **Exposition d’arts plastiques d’artistes méditerranéens** | **Du 16/10/2026 au 31/10/2026** (16 occurrences) | **Cité internationale universitaire de Paris, Paris** | Plusieurs artistes méditerranéens présentent leurs créations à la Maison de la Tunisie, la Maison du Maroc et la Fondation Lucien Paye. Des œuvres qui repensent les territoires de la Méditerranée à travers les perspectives de jeunes créateurs.","L'exposition d'arts plastiques d'artistes méditerranéens a lieu à la Cité internationale universitaire de Paris, du 16 au 31 octobre 2026.",0.9,1.0,0.5346529465809007
Où se déroule la Grande soirée irlandaise avec Bouzouki Craic le 21 juin 2026 ?,"[""L'événement Grande soirée irlandaise avec Bouzouki Craic, Saltaire et Bronagh Gallagher a lieu au Centre Culturel Irlandais dans la ville de Paris. Date : le 21/06/2026 (juin 2026) de 18h00 à 22h00. Description : Depuis plus de dix ans maintenant, la Fête de la Musique du Centre Culturel Irlandais rassemble dans la cour plusieurs milliers de personnes dans une atmosphère des plus chaleureuses et festives. Cette année ne fera pas exception : nous accueillerons trois groupes et artistes, traduisant à nouveau la vitalité et la grande richesse du paysage musical irlandais. Comme l’an passé, cette édition mettra un accent particulier sur les musiques traditionnelles avec le projet musical Bouzouki Craic (présenté en association avec le Centre Culturel Hellénique et Chypre Culture), puis le trio"", ""Hellénique et Chypre Culture), puis le trio folk-trad Saltaire, accompagné de Eoghan Ó Ceannabháin et Laura Jo. La soirée se terminera avec l’irrésistible actrice et chanteuse soul Bronagh Gallagher, qualifiée de « joyau » par Dave Stewart, et « talent à l’état pur » pour Brian Eno. Oscillant entre force, audace et sensibilité, attendez-vous à une nouvelle soirée inoubliable ! Bouzouki Craic (musique trad-world) Bouzouki Craic fait dialoguer les riches traditions irlandaise, grecque et chypriote dans une rencontre musicale inédite spécialement imaginée pour ouvrir cette Fête de la Musique 2026. Instrument grec intégré à la musique traditionnelle irlandaise dans les années 1970, le bouzouki sera au cœur d'une courte résidence initiée par le CCI - en association avec nos amis et collègues"", ""L'événement Medley acoustique et scène ouverte a lieu au École de Rouilly dans la ville de Rouilly. Date : le 21/06/2026 (juin 2026) de 19h00 à 23h00. Description : 19h - Concert acoustique, pop, musique irlandaise, etc... 20h - Scène ouverte : venez jouer avec nous, nous faire chanter, danser 21h - Carnets de chants : Prenez vos carnets et chantons ensemble Buffet partagé façon auberge espagnole : apportez vos plats, découvrez ceux des autres."", ""L'événement Musique du monde a lieu au Placette Louis Loucheur (angle Louis Loucheur/boulevard Bessière) dans la ville de Paris. Date : le 21/06/2026 (juin 2026) de 18h00 à 23h45. Description : 18h à 20h : danse africaine 20h à 22h : musique Maroc / Tunisie / Algérie / Kabyles / raï 22h à 23h : autres"", ""L'événement Le 21 Juin à Juziers a lieu au Maison Pour Tous, 115 avenue de paris - Juziers dans la ville de Juziers. Date : le 21/06/2026 (juin 2026) de 16h00 à 22h00. Description : Concerts, animations et restauration La Ville de Juziers vous donne rendez-vous pour la fête de la musique le dimanche 21 juin de 16h à 22h, dans le jardin de la Maison Pour Tous. Au programme : • Concert proposé par nos candidats amateurs • Animations prévues sur place • Possibilité de se restaurer sur place avec Happy Truck : burgers et gourmandises sucrées pour le goûter et le dîner Retrouvez le programme détaillé de la soirée prochainement sur www.juziers.fr"", ""L'événement Du (Très) Bon Rock en plein air ! a lieu au Les insouciants, 116 boulevard saint germain 75006 Paris dans la ville de Paris. Date : le 21/06/2026 (juin 2026) de 17h00 à 23h55. Description : Du (Très) Bon Rock en plein air ! Nous sommes Ira Mundi - Retrouvez nous pour vibrer au son de tubes Pop Rock planétaires : ### Beatles, Kinks, Rolling Stones, Led Zep, AC/DC, U2, Nirvana, Oasis, Radiohead, The Hives, Arctic Monkeys, Jack White, Kings of Leon, Muse ... dans le style original ou en prenant parfois quelques libertés ... Nous espérons que vous aimerez le shOw et chanterez avec nous jusqu'à la tombée de la nuit ! Nouveauté 2026 : nous accueillons dans notre voyage musical une nouvelle recrue : Valentine ! Fifi (Chant), Valentine (Chant)(New!!) , Pej (Batterie), Joe (Guitare),"", ""L'événement Fiddler On The Seine a lieu au Fontaine, rue du pot de fer, Paris 75005 dans la ville de Paris. Date : le 21/06/2026 (juin 2026) de 20h00 à 21h00. Description : Fiddler (violiniste) qui joue de la musique traditionnelle irlandaise"", ""L'événement Faites de la musique a lieu au Rue Julien Lacroix dans la ville de Paris. Date : le 21/06/2026 (juin 2026) de 14h30 à 19h00. Description : Prêt pour une immersion totale dans les racines de la culture club ? Le collectif « Faites de la musique » s’empare des platines pour une traversée sonore sans frontières. Oubliez les sets linéaires. L'événement est conçu comme un voyage chronologique et géographique : L’héritage US : Une sélection pointue de House originelle, entre les rythmes bruts de Chicago, la profondeur de Detroit et l'énergie vocale de New York. La touche brésilienne : Une transition vers des sonorités plus organiques et percussives, mêlant chaleur latine et rythmique électronique moderne. Ce qui vous attend : Un flux continu de pépites chinées par des passionnés, une"", ""L'événement La Bohme Dergisi a lieu au Bohème Café Coworking dans la ville de Drancy. Date : le 21/06/2026 (juin 2026) de 19h30 à 23h59. Description : Venez célébrer la Fête de la Musique dans une ambiance chaleureuse, festive et ouverte à toutes les cultures 🎶 Organisée par La Bohème Dergisi Derneği, cette soirée sera un véritable voyage musical entre les langues, les styles et les émotions. Des chansons populaires aux musiques du monde, des classiques aux sons modernes, chaque voix et chaque univers auront leur place. Au programme : musique live, rencontres, partage, chants, danse et bonne humeur dans un esprit convivial et inclusif. Que vous soyez passionné de musique, curieux de découvrir de nouveaux sons ou simplement à la recherche d’une belle soirée d’été, cette célébration est"", ""L'événement Mazurcade musiques traditionnelles a lieu au Parc Montsouris 75014 Paris dans la ville de Paris. Date : le 21/06/2026 (juin 2026) de 16h00 à 19h00. Description : Le groupe Mazurcade joue de la musique issue de divers terroirs et animes des manifestations festives: bals, soirées, apéritifs conserts..."", ""L'événement Marilou Fête la Musique a lieu au Marilou dans la ville de Paris. Date : le 21/06/2026 (juin 2026) de 14h00 à 19h30. Description : CONCERT X JAM SESSION AU MARILOU - FÊTE DE LA MUSIQUE"", ""L'événement Concert du 21 juin à 16h en ouverture de la Fête de la Musique a lieu au 2 Place Saint-Symphorien, 78000 Versailles, France dans la ville de Versailles. Dates : le 19/06/2026 (juin 2026) ; le 21/06/2026 (juin 2026). Description : La grande messe en ut de Mozart et quelques choeurs du Messie de Haendel""]","Voici 1 événement :

1. **Grande soirée irlandaise avec Bouzouki Craic, Saltaire et Bronagh Gallagher** | 21/06/2026 de 18h00 à 22h00 | **Centre Culturel Irlandais, Paris** | Depuis plus de dix ans, la Fête de la Musique du Centre Culturel Irlandais rassemble plusieurs milliers de personnes pour une soirée festive avec des groupes et artistes irlandais, dont Bouzouki Craic, Saltaire et Bronagh Gallagher.","La Grande soirée irlandaise avec Bouzouki Craic, Saltaire et Bronagh Gallagher a lieu au Centre Culturel Irlandais à Paris, le 21 juin 2026 de 18h à 22h.",1.0,1.0,0.7762583285504342
Quand a lieu l'événement ARCAL à Bazoches-sur-Guyonne ?,"[""L'événement ARCAL a lieu au Maison Jean Monnet dans la ville de Bazoches-sur-Guyonne. Date : le 22/08/2026 (août 2026) de 15h00 à 17h00. Description : Cette année, le programme culturel de la Maison Jean Monnet vous invite à explorer l’Europe à travers ses différentes cultures musicales. De l’Ecosse à l’Andalousie, de l’opéra aux grands compositeurs comme Mozart et Beethoven, ces rencontres artistiques célèbrent la diversité et les échanges, révélant la richesse des traditions et des innovations qui animent l’Europe d’hier et d’aujourd’hui. Venez découvrir ces créations puisant dans les différentes couleurs musicales du patrimoine commun européen"", ""L'événement Animation nature et découverte dans le parc de la Maison Jean Monnet a lieu au Maison Jean Monnet dans la ville de Bazoches-sur-Guyonne. Dates : le 19/09/2026 (septembre 2026) ; le 20/09/2026 (septembre 2026). Description : L’association Paradeisos – Jardins européens proposera des animations (atelier ou conférence) autour de la chaumière, dépendances, terrasses, jardins et parc arboré. Dans un lieu inspirant, lové dans son écrin de nature champêtre francilienne, sera partagé le travail associatif réalisé ces dernières années : « Jardin citoyen européen », ateliers d’histoire participative, recréation du parterre des rosiers de la Maison Monnet."", ""L'événement Le Cercle de l'Harmonie a lieu au Maison Jean Monnet dans la ville de Bazoches-sur-Guyonne. Date : le 08/08/2026 (août 2026) de 15h00 à 17h00. Description : le Cercle de l'Harmonie (direction Jérémie Rohrer), en petite formation propose un programme pour Clarinette & Cordes : un voyage à la recherche du répertoire encore méconnu du trio à cordes avec clarinette. Les pièces de cette formation ont largement contribué à l'évolution de la technique et de l'expressivité de la clarinette. S'essayant à l’art de la composition et de l’arrangement pour ce nouveau quatuor, faisant de la clarinette le protagoniste, des compositeurs donnèrent vie à des pièces originales. Le Quatuor avec clarinette du Cercle de l’Harmonie propose, sur instruments d’époque, un voyage musical dans ce format"", ""L'événement O'Bangor's Bangers a lieu au Maison Jean Monnet dans la ville de Bazoches-sur-Guyonne. Date : le 15/08/2026 (août 2026) de 15h00 à 17h00. Description : Cette année, le programme culturel de la Maison Jean Monnet vous invite à explorer l’Europe à travers ses différentes cultures musicales. De l’Ecosse à l’Andalousie, de l’opéra aux grands compositeurs comme Mozart et Beethoven, ces rencontres artistiques célèbrent la diversité et les échanges, révélant la richesse des traditions et des innovations qui animent l’Europe d’hier et d’aujourd’hui. Venez découvrir ces créations puisant dans les différentes couleurs musicales du patrimoine commun européen"", ""L'événement La Tempesta a lieu au Maison Jean Monnet dans la ville de Bazoches-sur-Guyonne. Date : le 01/08/2026 (août 2026) de 15h00 à 17h00. Description : La Tempesta propose un magnifique programme de quatuor à cordes. L’année 1806 est une année importante dans l’histoire du quatuor à cordes. C’est l’année pendant laquelle Beethoven compose ses trois quatuors « Razoumovsky » opus 59. Mais cette année voit aussi la composition des trois quatuors du bohémien Jan Ladislav Dussek, et plusieurs œuvres pour quatuor de son compatriote Anton Reicha, dont une très originale Fantaisie « La Pantomime ». Ce programme réunit ces trois compositeurs dont la musique illustre l’évolution de style classique vers le romantisme. Il ouvre donc l'horizon vers l'Europe centrale."", 'd’époque, un voyage musical dans ce format unique autour du célèbre Mozart avec une œuvre rarement donnée du finnois Bernhard Crusell']","Voici 1 événement :

1. **ARCAL** | 22/08/2026 de 15h00 à 17h00 | Maison Jean Monnet, Bazoches-sur-Guyonne | Cette année, le programme culturel de la Maison Jean Monnet vous invite à explorer l’Europe à travers ses différentes cultures musicales. De l’Ecosse à l’Andalousie, de l’opéra aux grands compositeurs comme Mozart et Beethoven, ces rencontres artistiques célèbrent la diversité et les échanges, révélant la richesse des traditions et des innovations qui animent l’Europe d’hier et d’aujourd’hui.","ARCAL a lieu à la Maison Jean Monnet à Bazoches-sur-Guyonne, le 22 août 2026 de 15h à 17h.",0.9285714285714286,1.0,0.5307609918698692
"Où se déroule le spectacle ""Terre natale"" de Daniel Kleene le 28 juin 2026 ?","['L\'événement = REPORTÉ = ""Terre natale"" - Daniel Kleene a lieu au Chez Jocelyne et Jean-Luc au 321 rue des moulins 77160 Chalautre la petite dans la ville de Chalautre-la-Petite. Date : le 28/06/2026 (juin 2026) de 19h30 à 20h30. Description : == REPORTÉ À LA SAISON 26/27 POUR RAISONS CLIMATIQUES == Nous sommes quelque part, dans un endroit, dans un monde que nous connaissons. Mais comment grandir quand le travail commence à trembler et que les silences deviennent écrasants ? Sur la toile de fond d\'une crise qui s\'annonce, celle du travail et des conditions de vie se déploie l\'histoire d\'une famille ordinaire. Un adolescent y formule ses premières questions face à un futur fragile. Mise en scène : Pascal Antonini avec : Damien Labridy, Eva Dellac, Marie Aubert, Sylvie Chapotot Thierry', ""L'événement Je me souviens de la terre a lieu au Théâtre de la Concorde dans la ville de Paris. Événement récurrent : 25 occurrences du 22/05/2026 au 27/06/2026. Mois concernés : juin 2026, mai 2026. Description : Entre colères, hésitations, désaccords et élans de solidarité, la pièce explore les tensions qui traversent toute tentative d’action collective. Des habitants, inquiets des projets qui menacent leur cadre de vie naturel, décident d’agir. Victimes de violences au cours d’une manifestation, ils font face au dilemme de l’engagement : continuer ou pas ? Je me souviens de la terre est une pièce inquiète de notre temps puisque désormais, même en démocratie, l’indignation et la contestation publiques peuvent se payer au prix élevé de la répression. L’histoire est racontée par les"", 'L\'événement Archéo-color a lieu au Fabrique de la ville dans la ville de Saint-Denis. Date : le 13/06/2026 (juin 2026) de 16h00 à 16h30. Description : Dans le cadre des Journées Européennes de l’Archéologie, l\'association Déchets d\'arts et l\'Unité d\'archéologie de la ville de Saint-Denis vous invitent à une représentation publique d’environ trente minutes autour du thème de l’eau. Ce spectacle vivant, issu des différentes étapes du projet, mêlera performance, scénographie textile et présence corporelle dans les échafaudages de la ""maison-échafaudage"". Pensée comme une expérience sensible et immersive, cette restitution invitera les spectateur·rices à découvrir une interprétation poétique et collective des transformations du paysage et des enjeux liés à l’eau.', ""L'événement D'amour ou d'amitié a lieu au Sept Lieux dans la ville de Versailles. Date : le 03/06/2026 (juin 2026) de 21h00 à 22h00. Description : Investies d’une mission émanant de la star elle-même (si si !), Alice et Camille vont retracer le parcours de la grande Céline. Après avoir épluché tout son concert de 1995 au Zénith de Paris, et toutes ses interviews ; après avoir écumé internet pour copier ses tenues les plus emblématiques; après avoir chanté tout l’album D’Eux dans tous les karaokés, elles vont donner le meilleur d’elles-mêmes (c’est beaucoup) pour balayer la carrière de la star. De là naît un spectacle tout de bric et de broc, mêlant interviews, playbacks, tubes incontournables, et à grands renforts de perruques et de paillettes. Si vous avez déjà chanté dans votre brosse à"", ""L'événement Journée portes ouvertes a lieu au Territoires - Maison de  l'Écologie dans la ville de Saint-Denis. Date : le 06/06/2026 (juin 2026) de 09h00 à 16h00. Description : L’Association Territoires, basée à Saint-Denis, agit en faveur de l’inclusion et de la transition écologique. Avec son dispositif d’inclusion économique et social, sa ferme bio et la Maison de l’Écologie, elle agit chaque jour en faveur de l’économie solidaire et sociale. Pionnière de l’Agriculture Biologique en Ile-de-France, l’association Territoires n’a cessé de développer un modèle économique inclusif et vertueux, conjuguant emploi, agriculture, alimentation durable, biodiversité et solidarité. Depuis quelques années, les 48h de l’agriculture urbaine sont devenus un événement incontournable de l’association. A"", ""L'événement Jeunes Talents célèbre la musique a lieu au Archives nationales de France dans la ville de Paris. Date : le 21/06/2026 (juin 2026) de 14h30 à 18h30. Description : Célébrez la musique dans un écrin de verdure historique au coeur de Paris lors de cet évènement gratuit et en plein air. Rencontrez la nouvelle promotion des grands artistes de la musique classique de demain séléctionnés lors des auditions 2026. Du piano, du chant, de la guitare et bien d'autres instruments vous attendent pour ce jour spécial."", ""à la diffusion : Mation Detienne - On track by le Train Bleu : marion.detienne@theatredutrainbleu.fr Accompagnement à la production : Alexandre Slyper - Tapioca : alexandre@tapiocaetmoi.com Calendrier de création 2026/2027 : - Résidence du 15 au 28 juin 2026 : CENTQUATRE - Paris - Résidence du 14 au 18 septembre 2026 : Théâtre de Vanves - Résidence du 8 au 15 novembre 2026 : Maison d’Elsa - scène conventionnée - Jarny, Grand-Est. - Résidence du 14 au 18 décembre 2026 : Théâtre Jacques Carat - Cachan - Résidence du 4 au 17 janvier 2027 : Nouveau Théâtre de l'Atalante - Paris Exploitation saison 2026/2027 : Création au Nouveau Théâtre de l’Atalante : du 18 au 31 janvier 2027 - 10 dates Semaine du 2 février 2027 : Théâtre Marcelin Berthelot - Montreuil : 1 date Semaine du 9 au 11 mars 2027 :"", ""L'événement Concert spatialisé a lieu au Cité des sciences et de l'Industrie dans la ville de Paris. Dates : le 19/06/2026 (juin 2026) ; le 19/06/2026 (juin 2026) ; le 19/06/2026 (juin 2026). Description : Distribution : Modulor Music / label: TD47 À l’occasion des Éclatantes, elle s’associe au musicien Julien Maillard pour spatialiser ce concert au planétarium et créer une immersion totale, visuelle et sonore. Son premier album paraîtra cette année, précédé de plusieurs singles à l’été 2026. 3 séances à 21h, 22h et 23h"", ""L'événement Célébrons ensemble le solstice d’été en Pleine Conscience ! a lieu au 36 Av. de la Belle Gabrielle, 94130 Nogent-sur-Marne, France dans la ville de Nogent-sur-Marne. Date : le 21/06/2026 (juin 2026) de 12h00 à 14h00. Description : Bonjour ! C'est bientôt l'été ! À l’occasion du solstice d’été, je vous invite à un atelier d'exploration méditative en plein air : méditations guidées, mouvements, marche, et écoute de la nature. Un espace pour s’ouvrir, ressentir, et célébrer ensemble la lumière de l’été. Ouvert à tous - Participation libre Je serai ravie de vous rencontrer et partager l'expérience ensemble. Avec grande joie, Hiroko. Durée : 2h00 Activité organisée par Hiroko - Instructrice de méditation en pleine conscience Infos et réservation sur EcoNature :"", ""L'événement By the waters a lieu au Maison d'éducation de la Légion d'honneur dans la ville de Saint-Denis. Dates : le 06/06/2026 (juin 2026) ; le 06/06/2026 (juin 2026). Description : Un voyage au fil de l’eau. Entre ciel et mer, ce programme, spécialement adapté pour les tout-petits, fait dialoguer des traditions venues d’horizons variés : chants populaires, pages du répertoire classique et créations contemporaines aux sonorités audacieuses. Issus du Conservatoire à Rayonnement Régional de Paris, les quatre jeunes solistes qui forment l’ensemble Æsthesis travaillent par associations et correspondances. Ils composent ainsi un programme découlant de leurs sensibilités qui résonne avec celles du public d’aujourd’hui. Pas de limites de genre, de style ou d’époque, le décloisonnement des"", ""L'événement Spectacle de contes spécial héroïnes a lieu au Cité des sciences et de l'Industrie dans la ville de Paris. Dates : le 27/06/2026 (juin 2026) ; le 01/07/2026 (juillet 2026) ; le 04/07/2026 (juillet 2026). Description : Venez découvrir un spectacle vibrant où des héroïnes singulières, venues des quatre coins du monde, prennent vie à travers des récits merveilleux et surprenants. Avec Isabelle Sauer. À découvrir en famille ! À partir de 3 ans."", ""L'événement Cultures matérielles, cultures immatérielles, de l’importance des lieux. Enraciner les mémoires aujourd’hui a lieu au Théâtre municipal de Fontainebleau - salle de spectacle dans la ville de Fontainebleau. Date : le 05/06/2026 (juin 2026) de 12h00 à 13h00. Description : Comment préserver des lieux d’ancrage matériels, sans la communauté qui porte ces cultures ou ces savoir-faire et leur patrimoine ? Comment éviter la captation par une poignée d’individus pour préférer s’attacher à favoriser des actions communautaires, complexes et difficiles ? Comment favoriser dans un moment de grande transformation, de petits lieux abandonnés ou des monuments emblématiques (greniers, oratoires, zawyas, synagogues, qsurs...), en s’attachant aux vivants ? Comment préserver et enraciner les""]","Voici 1 événement :

1. **= REPORTÉ = ""Terre natale"" - Daniel Kleene** | 28/06/2026 de 19h30 à 20h30 | Chez Jocelyne et Jean-Luc au 321 rue des moulins, 77160 Chalautre-la-Petite | == REPORTÉ À LA SAISON 26/27 POUR RAISONS CLIMATIQUES == Spectacle explorant l'histoire d'une famille ordinaire face à une crise sociale et économique, avec un adolescent questionnant son avenir. Mise en scène : Pascal Antonini.","""Terre natale"" de Daniel Kleene a lieu à Chalautre-la-Petite, le 28 juin 2026 (événement reporté).",0.8888888888888888,1.0,0.5051176495842162
"Quand a lieu le ""Spectacle de contes spécial héroïnes"" à Paris en juin et juillet 2026 ?","[""L'événement Spectacle de contes spécial héroïnes a lieu au Cité des sciences et de l'Industrie dans la ville de Paris. Dates : le 27/06/2026 (juin 2026) ; le 01/07/2026 (juillet 2026) ; le 04/07/2026 (juillet 2026). Description : Venez découvrir un spectacle vibrant où des héroïnes singulières, venues des quatre coins du monde, prennent vie à travers des récits merveilleux et surprenants. Avec Isabelle Sauer. À découvrir en famille ! À partir de 3 ans."", ""L'événement Qu’est-ce qu’un héros\u202f? a lieu au Cité des sciences et de l'Industrie dans la ville de Paris. Date : le 20/06/2026 (juin 2026) de 14h30 à 16h00. Description : Atelier philo-créatif. Une initiation à la philosophie à travers la figure du héros et réalisation d’un autoportrait de super-héros dans une partie plus créative. À partir de 6 ans."", ""L'événement Partir en livre a lieu au Cité des sciences et de l'Industrie dans la ville de Paris. Dates : le 17/06/2026 (juin 2026) ; le 20/06/2026 (juin 2026) ; le 24/06/2026 (juin 2026) ; le 27/06/2026 (juin 2026) ; le 28/06/2026 (juin 2026) ; le 08/07/2026 (juillet 2026) ; le 10/07/2026 (juillet 2026) ; le 11/07/2026 (juillet 2026) ; le 16/07/2026 (juillet 2026) ; le 19/07/2026 (juillet 2026). Description : Du 17 juin au 19 juillet 2026, à l’occasion de la 12e édition de « Partir en Livre », le festival national du livre pour la jeunesse organisé par le Centre national du livre, la Bibliothèque de la Cité des sciences et de l’industrie vous propose d’explorer l’univers fascinant de « nos petits et grands héros. »"", ""L'événement MES PREMIERS PAS DANS L'INTERMITTENCE a lieu au Agence CINEMA SPECTACLE PARIS dans la ville de Paris. Date : le 23/06/2026 (juin 2026) de 10h00 à 11h30. Description : Bonjour Vous bénéficiez désormais d'une ouverture de droits des annexes 8 & 10 et pour tout comprendre sur ce régime, vous êtes invités à participer à un atelier qui vous expliquera le fonctionnement et vous présentera l'offre de services proposée par France Travail Spectacle en IDF. Au programme : Vos droits décryptés : indemnisation, renouvellement, actualisation On vous explique tout ! Un atelier animé par nos conseillers experts en indemnisation, suivi d'un temps d'échange pour répondre à to"", ""L'événement Cavalières a lieu au Théâtre Paris-Villette dans la ville de Paris. Dates : le 16/06/2026 (juin 2026) ; le 17/06/2026 (juin 2026) ; le 18/06/2026 (juin 2026) ; le 19/06/2026 (juin 2026) ; le 20/06/2026 (juin 2026) ; le 23/06/2026 (juin 2026) ; le 24/06/2026 (juin 2026) ; le 25/06/2026 (juin 2026) ; le 26/06/2026 (juin 2026) ; le 27/06/2026 (juin 2026). Description : CAVALIERES Pour moi commun veut dire tout ce qui n’est ni l’un, ni l’autre. C’est “comme un”mais ce n’est ni l’un, ni l’autre. Tout ce qui peut avoir lieu hors de l’un et de l’autre. Fernand Deligny On est toujours seule face l’écriture. En notant ceci j’entends la voix rauque et ferme de Marguerite Duras parler de cette solitude. Oui on habite seule l’écriture et pourtant “Cavalières” en a décidé autrement. Nous"", ""L'événement Visites Spectacles\xa0: découvrez Paris comme vous ne l’avez jamais vu a lieu au Visites Spectacles dans la ville de Paris. Événement récurrent : 80 occurrences du 28/03/2026 au 27/12/2026. Mois concernés : août 2026, avril 2026, décembre 2026, juillet 2026, juin 2026, mai 2026, mars 2026, novembre 2026, octobre 2026, septembre 2026. Description : Un concept immersif entre théâtre et visite guidée Avec Visites Spectacles, vous ne suivez pas simplement un guide… vous entrez dans une histoire. Des comédiens professionnels, en costume, vous entraînent dans un scénario captivant à travers les rues de Paris. Chaque quartier devient un décor, chaque monument une scène, et chaque visite une véritable aventure. Le résultat ? Une immersion totale où l’on apprend en s’amusant, dans une"", ""L'événement Soeurs (Audrey & Victoria) a lieu au Théâtre de l'Atelier dans la ville de Paris. Dates : le 26/05/2026 (mai 2026) ; le 27/05/2026 (mai 2026) ; le 02/06/2026 (juin 2026) ; le 03/06/2026 (juin 2026) ; le 09/06/2026 (juin 2026) ; le 10/06/2026 (juin 2026) ; le 16/06/2026 (juin 2026) ; le 17/06/2026 (juin 2026). Description : J’ai décidé d’écrire Soeurs ( Marina & Audrey ) en octobre 2017 le lendemain de la première répétition aux Bouffes du Nord de la scène que Marina Hands et Audrey Bonnet ont en commun dans Actrice. Écrire ou mettre en scène c’est répondre à des appels. Là, ni Marina ni Audrey ne me demandent rien. Elles répètent. Mais ce que je vois devant moi est d’une telle force. Les énergies sont tellement complémentaires, que je décide de répondre à ces forces à ces"", ""L'événement Atelier et Jam au Palais de la Femme a lieu au Palais de la Femme dans la ville de Paris. Dates : le 29/03/2026 (mars 2026) ; le 05/04/2026 (avril 2026) ; le 10/05/2026 (mai 2026) ; le 07/06/2026 (juin 2026). Description : Soirée de danse pour tous danseurs avec des performances quelques fois"", ""L'événement Les petites soeurs n'ont pas le droit de souffrir a lieu au Le CENTQUATRE-PARIS dans la ville de Paris. Date : le 26/06/2026 (juin 2026) de 12h30 à 13h30. Description : SORTIE DE RÉSIDENCE - CENTQUATRE Dans les années 1970, trois sœurs vivent isolées dans une forêt au pied d'un plateau calcaire. En haut, un élevage intensif domine ; en bas, la rivière devient le théâtre de morts étranges. Depuis peu, dans la résurgence, on voit apparaître des filaments rouges. Alors que les autorités locales détournent le regard, les sœurs s'engagent malgré elles dans une lutte pour la vérité. Aux côtés d’une vétérinaire et de la fille du maire, elles tissent des liens inattendus dans une quête d’empathie et de compréhension. Cette fable écologique interroge les hiérarchies de l’existence et"", ""L'événement Visite-atelier Mythes et héros a lieu au BnF | Richelieu dans la ville de Paris. Date : le 14/06/2026 (juin 2026) de 14h30 à 16h00. Description : Inspiré par les dieux et héros de l’antiquité grecque, créez votre propre jeu de cartes ! Partez à la rencontre d’Héraclès, Ulysse, Achille, Hermès, Athéna, Dionysos et bien d’autres dans le musée de la BnF. A l’issue de l’atelier, place au jeu et que le meilleur gagne ! En savoir plus"", ""L'événement Contes d'été aux epinettes a lieu au ité Général Henrys dans la ville de Paris. Dates : le 01/07/2026 (juillet 2026) ; le 08/07/2026 (juillet 2026) ; le 15/07/2026 (juillet 2026). Description : Les contes d'été aux Epinettes - Contes aux fenêtres présentent trois spectacles dans le jardin de la cité General Henrys en partenariat avec l'association Chouette Chez Nous Mercredi 1er /07 : François-Moïse Bamba - Les héros au Burkina Faso Mercredi 8/07 : Hervé Péjaudier et Benjamin Bertocchi - Les deux frères coréens Mercredi 15/07 : Isabelle Genlis et Hô Thuy Trang - Le bestiaire bavard"", ""L'événement Les Lapins Trois-Oreilles a lieu au Cité des sciences et de l'Industrie dans la ville de Paris. Événement récurrent : 70 occurrences du 18/01/2026 au 05/07/2026. Mois concernés : avril 2026, février 2026, janvier 2026, juillet 2026, juin 2026, mai 2026, mars 2026. Description : CONTE JEUNESSE - PAS UNE SEANCE D'ASTRONOMIE Dans un royaume, au Moyen-Âge. Pour libérer une princesse du joug tyrannique d’un régent, un jeune garçon devra surmonter l’infernale épreuve des Lapins Trois-Oreilles. Mais la princesse veut-elle vraiment se marier... Ne préfère-t-elle pas danser avec les lapins mélomanes ?""]","Voici 1 événement :

1. **Spectacle de contes spécial héroïnes** | **Dates et horaires** : le 27/06/2026 ; le 01/07/2026 ; le 04/07/2026 | **Lieu et ville** : Cité des sciences et de l'Industrie, Paris | **Description courte** : Venez découvrir un spectacle vibrant où des héroïnes singulières, venues des quatre coins du monde, prennent vie à travers des récits merveilleux et surprenants. Avec Isabelle Sauer. À découvrir en famille ! À partir de 3 ans.","Le ""Spectacle de contes spécial héroïnes"" a lieu à la Cité des sciences et de l'Industrie à Paris, les 27 juin, 1er et 4 juillet 2026.",0.875,1.0,0.737986870957489
"Où se tient la conférence ""Hériter ? Collections photographiques"" à Saint-Denis ?","[""L'événement Hériter ? Collections photographiques (post)coloniales en mondes africains. #3 a lieu au Département Arts plastiques, Université Paris 8 dans la ville de Saint-Denis. Date : le 14/12/2026 (décembre 2026) de 18h00 à 21h00. Description : Cycle de conférences proposé par Christine Barthe (musée du quai Branly – Jacques Chirac), Inès Boufouchk (ECPAD), Annabelle Lacour (musée du quai Branly – Jacques Chirac), Marian Nur Goni (université Paris 8), Aline Pighin (Centre des Archives diplomatiques de La Courneuve) et Anna Seiderer (université Paris 8). #3 -- La date est indicative, le thème de la séance et le nom de l'invité·e seront précisés ultérieurement. Ouvert aux étudiant·es et à tous les publics, le cycle est accueilli par le département Arts plastiques de l'université Paris 8."", ""L'événement Hériter ? Collections photographiques (post)coloniales en mondes africains. #6 a lieu au Département Arts plastiques, Université Paris 8 dans la ville de Saint-Denis. Date : le 22/03/2027 (mars 2027) de 18h00 à 21h00. Description : Cycle de conférences proposé par Christine Barthe (musée du quai Branly – Jacques Chirac), Inès Boufouchk (ECPAD), Annabelle Lacour (musée du quai Branly – Jacques Chirac), Marian Nur Goni (université Paris 8), Aline Pighin (Centre des Archives diplomatiques de La Courneuve) et Anna Seiderer (université Paris 8). #6 -- La date est indicative, le thème de la séance et le nom de l'invité·e seront précisés ultérieurement. Ouvert aux étudiant·es et à tous les publics, le cycle est accueilli par le département Arts plastiques de l'université Paris 8."", ""L'événement Hériter ? Collections photographiques (post)coloniales en mondes africains. #2 a lieu au Département Arts plastiques, Université Paris 8 dans la ville de Saint-Denis. Date : le 23/11/2026 (novembre 2026) de 18h00 à 21h00. Description : Cycle de conférences proposé par Christine Barthe (musée du quai Branly – Jacques Chirac), Inès Boufouchk (ECPAD), Annabelle Lacour (musée du quai Branly – Jacques Chirac), Marian Nur Goni (université Paris 8), Aline Pighin (Centre des Archives diplomatiques de La Courneuve) et Anna Seiderer (université Paris 8). #2 -- La date est indicative, le thème de la séance et le nom de l'invité·e seront précisés ultérieurement. Ouvert aux étudiant·es et à tous les publics, le cycle est accueilli par le département Arts plastiques de l'université Paris 8."", ""L'événement Hériter ? Collections photographiques (post)coloniales en mondes africains. #1 a lieu au Département Arts plastiques, Université Paris 8 dans la ville de Saint-Denis. Date : le 26/10/2026 (octobre 2026) de 18h00 à 21h00. Description : Cycle de conférences proposé par Christine Barthe (musée du quai Branly – Jacques Chirac), Inès Boufouchk (ECPAD), Annabelle Lacour (musée du quai Branly – Jacques Chirac), Marian Nur Goni (université Paris 8), Aline Pighin (Centre des Archives diplomatiques de La Courneuve) et Anna Seiderer (université Paris 8). #1 -- La date est indicative, le thème de la séance et le nom de l'invité·e seront précisés ultérieurement. Ouvert aux étudiant·es et à tous les publics, le cycle est accueilli par le département Arts plastiques de l'université Paris 8."", ""L'événement Hériter ? Collections photographiques (post)coloniales en mondes africains. #5 a lieu au Département Arts plastiques, Université Paris 8 dans la ville de Saint-Denis. Date : le 22/02/2027 (février 2027) de 18h00 à 21h00. Description : Cycle de conférences proposé par Christine Barthe (musée du quai Branly – Jacques Chirac), Inès Boufouchk (ECPAD), Annabelle Lacour (musée du quai Branly – Jacques Chirac), Marian Nur Goni (université Paris 8), Aline Pighin (Centre des Archives diplomatiques de La Courneuve) et Anna Seiderer (université Paris 8). #5 -- La date est indicative, le thème de la séance et le nom de l'invité·e seront précisés ultérieurement. Ouvert aux étudiant·es et à tous les publics, le cycle est accueilli par le département Arts plastiques de l'université Paris 8."", ""L'événement Hériter ? Collections photographiques (post)coloniales en mondes africains. #4 a lieu au Département Arts plastiques, Université Paris 8 dans la ville de Saint-Denis. Date : le 25/01/2027 (janvier 2027) de 18h00 à 21h00. Description : Cycle de conférences proposé par Christine Barthe (musée du quai Branly – Jacques Chirac), Inès Boufouchk (ECPAD), Annabelle Lacour (musée du quai Branly – Jacques Chirac), Marian Nur Goni (université Paris 8), Aline Pighin (Centre des Archives diplomatiques de La Courneuve) et Anna Seiderer (université Paris 8). #4 -- La date est indicative, le thème de la séance et le nom de l'invité·e seront précisés ultérieurement. Ouvert aux étudiant·es et à tous les publics, le cycle est accueilli par le département Arts plastiques de l'université Paris 8."", ""L'événement À la découverte des collections patrimoniales et archéologiques a lieu au Médiathèque du centre-ville de Saint-Denis dans la ville de Saint-Denis. Date : le 19/09/2026 (septembre 2026) de 10h00 à 18h00. Description : À l'occasion des Journées européennes du patrimoine, la médiathèque du Centre-Ville de Saint-Denis (réseau de lecture publique Plaine Commune) et l'Unité d'archéologie de la ville de Saint-Denis vous invitent à découvrir deux collections exceptionnelles qui témoignent de l'histoire du territoire. Tout au long de la journée, des visites commentées des vitrines archéologiques permettront d'observer une sélection d'objets issus des fouilles menées à Saint-Denis et d'en apprendre davantage sur le travail des archéologues, de la découverte des vestiges à leur étude et"", ""L'événement Florilège — Exposition a lieu au Musée d'art et d'histoire Paul Eluard, Saint-Denis dans la ville de Saint-Denis. Événement récurrent : 37 occurrences du 26/04/2027 au 06/06/2027. Mois concernés : avril 2027, juin 2027, mai 2027. Description : Cette exposition donne une forme visible et partageable aux recherches menées au département photographie de Paris 8, en pensant l’exposition comme dispositif critique où images, textes, légendes et récits dialoguent. Cette dimension met en jeu la photographie non seulement comme objet à voir, mais comme champ de lecture, d’interprétation et d’expérimentation, en écho aux nouveaux horizons du couple texte–image ouverts par le bicentenaire. Nous prévoyons plusieurs expositions à Saint-Denis, en collaboration avec le Musée d'Art et"", ""L'événement À la découverte des collections patrimoniales et archéologiques a lieu au Médiathèque du centre-ville dans la ville de Saint-Denis. Date : le 19/09/2026 (septembre 2026) de 10h30 à 17h00. Description : À l'occasion des Journées européennes du patrimoine, la Médiathèque du Centre-Ville de Saint-Denis et l'Unité d'archéologie vous invitent à découvrir deux collections exceptionnelles qui témoignent de l'histoire du territoire. Tout au long de la journée, des visites commentées des vitrines archéologiques permettront de découvrir quels procédés sont utilisés pour sauvegarder des objets issus des fouilles effectuées à Saint-Denis ou, par défaut, leur trace. Il s’agit d’en apprendre davantage sur les autres facettes du travail des archéologues, de la découverte des vestiges à leur"", ""L'événement Trait de regard, retrait de garde – tracer sur l’image photographique a lieu au Université Paris 8 / Département Photographie dans la ville de Saint-Denis. Date : le 27/05/2027 (mai 2027) de 09h00 à 18h00. Description : Cette journée d’étude explore les liens entre dessin et photographie à travers des pratiques artistiques qui interviennent directement sur l’image photographique. Elle interroge le dessin sur photo sous deux angles : comme geste qui révèle la matérialité de l’image et remet en question son apparente neutralité, mais aussi comme expérience physique et cognitive engageant le corps, la perception et l’imagination de l’artiste. Chercheur·euses, artistes et critiques réfléchiront ensemble à la photographie comme espace d’inscription, de transformation et de"", ""L'événement La Cité fait son cinéma: la grande inauguration de la nouvelle Cité du Cinéma ! Atelier a lieu au La Cité du cinéma dans la ville de Saint-Denis. Dates : le 19/09/2026 (septembre 2026) ; le 20/09/2026 (septembre 2026). Description : À l'occasion des Journées européennes du patrimoine, la Cité du Cinéma ouvre grand ses portes. Pendant deux jours, profitez d'une programmation gratuite d'ateliers pour découvrir ce nouveau lieu culturel et événementiel du Grand Paris en famille ou entre amis."", ""L'événement La Cité fait son cinéma: la grande inauguration de la nouvelle Cité du Cinéma ! Exposition a lieu au La Cité du cinéma dans la ville de Saint-Denis. Dates : le 19/09/2026 (septembre 2026) ; le 20/09/2026 (septembre 2026). Description : À l'occasion des Journées européennes du patrimoine, la Cité du Cinéma ouvre grand ses portes. Pendant deux jours, profitez d'une programmation gratuite d'expositions pour découvrir ce nouveau lieu culturel et événementiel du Grand Paris en famille ou entre amis.""]","Voici 4 événements correspondant à votre demande :

1. **Hériter ? Collections photographiques (post)coloniales en mondes africains. #1** | 26/10/2026 de 18h00 à 21h00 | Département Arts plastiques, Université Paris 8, Saint-Denis | Cycle de conférences proposé par Christine Barthe, Inès Boufouchk, Annabelle Lacour, Marian Nur Goni, Aline Pighin et Anna Seiderer. Ouvert à tous les publics.

2. **Hériter ? Collections photographiques (post)coloniales en mondes africains. #2** | 23/11/2026 de 18h00 à 21h00 | Département Arts plastiques, Université Paris 8, Saint-Denis | Cycle de conférences (même organisateurs). Ouvert à tous les publics.

3. **Hériter ? Collections photographiques (post)coloniales en mondes africains. #3** | 14/12/2026 de 18h00 à 21h00 | Département Arts plastiques, Université Paris 8, Saint-Denis | Cycle de conférences (même organisateurs). Ouvert à tous les publics.

4. **Hériter ? Collections photographiques (post)coloniales en mondes africains. #4** | 25/01/2027 de 18h00 à 21h00 | Département Arts plastiques, Université Paris 8, Saint-Denis | Cycle de conférences (même organisateurs). Ouvert à tous les publics.","La conférence ""Hériter ? Collections photographiques (post)coloniales en mondes africains #2"" a lieu à l'Université Paris 8, à Saint-Denis, le 23 novembre 2026 de 18h à 21h.",0.9655172413793104,1.0,0.432429033903701
Y a-t-il un événement sur la création d'entreprise à Nemours en juin 2026 ?,"[""L'événement Une idée de création d'entreprise? Informez vous ! a lieu au Agence Nemours dans la ville de Nemours. Date : le 23/06/2026 (juin 2026) de 14h15 à 16h00. Description : Vous envisagez de créer votre activité/votre entreprise? Nous vous proposons un atelier afin de vous informer sur: -les aides France Travail -les accompagnements et prestations qui peuvent vous aider à asseoir votre réflexion et à aller plus loin dans la démarche. Tour de table Présentation des aides et accompagnements Echange sur les informations."", ""L'événement Atelier seniors : dynamiques et perspectives a lieu au Agence Nemours dans la ville de Nemours. Date : le 10/06/2026 (juin 2026) de 14h00 à 17h00. Description : Nous allons explorer ensemble les stéréotypes liés à l'âge, comprendre leur impact et identifier des leviers pour les surmonter. Croiser les regards, dépasser les idées reçues & révéler ses talents. Echanger et réfléchir sur les situations rencontrées, Comprendre les représentations liées à l'âge, Reprendre confiance et renforcer votre dynamique. Echange de groupe. Prévoir la demie journée."", ""L'événement Découvrez les Métiers de l'Aide à la Personne et rencontrez l'employeur CENTRE SERVICES : Votre Avenir Commence Ici ! a lieu au Agence Nemours dans la ville de Nemours. Date : le 11/06/2026 (juin 2026) de 09h30 à 10h00. Description : Participez à notre atelier sectoriel dédié aux métiers de l'aide à la personne et à domicile. Cet événement est une occasion unique d'explorer les carrières d'aide ménagère, d'auxiliaire de vie et d'autres professions essentielles. Vous aurez l'opportunité d'écouter des experts du secteur et de rencontrer un recruteur de l'entreprise CENTRE SERVICES , qui présentera ses besoins en personnel. Que vous soyez en reconversion professionnelle ou simplement curieux, cet atelier vous permettra de vous"", ""L'événement Découvrez les Métiers de l'Aide à la Personne et rencontrez l'employeur APEF : Votre Avenir Commence Ici ! a lieu au Agence Nemours dans la ville de Nemours. Date : le 25/06/2026 (juin 2026) de 09h30 à 11h00. Description : Participez à notre atelier sectoriel dédié aux métiers de l'aide à la personne et à domicile. Cet événement est une occasion unique d'explorer les carrières d'aide ménagère, d'auxiliaire de vie et d'autres professions essentielles. Vous aurez l'opportunité d'écouter des experts du secteur et de rencontrer un recruteur de l'entreprise APEF, qui présentera ses besoins en personnel. Que vous soyez en reconversion professionnelle ou simplement curieux, cet atelier vous permettra de vous informer sur"", ""L'événement Ouverture de l'exposition « Ça en jette ! Quand l’archéologie s’intéresse à nos déchets » a lieu au Musée de Préhistoire d'Ile-de-France dans la ville de Nemours. Dates : le 13/06/2026 (juin 2026) ; le 13/06/2026 (juin 2026) ; le 14/06/2026 (juin 2026) ; le 14/06/2026 (juin 2026). Description : Vous avez rendez-vous avec votre histoire. Partout en France et en Europe, ces journées sont l’occasion de découvrir l’archéologie grâce à plus de 5 000 évènements. Le musée ouvre gratuitement ses portes pour cet évènement. À l’occasion des Journées européennes de l’archéologie, soyez les premiers à découvrir la toute dernière exposition temporaire intutilée « Ça en jette ! Quand l’archéologie s’intéresse à nos déchets ». Cette exposition originale est consacrée aux déchets et à leur"", ""L'événement Paysages d'eau a lieu au Château-Musée de Nemours dans la ville de Nemours. Événement récurrent : 183 occurrences du 11/04/2026 au 30/08/2026. Mois concernés : août 2026, avril 2026, juillet 2026, juin 2026, mai 2026. Description : L’accrochage « Paysages d’eau » invite à explorer les espaces multiples que l’eau dessine dans la nature comme dans l’art. Peintures, dessins, gravures et sculptures sont présentés, offrant un parcours à travers la France entière, de ses rivages à ses rivières."", ""L'événement Visite Flash de l'exposition « Ça en jette ! Quand l’archéologie s’intéresse à nos déchets ». a lieu au Musée de Préhistoire d'Ile-de-France dans la ville de Nemours. Dates : le 14/06/2026 (juin 2026) ; le 14/06/2026 (juin 2026) ; le 14/06/2026 (juin 2026). Description : Suivez le guide et découvrez la toute nouvelle exposition du musée de Préhistoire consacrée … AUX DECHETS ! Contrairement à ce que l’on peut penser, l’archéologie n’est pas une affaire de trésors. Tous les vestiges matériels intéressent les archéologues et les déchets ne font pas exception. Ils sont en effet porteurs de précieux renseignements sur les modes de vie de nos prédécesseurs. Cette exposition, en contant l’histoire de nos déchets, dessine en creux l’histoire de nos sociétés."", 'des pratiques anciennes. Saviez-vous que le gaspillage apparaît au Néolithique ? Que le premier récipient à usage unique est fabriqué dès l’Antiquité ? Que les habitants des villes médiévales jetaient les détritus dans les rues ? Que le recyclage et le réemploi ont toujours existé ? Grâce aux découvertes archéologiques faites en Seine-et-Marne et dans les environs, parcourons cette histoire des déchets, de leur production, de leur gestion et de ce que cela révèle des sociétés humaines. Exposition adaptée à partir de l’exposition originale « Ça en jette ! Quand l’archéologie s’intéresse à nos déchets » conçue par ARCHÉA, Archéologie en Pays de France.', ""originale est consacrée aux déchets et à leur importance pour les archéologues. L'archéologie ne s'intéresse pas qu'aux trésors. On fouille pour découvrir et étudier toutes les traces laissées par les populations du passé. Les déchets sont les vestiges les plus courants et représentent une source d’informations précieuses pour les archéologues : ruines, traces d’habitats, sépultures, ossements, restes végétaux, objets dans tous leurs états… Rien n’est délaissé et encore moins les déchets. Témoins omniprésents des sociétés humaines, ceux-ci sont porteurs de précieux renseignements sur leurs modes de vie, leurs savoir-faire et leurs environnements. L’histoire des déchets permet aussi de questionner nos propres usages et de les mettre en regard des pratiques anciennes. Saviez-vous que le""]","Voici 1 événement :

1. **Une idée de création d'entreprise? Informez vous !** | 23/06/2026 de 14h15 à 16h00 | Agence Nemours, Nemours | Atelier d'information sur les aides France Travail, les accompagnements et prestations pour créer son activité/entreprise. Tour de table, présentation des aides et échanges.","Oui, ""Une idée de création d'entreprise ? Informez-vous !"" a lieu à l'Agence Nemours le 23 juin 2026 de 14h15 à 16h.",1.0,1.0,0.5824677696380947
Quelle bibliothèque récurrente est ouverte à la Cité des sciences à Paris ?,"[""L'événement Bibliothèque de la Cité des sciences et de l'industrie a lieu au Cité des sciences et de l'Industrie dans la ville de Paris. Événement récurrent : 647 occurrences du 09/12/2025 au 09/01/2028. Mois concernés : août 2026, août 2027, avril 2026, avril 2027, décembre 2025, décembre 2026, décembre 2027, février 2026, février 2027, janvier 2026, janvier 2027, janvier 2028, juillet 2026, juillet 2027, juin 2026, juin 2027, mai 2026, mai 2027, mars 2026, mars 2027, novembre 2026, novembre 2027, octobre 2026, octobre 2027, septembre 2026, septembre 2027. Description : Profitez de plus de 120 000 ressources multi-supports : livres numériques, un espace jeunesse, des salles réservables, des espaces de travail individuels ou en groupe... Le plus grand espace de coworking de Paris est à"", ""L'événement Les expositions a lieu au Cité des sciences et de l'Industrie dans la ville de Paris. Événement récurrent : 656 occurrences du 23/09/2025 au 24/10/2027. Mois concernés : août 2026, août 2027, avril 2026, avril 2027, décembre 2025, décembre 2026, février 2026, février 2027, janvier 2026, janvier 2027, juillet 2026, juillet 2027, juin 2026, juin 2027, mai 2026, mai 2027, mars 2026, mars 2027, novembre 2025, novembre 2026, octobre 2025, octobre 2026, octobre 2027, septembre 2025, septembre 2026, septembre 2027. Description : .... et leur relation à la société contemporaine. Ces expositions, permanentes et temporaires, proposent une muséologie originale, interactive et ludique. Thèmes : Medecine - sante - sciences cognitives, Sciences de la vie, Habitat - territoire - transport,"", ""L'événement Carrefour numérique a lieu au Cité des sciences et de l'Industrie dans la ville de Paris. Événement récurrent : 541 occurrences du 09/12/2025 au 08/01/2028. Mois concernés : août 2026, août 2027, avril 2026, avril 2027, décembre 2025, décembre 2026, décembre 2027, février 2026, février 2027, janvier 2026, janvier 2027, janvier 2028, juillet 2026, juillet 2027, juin 2026, juin 2027, mai 2026, mai 2027, mars 2026, mars 2027, novembre 2026, novembre 2027, octobre 2026, octobre 2027, septembre 2026, septembre 2027. Description : Le Carrefour numérique², micro-lieu au sein d’un macro-lieu, vous entraîne et vous accompagne dans les pratiques et usages de demain. Le Fab Lab, un atelier partagé de conception et de fabrication, libre, gratuit et ouvert à tou·te·s.Les utilisateur·trice·s"", ""Le plus grand espace de coworking de Paris est à vous et il est en accès libre et gratuit, du mardi au dimanche, de 12h à 18h45. L'emprunt de documents à la bibliothèque est désormais 100% gratuit. Culture, sciences, métiers, santé, environnement, numérique, développement durable... passionnez-vous pour tous les sujets. Suivi en langue des signes"", ""L'événement Urgence climatique a lieu au Cité des sciences et de l'Industrie dans la ville de Paris. Événement récurrent : 677 occurrences du 09/12/2025 au 06/02/2028. Mois concernés : août 2026, août 2027, avril 2026, avril 2027, décembre 2025, décembre 2026, décembre 2027, février 2026, février 2027, février 2028, janvier 2026, janvier 2027, janvier 2028, juillet 2026, juillet 2027, juin 2026, juin 2027, mai 2026, mai 2027, mars 2026, mars 2027, novembre 2026, novembre 2027, octobre 2026, octobre 2027, septembre 2026, septembre 2027. Description : Comment continuer d’habiter la Terre ? Pour y parvenir, nous n’avons pas d’autre choix que de transformer nos manières de vivre et de faire société. Alors, comment pouvons-nous nous y prendre ? Une exposition en trois séquences de visite : >"", ""et l'accueil des chercheurs. Cet espace est exceptionnellement ouvert en accès libre durant les Journées européennes du Patrimoine."", ""L'événement La Cité des bébés a lieu au Cité des sciences et de l'Industrie dans la ville de Paris. Événement récurrent : 668 occurrences du 09/12/2025 au 17/01/2027. Mois concernés : août 2026, avril 2026, décembre 2025, décembre 2026, février 2026, janvier 2026, janvier 2027, juillet 2026, juin 2026, mai 2026, mars 2026, novembre 2026, octobre 2026, septembre 2026. Description : Dans ce lieu unique en son genre, les bébés ouvrent grand les yeux sur leur environnement et l'explorent à leur guise. Conçu comme un nid sécurisant, centré sur l’éveil, le développement et le bien-être de l'enfant, la Cité des bébés est un lieu original qui accueille chaque bébé, et l'adulte qui l’accompagne, dans une atmosphère chaleureuse. Au sein de cet univers ludique et évolutif, entièrement pensé pour eux,"", ""L'événement Electro-Robot : Programme ton aventure a lieu au Cité des sciences et de l'Industrie dans la ville de Paris. Événement récurrent : 22 occurrences du 21/04/2026 au 30/08/2026. Mois concernés : août 2026, avril 2026, juillet 2026, juin 2026, mai 2026. Description : La bibliothèque propose des ateliers intergénérationnels autour de ses robots. Les aventuriers de la robotique embarquent dans un atelier plein de surprises ! Au programme : secrets des composants électroniques Littlebits et programmation du robot RVR pour relever tous les défis préparés par les médiateurs... Les enfants doivent impérativement être accompagnés. Pas plus de 2 accompagnants pour un enfant, ni plus de 2 enfants par accompagnant. Atelier avec accompagnateur, payant et sur inscription."", ""L'événement Visite guidée du réfectoire des moines a lieu au Bibliothèque centrale du Conservatoire national des arts et métiers dans la ville de Paris. Dates : le 19/09/2026 (septembre 2026) ; le 19/09/2026 (septembre 2026) ; le 19/09/2026 (septembre 2026) ; le 19/09/2026 (septembre 2026) ; le 19/09/2026 (septembre 2026). Description : Venez découvrir l’histoire d’une des plus belles bibliothèques de Paris ! À l’occasion des Journées européennes du patrimoine, venez découvrir l’histoire de l’ancien prieuré Saint-Martin des Champs et de son réfectoire construit vers 1230 dans lequel la bibliothèque centrale du Conservatoire national des arts et métiers est installée depuis 1852. Visites guidées sur inscription, toutes les demi-heures, de 9h30 à 11h30. RDV dans la cour d’honneur, au 292 rue"", ""L'événement Visite de la Bibliothèque nationale de France (BnF) - Site François-Mitterrand a lieu au BnF | François-Mitterrand dans la ville de Paris. Date : le 20/09/2026 (septembre 2026) de 12h45 à 19h00. Description : Profitez des Journées européennes européennes du patrimoine pour explorer les coulisses techniques du bâtiment et son architecture emblématique, découvrir la collection Charles Cros (en hommage au premier concepteur du phonographe), faire une promenade insolite à travers l'art contemporain exposé dans les espaces publics, visiter les salles de lecture habituellement réservées aux chercheurs ou participer à un atelier « Imagine ta bibliothèque ! » en famille"", ""L'événement Écrire, s’exprimer, prendre confiance a lieu au Cité des sciences et de l'Industrie dans la ville de Paris. Dates : le 04/04/2026 (avril 2026) ; le 03/10/2026 (octobre 2026). Description : Venez progresser à l’écrit dans un cadre ludique ! Pendant deux heures, alternez jeux d’écriture, exercices guidés et création personnelle. Des techniques concrètes pour gagner en confiance à l’écrit et réutiliser vos acquis dans vos travaux scolaires, universitaires ou personnels."", ""L'événement Portes ouvertes de l'Institut de France a lieu au Institut de France dans la ville de Paris. Dates : le 19/09/2026 (septembre 2026) ; le 20/09/2026 (septembre 2026). Description : À l’occasion de la 43e édition des Journées européennes du patrimoine organisées autour des thèmes « Le Patrimoine de la photographie » et « Patrimoine en péril : raviver, résister, réimaginer », l’Institut de France ouvre grand ses portes pour dévoiler l’ensemble des lieux historiques de son Palais, dont bon nombre sont d’ordinaire fermés au public. Les visiteurs y découvriront les bibliothèques Mazarine et de l’Institut de France, les deux salles des séances des académiciens ainsi que la Coupole, lieu le plus symbolique de l’Institut et des compagnies qu’il abrite : l’Académie française, l’Académie""]","Voici 1 événement :

1. **Bibliothèque de la Cité des sciences et de l'industrie** | Du 09/12/2025 au 09/01/2028, du mardi au dimanche, de 12h à 18h45 | Cité des sciences et de l'Industrie, Paris | Profitez de plus de 120 000 ressources multi-supports : livres numériques, un espace jeunesse, des salles réservables, des espaces de travail individuels ou en groupe. Le plus grand espace de coworking de Paris est à vous et il est en accès libre et gratuit. L'emprunt de documents est désormais 100% gratuit.",La Bibliothèque de la Cité des sciences et de l'industrie à Paris propose des événements récurrents à partir du 9 décembre 2025.,0.9411764705882353,1.0,0.4578598107246836
"Où voir les ""Expositions au jardin de la citadelle"" à Pontoise les 6 et 7 juin 2026 ?","[""L'événement Expositions au jardin de la citadelle a lieu au Jardin de la Citadelle dans la ville de Pontoise. Dates : le 06/06/2026 (juin 2026) ; le 07/06/2026 (juin 2026). Description : Derrière les grands murs du 12 rue de la citadelle se cache le jardin de William. C'est une composition vivante où cohabite différentes ambiances entre ordre classique et poésie. Ce jardin a fait l'objet de nombreux articles de presse. Prochainement les talents de William seront mis à l'honneur dans l'émission télévisée les As du jardin produit par France Télévision. Les artistes suivants seront présents au jardin de la citadelle durant tout le week-end des RDV aux jardins : Isabelle Diffre , artiste plasticienne qui vit et travaille à Pontoise explore la notion de paysage à travers l'encre et la peinture."", ""L'événement Visite découverte du jardin de Roses a lieu au Jardin de roses dans la ville de Pontoise. Dates : le 06/06/2026 (juin 2026) ; le 07/06/2026 (juin 2026). Description : Avec sa superbe vue panoramique sur le vieux Pontoise, il s'agit d'un jardin orné de rosiers et de campanules."", 'L\'événement Animation ""Voir le potager autrement"" au jardin pédagogique de Pontoise a lieu au Le jardin pédagogique de Pontoise dans la ville de Pontoise. Dates : le 06/06/2026 (juin 2026) ; le 07/06/2026 (juin 2026). Description : Le jardin pédagogique de Pontoise est créé et géré par l\'association Pontoise Durablement . Autrement appelé Jardin de la Transition Ecologique il a pour vocation de sensibiliser à la production de fruits et légumes en autonomie. L\'objectif est de fournir un espace de partage et d\'apprentissage aux techniques de semis et de culture en permaculture sur Pontoise. Il est aussi un lieu d\'apprentissage de l\'apiculture avec 3 ruches pédagogiques gérées par les membres de l\'association. Ouvert aux membres et aux scolaires. L\'association vous propose une animation ""Voir', ""L'événement Ouverture du jardin écologique du CAUE 95 le samedi 6 juin de 10h à 16h a lieu au Moulin de la Couleuvre-CAUE dans la ville de Pontoise. Date : le 06/06/2026 (juin 2026) de 10h00 à 16h00. Description : À l’occasion des Rendez-vous aux jardins 2026, le jardin écologique du CAUE 95 vous accueille le 6 juin avec des ateliers, des visites, des conseils de jardinage durable, des supports pédagogiques et un Troc Plantes ouvert à tous. Le jardin écologique expérimental du Moulin de la Couleuvre vous ouvre ses portes ! Depuis plus de 30 ans, ce lieu unique est entretenu en gestion différenciée par le CAUE 95 et constitue un véritable laboratoire vivant de la biodiversité. Venez explorer la diversité de ses milieux, observer la richesse de sa flore et de sa faune, et échanger avec les"", ""L'événement Visite libre du jardin du CAUE a lieu au Moulin de la Couleuvre-CAUE dans la ville de Pontoise. Date : le 06/06/2026 (juin 2026) de 10h00 à 16h00. Description : Depuis plus de 30 ans, ce lieu unique est entretenu en gestion différenciée par le CAUE 95 et constitue un véritable laboratoire vivant de la biodiversité. Venez explorer la diversité de ses milieux, observer la richesse de sa flore et de sa faune, et échanger avec les paysagistes du CAUE pour découvrir des solutions concrètes à mettre en œuvre chez vous — au jardin, sur un balcon ou même au pied de votre rue …"", ""L'événement Visite libre du jardin du musée Tavet-Delacour a lieu au Musée Tavet-Delacour dans la ville de Pontoise. Dates : le 06/06/2026 (juin 2026) ; le 07/06/2026 (juin 2026). Description : Le jardin, adossé aux anciennes casemates, présente une collection de sculptures anciennes (chapiteaux, gargouilles, vestiges de Pontoise), une allée couverte, des œuvres contemporaines d'Otto Freundlich ainsi que les ouevres de clara Tournay et Arièle Rozowy, artistes contemporaines qui mettent en lumière la mémoire et la place des femmes à travers formes, matières et couleurs. Une promenade artistique et romantique."", 'L\'événement Vue sur cour\xa0: ""découvrir l’histoire des Cinq Sens"" au Musée Pissarro a lieu au Musée Camille-Pissarro dans la ville de Pontoise. Dates : le 06/06/2026 (juin 2026) ; le 07/06/2026 (juin 2026). Description : Vous voulez en savoir plus sur notre jardin des 5 sens ? Le samedi 6 juin et le dimanche 7 juin, le Musée d’Art et d’Histoire Pissarro-Pontoise vous propose de découvrir le jardin des Cinq sens comme vous ne l’avez jamais vu. Quelle est son histoire ? Pourquoi a-t-il été créé ? Autant de questions qui auront le droit à leurs réponses grâce à une visite-atelier croquis du jardin que vous pourrez faire en famille ou entre amis. En prime, vous pourrez repartir avec votre carnet de croquis, dans lequel vous pourrez collecter et reproduire certaines des plantes et fleurs de notre', ""L'événement Exposition « Le Vieux Pontoise, d’hier à aujourd’hui » - jardin partagé de la Harengerie a lieu au Jardin de la Harengerie dans la ville de Pontoise. Dates : le 06/06/2026 (juin 2026) ; le 07/06/2026 (juin 2026). Description : Sur le site de l’ancien presbytère de Saint-Maclou, une friche s’étendait... Depuis 8 ans, c’est un jardin partagé, créé par les habitants du quartier. Un havre de biodiversité, où les cultures potagères côtoient une flore sauvage soigneusement préservée. Dans le Jardin Partagé de la Harengerie, vous pourrez découvrir l'exposition « Le vieux Pontoise, d’hier à aujourd’hui »."", ""L'événement Atelier semis réussis au jardin pédagogique de Pontoise a lieu au Le jardin pédagogique de Pontoise dans la ville de Pontoise. Dates : le 06/06/2026 (juin 2026) ; le 07/06/2026 (juin 2026). Description : Le jardin pédagogique de Pontoise est créé et géré par l'association Pontoise Durablement . Autrement appelé Jardin de la Transition Ecologique il a pour vocation de sensibiliser à la production de fruits et légumes en autonomie. L'objectif est de fournir un espace de partage et d'apprentissage aux techniques de semis et de culture en permaculture sur Pontoise. Il est aussi un lieu d'apprentissage de l'apiculture avec 3 ruches pédagogiques gérées par les membres de l'association. Ouvert aux membres et aux scolaires. L'association Pointoise Durablement vous propose un atelier"", ""L'événement Initiation au cyanotype nature au jardin pédagogique de Pontoise a lieu au Le jardin pédagogique de Pontoise dans la ville de Pontoise. Dates : le 06/06/2026 (juin 2026) ; le 07/06/2026 (juin 2026). Description : Le jardin pédagogique de Pontoise est créé et géré par l'association Pontoise Durablement . Autrement appelé Jardin de la Transition Ecologique il a pour vocation de sensibiliser à la production de fruits et légumes en autonomie. L'objectif est de fournir un espace de partage et d'apprentissage aux techniques de semis et de culture en permaculture sur Pontoise. Il est aussi un lieu d'apprentissage de l'apiculture avec 3 ruches pédagogiques gérées par les membres de l'association. Ouvert aux membres et aux scolaires. L'association Pointoise Durablement vous propose une"", ""L'événement Jeu-défi nature pollinisateurs au jardin pédagogique de Pontoise a lieu au Le jardin pédagogique de Pontoise dans la ville de Pontoise. Dates : le 06/06/2026 (juin 2026) ; le 07/06/2026 (juin 2026). Description : Le jardin pédagogique de Pontoise est créé et géré par l'association Pontoise Durablement . Autrement appelé Jardin de la Transition Ecologique il a pour vocation de sensibiliser à la production de fruits et légumes en autonomie. L'objectif est de fournir un espace de partage et d'apprentissage aux techniques de semis et de culture en permaculture sur Pontoise. Il est aussi un lieu d'apprentissage de l'apiculture avec 3 ruches pédagogiques gérées par les membres de l'association. Ouvert aux membres et aux scolaires. L'association Pointoise Durablement vous proposeun"", 'L\'événement Balade à dos d\'âne dans le jardin de la ville a lieu au Jardin de la ville dans la ville de Pontoise. Dates : le 07/06/2026 (juin 2026) ; le 07/06/2026 (juin 2026). Description : Balade à dos d\'ânes dans le jardin de la ville avec ""ânes en Vexin""']","Voici 1 événement :

1. **Expositions au jardin de la citadelle** | **06/06/2026 et 07/06/2026** | **Jardin de la Citadelle, Pontoise** | Derrière les grands murs du 12 rue de la citadelle se cache le jardin de William. Une composition vivante où cohabitent différentes ambiances entre ordre classique et poésie. Les artistes Isabelle Diffre (plasticienne) et d'autres talents seront présents pour explorer la notion de paysage à travers l'encre et la peinture.","Les ""Expositions au jardin de la citadelle"" ont lieu au Jardin de la Citadelle à Pontoise, les 6 et 7 juin 2026.",0.9285714285714286,1.0,0.4325189223139581
Quelle conférence sur les étudiants commissaires d'exposition a lieu à Fontainebleau le 6 juin 2026 ?,"[""L'événement Quand des étudiants deviennent commissaires d’exposition : un regard renouvelé ? a lieu au Château de Fontainebleau - quartier Henri IV, salle à manger dans la ville de Fontainebleau. Date : le 06/06/2026 (juin 2026) de 17h30 à 18h30. Description : Projet pédagogique grandeur nature, depuis maintenant sept ans, où des élèves de l’Ecole du Louvre réalisent une exposition-école. Cette intervention se fera sous forme de témoignages et d’échanges avec les acteurs du projet. L'exposition de l'année 2026, en partenariat avec la Cité de l'Architecture et du Patrimoine, portera sur le dépôt de moulages à l'Ecole du Louvre. Ils évoqueront leur expérience de jeunes commissaires d'exposition en présentant leur projet d'exposition, du choix des oeuvres à la médiation autour du moulage."", ""L'événement Exposer la mode en France a lieu au Château de Fontainebleau - chapiteau cour ovale dans la ville de Fontainebleau. Date : le 06/06/2026 (juin 2026) de 11h30 à 13h00. Description : Cette table ronde propose d’explorer les enjeux contemporains et transversaux de l’exposition de la mode en France, à travers plusieurs projets récents et à venir. Conservateurs et commissaires y présenteront leurs expositions, avant de revenir sur leur genèse : rôle des collections, choix des thématiques, place de la mode dans les institutions muséales. La discussion abordera également les dispositifs scénographiques et de médiation, notamment les manières de restituer la dimension sensible du vêtement, de redonner corps aux pièces exposées et de rendre compte de leur histoire sociale et intime."", ""L'événement Fashion-Z : Recherches en mode. Les étudiants et doctorants en écoles de mode pitchent leurs travaux a lieu au Château de Fontainebleau - chapiteau cour ovale dans la ville de Fontainebleau. Date : le 07/06/2026 (juin 2026) de 14h00 à 15h30. Description : Inspiré de « Ma thèse en 180 secondes », cet exercice transpose le format et invite étudiants et doctorants en école de mode à relever le défi : condenser leurs mémoires en trois minutes chrono ! Ces travaux hybrides décloisonnent les frontières entre théorie et pratique. Chaque mémoire se matérialise dans un ouvrage unique où l’iconographie devient langage. La recherche s’incarne, le concept prend forme. En 180 secondes, les étudiants défendent leur démarche, révèlent leurs obsessions créatives et partagent la singularité de"", ""L'événement Rencontre costumée : à la découverte des grandes figures de Fontainebleau a lieu au Château de Fontainebleau - salle de la Belle Cheminée et tout au long du circuit de visite dans la ville de Fontainebleau. Dates : le 06/06/2026 (juin 2026) ; le 06/06/2026 (juin 2026) ; le 07/06/2026 (juin 2026) ; le 07/06/2026 (juin 2026). Description : Association étudiante - Défilé de l’Histoire de l'École du Louvre. Les acteurs et actrices costumés, du club théâtre et du défilé de l’histoire de l'École du Louvre, donnent vie à des figures historiques marquantes. En allant à leur rencontre, les visiteurs complètent un carnet pédagogique avec des questions sur les costumes et les usages de la cour. Une expérience participative pour découvrir l’histoire autrement."", ""L'événement Médiation culturelle et outils numériques a lieu au Château de Fontainebleau - quartier Henri IV, grande salle dans la ville de Fontainebleau. Date : le 05/06/2026 (juin 2026) de 14h15 à 15h45. Description : Comment attirer de nouveaux publics dans les lieux culturels et enrichir l’expérience de visite ? Quels enjeux et impacts pour les lieux culturels ?"", ""L'événement Textiles : une affaire de mode a lieu au Château de Fontainebleau - départ kiosque de la cour d'Honneur dans la ville de Fontainebleau. Dates : le 06/06/2026 (juin 2026) ; le 07/06/2026 (juin 2026). Description : Cette visite propose une lecture du Château de Fontainebleau à travers le textile. Tentures murales, rideaux, tapisseries et textiles d’ameublement, souvent peu observés, sont pourtant essentiels pour comprendre les modes des différentes époques. Au fil des étoffes se tisse un autre regard sur son histoire. Partenariat entre le Château de Fontainebleau, l’INHA et l’École du Louvre."", ""L'événement Les voies de la recherche : parcours d'étudiants en histoire de l'art a lieu au Château de Fontainebleau - quartier Henri IV, grande salle dans la ville de Fontainebleau. Date : le 06/06/2026 (juin 2026) de 10h00 à 11h30. Description : À travers cinq parcours d’étude et professionnels différents, nous proposons de revenir sur les étapes et les choix qui ponctuent l’orientation vers la recherche en histoire de l’art, offrant ainsi une fenêtre sur notre quotidien de jeune chercheur(e)s en formation. Des enjeux pratiques (choix d’un sujet de recherche, d’une direction de mémoire/thèse, mise en place d’une codirection, financement) ainsi que des problématiques plus spécifiques (faire de la recherche sur des territoires empêchés, travailler avec les sciences du patrimoine, trouver"", ""L'événement Château de Fontainebleau : architecture, décors, collections a lieu au Château de Fontainebleau - tout au long du circuit de visite dans la ville de Fontainebleau. Dates : le 05/06/2026 (juin 2026) ; le 06/06/2026 (juin 2026) ; le 07/06/2026 (juin 2026). Description : Une question ? Les étudiants en histoire de l’art sont présents tout au long du circuit du visite pour vous apporter des explications !"", ""L'événement Les métiers de la conservation et le chantier des collections a lieu au Château de Fontainebleau - quartier Henri IV, salle à manger dans la ville de Fontainebleau. Date : le 05/06/2026 (juin 2026) de 14h00 à 15h00. Description : Découvrez les métiers de la conservation au sein de différentes institutions grâce au regard de professionnels qui évoqueront le travail sur le réaménagement des collections et leur restauration. Carte blanche à l'École du Louvre"", ""L'événement Histoire des arts et métiers d'art de la mode : un dialogue créatif a lieu au Château de Fontainebleau - salle des colonnes dans la ville de Fontainebleau. Date : le 05/06/2026 (juin 2026) de 10h50 à 11h35. Description : Comment l’histoire des arts nourrit-elle les savoir-faire d’excellence dans la mode ? Comment les métiers d’art, à leur tour, offrent-ils une porte d’entrée concrète vers la compréhension des œuvres et des courants artistiques ? Cette table ronde explore les passerelles entre patrimoine et innovation, en s’appuyant sur des exemples concrets tirés des collections muséales et des pratiques artisanales. Elle interroge aussi les démarches pédagogiques qui, par l’étude des techniques et des créations, rendent accessible l’histoire des arts."", ""L'événement Les métiers du marché de l'art a lieu au Château de Fontainebleau - quartier Henri IV, salle à manger dans la ville de Fontainebleau. Date : le 05/06/2026 (juin 2026) de 15h00 à 16h00. Description : Cette table ronde propose de croiser les regards et les approches sur les tendances actuelles du marché de l'art par le prisme des métiers. Carte blanche à l'École du Louvre"", ""L'événement Conférence sur l'ouvrage Bijoux de scène de la Comédie-Française, 2023 a lieu au Château de Fontainebleau - quartier Henri IV, cour des Offices dans la ville de Fontainebleau. Date : le 05/06/2026 (juin 2026) de 17h00 à 17h45. Description : Guillaume Glorieux et Agathe Sanjuan (dir.), Bijoux de scène de la Comédie-Française , Paris, L’École des Arts Joailliers ; Gallimard, 2023 L’Orient en scène: bijoux de la Comédie-Française et d’ailleurs.""]","Voici 1 événement :

1. **Quand des étudiants deviennent commissaires d’exposition : un regard renouvelé ?** | 06/06/2026 de 17h30 à 18h30 | Château de Fontainebleau - quartier Henri IV, salle à manger, Fontainebleau | Projet pédagogique où des élèves de l’École du Louvre réalisent une exposition-école. Témoignages et échanges sur leur expérience de jeunes commissaires, avec présentation de leur projet 2026 (dépôt de moulages à l'École du Louvre, en partenariat avec la Cité de l'Architecture et du Patrimoine).","La conférence ""Quand des étudiants deviennent commissaires d'exposition"" a lieu au Château de Fontainebleau le 6 juin 2026 de 17h30 à 18h30.",0.9,1.0,0.5064123453881806
Où se tient l'exposition d'Isabelle Le Minh en Île-de-France ?,"['Frac Normandie Rouen, le CRP/Douchy-les-Mines ou la Maison Rouge. Isabelle Le Minh enseigne à la Haute école des arts du Rhin à Strasbourg, son travail est représenté par la galerie Christophe Gaillard.', ""L'événement Rencontre Dialoguée avec Isabelle Le Minh,  dans le cadre de l'exposition monographique A Rose is a Rose is the Last Rose of Summer. a lieu au Centre photographique d'Île-de-France dans la ville de Pontault-Combault. Date : le 07/11/2026 (novembre 2026) de 15h00 à 17h30. Description : Autour des problématiques posées par l'exposition A Rose is a Rose is the Last Rose of Summer , La Rencontre Dialoguée est une proposition de dialogue public entre Isabelle Le Minh et une personnalité invitée . Dans le cadre des célébrations du Bicentenaire de l’invention de la photographie, le Centre photographique d’Île-de-France, centre d’art contemporain d’intérêt national, est heureux de présenter, à la suite de plusieurs collaborations, la première monographie dans un centre d’art"", ""L'événement Vernissage, Isabelle Le Minh,  A Rose is a Rose is the Last Rose of Summer a lieu au Centre photographique d'Île-de-France dans la ville de Pontault-Combault. Date : le 03/10/2026 (octobre 2026) de 15h00 à 18h00. Description : Dans le cadre des célébrations du Bicentenaire de l’invention de la photographie, le Centre photographique d’Île-de-France, centre d’art contemporain d’intérêt national, est heureux de présenter, à la suite de plusieurs collaborations, la première monographie dans un centre d’art contemporain en Île-de-France de l’artiste, à la reconnaissance internationale, Isabelle Le Minh . Intitulée A Rose is a Rose is the Last Rose of Summer , l’exposition se compose de tirages, d’ensembles installatifs et de dispositifs variés. Elle articule de nouvelles créations"", ""L'événement Exposition monographique d'Isabelle Le Minh,  A Rose is a Rose is the Last Rose of Summer a lieu au Centre photographique d'Île-de-France dans la ville de Pontault-Combault. Événement récurrent : 54 occurrences du 03/10/2026 au 20/12/2026. Mois concernés : décembre 2026, novembre 2026, octobre 2026. Description : Dans le cadre des célébrations du Bicentenaire de la Photographie, le Centre photographique d’Île-de-France, centre d’art contemporain d’intérêt national, est heureux de présenter, à la suite de plusieurs collaborations, la première monographie dans un centre d’art contemporain en Île-de-France de l’artiste, à la reconnaissance internationale, Isabelle Le Minh . Intitulée A Rose is a Rose is the Last Rose of Summer , l’exposition se compose de tirages, d’ensembles"", 'comme les Rencontres d’Arles, Paris Photo, le Mois de la Photographie à Montréal, mais aussi dans des institutions comme le Centre Pompidou, la Bibliothèque Nationale de France, le Musée des techniques de Dresde, la Fondation Ehrhardt à Berlin, le Goethe Institut à Paris, le Frac Normandie Rouen, le CRP/Douchy-les-Mines ou la Maison Rouge. Isabelle Le Minh enseigne à la Haute école des arts du Rhin à Strasbourg, son travail est représenté par la galerie Christophe Gaillard.', 'de France, le Musée des techniques de Dresde, la Fondation Ehrhardt à Berlin, le Goethe Institut à Paris, le Frac Normandie Rouen, le CRP/Douchy-les-Mines ou la Maison Rouge. Isabelle Le Minh enseigne à la Haute école des arts du Rhin à Strasbourg, son travail est représenté par la galerie Christophe Gaillard.', ""L'événement Sam'di en famille autour de l'exposition d'Isabelle Le Minh,  A Rose is a Rose is the Last Rose of Summer a lieu au Centre photographique d'Île-de-France dans la ville de Pontault-Combault. Date : le 12/12/2026 (décembre 2026) de 15h00 à 16h00. Description : Le Centre Photographique imagine des visites interactives afin de partager un moment plein de surprises. Résoudre une énigme, se laisser absorber par le récit d’un conte, manipuler un appareil photo, laisser filer son stylo sur un carnet de croquis… Accompagnées par un·e médiateur·rice, les familles sont conviées à se réunir autour des œuvres pour s’immerger de manière sensible et ludique dans l’univers des artistes. Ouvert à tous et à toutes, à partir de 5 ans, Gratruit, réservation obligatoire"", ""L'événement Sam'di en famille autour de l'exposition d'Isabelle Le Minh,  A Rose is a Rose is the Last Rose of Summer a lieu au Centre photographique d'Île-de-France dans la ville de Pontault-Combault. Date : le 10/10/2026 (octobre 2026) de 15h00 à 16h00. Description : Le Centre Photographique imagine des visites interactives afin de partager un moment plein de surprises. Résoudre une énigme, se laisser absorber par le récit d’un conte, manipuler un appareil photo, laisser filer son stylo sur un carnet de croquis… Accompagnées par un·e médiateur·rice, les familles sont conviées à se réunir autour des œuvres pour s’immerger de manière sensible et ludique dans l’univers des artistes. Ouvert à tous et à toutes, à partir de 5 ans Gratuit, sur réservation"", ""L'événement La révélation photographique (titre provisoire) a lieu au Frac Île-de-France, Les Réserves dans la ville de Romainville. Événement récurrent : 69 occurrences du 20/03/2027 au 17/07/2027. Mois concernés : avril 2027, juillet 2027, juin 2027, mai 2027, mars 2027. Description : Le Frac Ile-de-France célèbrera au printemps 2027 le Bicentenaire de la Photographie en proposant plusieurs expositions et de nombreux événements et ateliers autour du médium : une exposition collective aux Réserves (Romainville) et des projets monographiques au Plateau (Paris) dont le commissariat sera ssuré par Garance Chabert, ainsi qu’un programme hors les murs sur le territoire francilien, associés à des actions pédagogiques et événementielles. Le projet d’exposition propose de plonger dans le bain"", ""L'événement Mémoires du paysage Caroline Bouyer – Ariane Fruit a lieu au Musée d'art et d'histoire Louis Senlecq dans la ville de L'Isle-Adam. Dates : le 19/09/2026 (septembre 2026) ; le 20/09/2026 (septembre 2026). Description : Exposition consacrée à l’oeuvre gravé et dessiné de Caroline Bouyer et d’Ariane Fruit. Les gravures de Caroline Bouyer, représentant les abords de voies ferrées, les chantiers parisiens, les portes du périphérique ou encore les hauts fourneaux de Dunkerque, entrent en dialogue avec les oeuvres d’Ariane Fruit, qui évoquent des vues nocturnes de Paris, les paysages de la petite ceinture et l’interminable rue de Rome. Les espaces industrialo-urbains, laissent ensuite place à l’immensité des forêts canadiennes et aux plages et falaises normandes, dessinées et gravées"", ""L'événement Visite commentée du dimanche de l'exposition d'Isabelle Le Minh,  A Rose is a Rose is the Last Rose of Summer a lieu au Centre photographique d'Île-de-France dans la ville de Pontault-Combault. Événement récurrent : 11 occurrences du 04/10/2026 au 13/12/2026. Mois concernés : décembre 2026, novembre 2026, octobre 2026. Description : Visite commentée gratuite de l'exposition d'Isabelle Le Minh, A Rose is a Rose is the Last Rose of Summer Chaque dimanche à 15h"", ""L'événement Visite commentée pour les groupes de l'exposition d'Isabelle Le Minh, A Rose is a Rose is the Last Rose of Summer a lieu au Centre photographique d'Île-de-France dans la ville de Pontault-Combault. Événement récurrent : 44 occurrences du 06/10/2026 au 18/12/2026. Mois concernés : décembre 2026, novembre 2026, octobre 2026. Description : Adaptée au niveau, à la nature de votre groupe et aux objectifs pédagogiques que vous poursuivez, ces visites prennent la forme d'un échange autour des oeuvres. Elles s'appuient sur l'apprentissage du regard et visent à mettre en lumière les enjeux de l'exposition. Gratuit / Adhésion obligatoire (32 euros pour la classe) Durée : 45min - 1h""]","Voici 1 événement :

1. **Exposition monographique d'Isabelle Le Minh, A Rose is a Rose is the Last Rose of Summer** | Du 03/10/2026 au 20/12/2026 | Centre photographique d'Île-de-France, Pontault-Combault | Dans le cadre des célébrations du Bicentenaire de la Photographie, cette exposition présente des tirages, des ensembles installatifs et des dispositifs variés de l'artiste Isabelle Le Minh.","L'exposition monographique d'Isabelle Le Minh ""A Rose is a Rose is the Last Rose of Summer"" a lieu au Centre photographique d'Île-de-France à Pontault-Combault, du 3 octobre au 20 décembre 2026.",0.9090909090909091,1.0,0.7742154261370328
Quel escape game musical a lieu à Fontainebleau le 5 juin 2026 ?,"[""L'événement La dernière tendance musicale a lieu au Mines Paris - Université PSL dans la ville de Fontainebleau. Dates : le 05/06/2026 (juin 2026) ; le 05/06/2026 (juin 2026). Description : Au travers d’un Escape Game, vous êtes invités à résoudre plusieurs énigmes autour d’un questionnement permettant d’explorer la mode dans ses acceptions. A la croisée des différentes formes d’arts, et avec la complicité de quelques créateurs célèbres spécialement invités pour l’occasion, cet atelier vous proposera une immersion pédagogique et ludique. Salle informatique du bâtiment S"", ""L'événement Défilé de mode en musique - Orchestre à l'école et le LAB de Teddy Parra a lieu au Château de Fontainebleau - salle de Bal dans la ville de Fontainebleau. Dates : le 07/06/2026 (juin 2026) ; le 07/06/2026 (juin 2026). Description : Accompagnés par les comédiens Béatrice Fontaine et Loïc Auffret, les étudiants du LAB de Teddy Parra présentent leurs créations lors d’un défilé mis en musique grâce aux élèves du collège Jean Rostand de Cazaubon (Gers) et l’association Orchestre à l’École. Mêlant inspirations historiques et création contemporaine, créateurs, mannequins et musiciens font revivre la féerie carnavalesque d’un château dont Napoléon disait qu’il avait « la forme et la couleur du temps »."", ""L'événement Fête de la musique à Fontainebleau a lieu au Centre-Ville, 77300 FONTAINEBLEAU dans la ville de Fontainebleau. Date : le 21/06/2026 (juin 2026) de 19h00 à 23h59. Description : Vous ne l’avez peut-être pas vu venir… et pourtant, l’été est déjà à nos portes ! Pour célébrer son arrivée comme il se doit, la Fête de la musique investit les rues de Fontainebleau pour une soirée placée sous le signe du rythme et de la convivialité, dimanche 21 juin de 19h à minuit. Le centre-ville piéton se transforme en véritable scène à ciel ouvert, où chacun peut découvrir gratuitement des artistes et groupes, confirmés ou émergents, tous styles confondus. Que vous soyez fan de rock, de jazz, de pop ou d’électro, il y en aura pour toutes les oreilles ! Rendez-vous sur les grandes places de la ville"", ""L'événement Numérisation patrimoniale : accompagner, innover, transmettre a lieu au Château de Fontainebleau - quartier Henri IV, grande salle dans la ville de Fontainebleau. Date : le 05/06/2026 (juin 2026) de 17h00 à 18h15. Description : Accompagner, innover, transmettre. Quels sont les défis de la numérisation ?"", ""L'événement Médiation culturelle et outils numériques a lieu au Château de Fontainebleau - quartier Henri IV, grande salle dans la ville de Fontainebleau. Date : le 05/06/2026 (juin 2026) de 14h15 à 15h45. Description : Comment attirer de nouveaux publics dans les lieux culturels et enrichir l’expérience de visite ? Quels enjeux et impacts pour les lieux culturels ?"", ""L'événement Le théâtre Impérial a lieu au Château de Fontainebleau - départ entrée du Château, cour d’Honneur dans la ville de Fontainebleau. Dates : le 05/06/2026 (juin 2026) ; le 06/06/2026 (juin 2026) ; le 06/06/2026 (juin 2026) ; le 07/06/2026 (juin 2026) ; le 07/06/2026 (juin 2026). Description : Inauguré en 1857, ce joyau du Second Empire a été aménagé par l’architecte Hector Lefuel à la demande de Napoléon III. Récemment restauré, le théâtre dévoile toute la richesse et la délicatesse de son décor. Les places pour les visites guidées sont distribuées gratuitement au kiosque situé dans la cour d’Honneur du Château."", ""L'événement Le château de Fontainebleau invite Orchestre à l'École a lieu au Château de Fontainebleau dans la ville de Fontainebleau. Date : le 21/06/2026 (juin 2026) de 13h15 à 15h15. Description : Le château de Fontainebleau invite l'association Orchestre à l'École à proposer quatre concerts dans le Jardin Anglais du musée pour la Fête de la musique ! Au programme, les concerts des orchestres à l'école suivants : ÉCOLE ÉLÉMENTAIRE de PARS LES ROMILLY COLLÈGE CHRISTINE DE PISAN de PERTHES EN GATINAIS ÉCOLE PETIT VAUGIRARD de MONTEREAU FAULT YONNE COLLÈGE LE GRAND CHAMP de GREZ EN BOUERE « Orchestre à l'École » est un dispositif qui transforme une classe en orchestre pendant 3 ans qui défend au quotidien les valeurs de parité, d'égalité, de diversité et d'inclusivité par la création"", ""L'événement Initiation au Jeu de paume a lieu au Château de Fontainebleau - salle du Jeu de Paume dans la ville de Fontainebleau. Dates : le 06/06/2026 (juin 2026) ; le 06/06/2026 (juin 2026) ; le 07/06/2026 (juin 2026) ; le 07/06/2026 (juin 2026). Description : Au cours de démonstrations et d’initiations dans la seule salle historique de Jeu de paume encore en activité en France, le maître-paumier explique l’histoire du « jeu des rois, roi des jeux », ses règles, et les multiples expressions françaises qui en sont issues. Départs toutes les 30 minutes À partir de 7 ans"", ""L'événement Château de Fontainebleau : architecture, décors, collections a lieu au Château de Fontainebleau - tout au long du circuit de visite dans la ville de Fontainebleau. Dates : le 05/06/2026 (juin 2026) ; le 06/06/2026 (juin 2026) ; le 07/06/2026 (juin 2026). Description : Une question ? Les étudiants en histoire de l’art sont présents tout au long du circuit du visite pour vous apporter des explications !"", ""L'événement Les enjeux des bases de données patrimoniales aujourd’hui : production, qualité, cohérence et partage des contenus a lieu au Château de Fontainebleau - quartier Henri IV, grande salle dans la ville de Fontainebleau. Date : le 05/06/2026 (juin 2026) de 15h45 à 17h00. Description : Les enjeux des bases de données patrimoniales aujourd'hui : production, qualité, cohérence et partage des contenus."", ""L'événement Les goûts et les couleurs a lieu au Château de Fontainebleau - départ kiosque de la cour d'Honneur dans la ville de Fontainebleau. Dates : le 06/06/2026 (juin 2026) ; le 07/06/2026 (juin 2026). Description : Le fil rouge de cette visite est l'art de la couleur. Couleurs maniéristes, couleurs d'apparat mais aussi absence de couleur ou usage du noir. De la galerie de portraits du musée Napoléon à celle de Diane, nous observerons les couleurs des vêtements et des tenues de cour. Couleurs classiques ou improbables, vous serez surpris par les collections de Fontainebleau. Partenariat entre le Château de Fontainebleau, l’INHA et l’École du Louvre."", ""L'événement Couronne...ment ? Têtes d'or et de pouvoir a lieu au Château de Fontainebleau - départ kiosque de la cour d'Honneur dans la ville de Fontainebleau. Dates : le 06/06/2026 (juin 2026) ; le 07/06/2026 (juin 2026). Description : La visite traitera des couronnements humains et divins, à travers les cérémonies mais aussi leurs traces matérielles, notamment la plus emblématique : la couronne. Partenariat entre le Château de Fontainebleau, l’INHA et l’École du Louvre.""]","Voici 1 événement :

1. **La dernière tendance musicale** | 05/06/2026 à 12h45 | Mines Paris - Université PSL, Fontainebleau | Au travers d’un Escape Game, vous êtes invités à résoudre plusieurs énigmes autour d’un questionnement permettant d’explorer la mode dans ses acceptions. À la croisée des différentes formes d’arts, et avec la complicité de quelques créateurs célèbres, cet atelier vous proposera une immersion pédagogique et ludique. Salle informatique du bâtiment S.","""La dernière tendance musicale"", un escape game, a lieu à Mines Paris - Université PSL à Fontainebleau, le 5 juin 2026.",0.9166666666666666,1.0,0.555756169147952
"Quand a lieu ""Bibliambuler au domaine Brialy"" à Monthyon ?","[""L'événement Visite théâtralisée aux chandelles a lieu au Domaine Jean-Claude Brialy dans la ville de Monthyon. Dates : le 23/05/2026 (mai 2026) ; le 23/05/2026 (mai 2026) ; le 23/05/2026 (mai 2026) ; le 23/05/2026 (mai 2026) ; le 23/05/2026 (mai 2026). Description : Pour la nuit des musées, les élèves du théâtre Gérard Philippe de Meaux prêtent leur voix à la maison de Jean-Claude Brialy. Venez écouter ses confidences à la lueur des chandelles qui, du portail au théâtre des Petits Bouffes, et en passant par le rez-de-chaussée, vous replongeront dans l'histoire de cette demeure. Accès sur réservation uniquement sur www.meaux-marne-ourcq.com L'accueil s'effectuera au portail. ATTENTION : TOUTES LES VISITES AFFICHENT COMPLET""]",Je n'ai pas trouvé d'événement correspondant à votre demande.,"""Bibliambuler au domaine Brialy"" a lieu au Domaine Jean-Claude Brialy à Monthyon, le 15 juillet 2026 de 10h à 17h.",0.5,0.0,0.1888161511768645
"Où se déroule ""Lecture au Jardin"" à Saint-Cloud ?","[""L'événement Lecture au Jardin a lieu au Domaine national de Saint-Cloud dans la ville de Saint-Cloud. Dates : le 07/07/2026 (juillet 2026) ; le 21/07/2026 (juillet 2026) ; le 04/08/2026 (août 2026). Description : Assis dans l’herbe, à l’ombre des bosquets du domaine national de Saint-Cloud, écoutez des contes pour petits et grands, dans le cadre de Partir en livre, qui célèbre cette année « Nos petits et grands héros »."", ""L'événement Exposition photographique : Châteaux, villas et folies. Villégiature en Île-de-France a lieu au Domaine national de Saint-Cloud dans la ville de Saint-Cloud. Événement récurrent : 62 occurrences du 30/06/2026 au 30/08/2026. Mois concernés : août 2026, juillet 2026, juin 2026. Description : Découvrez une exposition de photographies, présentée en plein air dans le cadre intime du jardin de Valois. La villégiature, cette pratique consistant à séjourner dans une résidence secondaire pour les loisirs, a façonné le paysage francilien depuis le XVIIe siècle. Des châteaux et demeures aux maisons de campagne ou aux résidences d’artistes, l'architecture de la villégiature en Île-de-France témoigne de l'évolution des modes de vie et des goûts esthétiques. Par une ouverture sur le fleuve,"", ""L'événement Le problème lapin, cartographie 7 a lieu au Les 3 Pierrots dans la ville de Saint-Cloud. Date : le 16/03/2027 (mars 2027) de 20h30 à 21h55. Description : Le problème lapin, cartographie 7 Ou comment le lapin pose des questions vraiment très intéressantes pour comprendre tout un tas de choses du monde d’aujourd’hui (Homo sapiens, l’écologie, le virus et la parenthèse) Création 2021 Du clapier à l’élevage industriel, de l’espèce invasive ayant détruit de nombreux écosystèmes aux résistants de Kerguelen, de celui envoyé dans l’espace en 1959 par les Russes aux victimes du tueur en série des côtes d’Armor, des peluches qui posent joyeusement sur les lits de nos enfants à celles que nous finirons par manger et boire au fur et à mesure qu’il pleut du plastique, les lapins ne cessent"", 'Paris Avec le soutien du Département de la Seine et Marne et de la \u200bDRAC Île-de-France – Ministère de la Culture et de la Communication dans le cadre du plan de relance. La compagnie Vertical Détour est conventionnée par la Région Île-de-France et la DRAC Île-de-France – Ministère de la Culture et de la Communication. Elle est accueillie en résidence au Centre de Réadaptation de Coubert – établissement de l’UGECAM Île-de-France.', 'esthétiques. Par une ouverture sur le fleuve, la forêt ou le paysage, la maison de campagne offre une échappée loin du vacarme de la ville. La Région Île-de-France a conduit un inventaire de ces maisons de campagne autour de Paris dont voici une sélection représentative, du château aristocratique à la villa éclectique en passant par les très originales folies.', 'qu’il pleut du plastique, les lapins ne cessent d’interroger les limites de notre monde. Parés de nombreux maux, ils seraient devenus l’un des signes de la mauvaise santé planétaire, le marqueur des processus d’appauvrissement et d’extinction du vivant, et in fine d’eux-mêmes ? Mais les lapins sont-ils vraiment aussi crétins ? La question est évidemment essentielle. Interprétations De Frédéric Ferrer Avec la complicité d’Hélène Schwartz pour mener l’enquête et penser lapin Avec Frédéric Ferrer et Hélène Schwartz Régie générale et construction Paco Galan Accessoires - Scénographie Margaux Folléa Costumes Anne Buguet Masques Sébastien Baille et Einat Landais Mentions Production : Compagnie Vertical Détour Co-production : Maison des Métallos, Paris Avec le soutien du Département de la Seine']","Voici 1 événement :

1. **Lecture au Jardin** | 21/07/2026 | Domaine national de Saint-Cloud, Saint-Cloud | Assis dans l’herbe, à l’ombre des bosquets du domaine national de Saint-Cloud, écoutez des contes pour petits et grands, dans le cadre de Partir en livre, qui célèbre cette année « Nos petits et grands héros ».","""Lecture au Jardin"" a lieu au Domaine national de Saint-Cloud, les 7, 21 juillet et 4 août 2026.",0.8888888888888888,1.0,0.4580251858148682
Quand a lieu le Festival Connexion à Poligny le 4 juillet 2026 ?,"[""L'événement Festival connexion – Ateliers collectifs a lieu au L'autre Paradis dans la ville de Poligny. Date : le 04/07/2026 (juillet 2026) de 10h00 à 21h00. Description : ATELIERS COLLECTIFS (compris dans le pass complet) 10h Ouverture 10h30 Qi Gong (Mireille Josselin)... pelouse 11h Atelier aquarelle (Vela Moric)... grand bassin 11h Cérémonie du thé (Cécile Nguyen)...barge flottante 6 personnes 11h Rebozo (Justine doula louve)... plage 11h30 Connexion créative à la nature (Severine Settier)... déambulatoire 12h Yoga (Myrtille)... pelouse 12h30 Atelier régulation du système nerveux (Margaux Jamet)... plage 12h30 Ecriture intuitive et sensible (Karine Darnet Ginot)... grand bassin 13h00 Cérémonie du thé (Cécile Nguyen)...barge flottante 6 personnes 13h30 Bain sonore (Laurence Franco)..."", ""L'événement Festival connexion – Concerts et spectacles a lieu au L'autre Paradis dans la ville de Poligny. Date : le 04/07/2026 (juillet 2026) de 10h00 à 21h00. Description : 13h terrasse des créateurs: KOUROU FIA (KORA SOLO), PAULINE METAIS (CONTE FORESTIER) 19h scène flottante: MYRTILLE ET AXEL LECOURT, LES LANDRY DUO INVITÉE SURPRISE: LENA KAUFMAN"", ""L'événement Festival connexion – exposants artistes et créateurs a lieu au L'autre Paradis dans la ville de Poligny. Date : le 04/07/2026 (juillet 2026) de 10h00 à 21h00. Description : Sophie Belle (dessins à l’encre de Chine, peinture sur porcelaine) Damien Diche (sculpture, gravure) Anne Huet (aquarelle) Bérangère Noyau (céramique) Isabelle Antier (céramique) Véronique Koffel (emaux) Nina K (bijoux) Lesfoliesdanais (bijoux) Laurence Franco (amor malas) Sophie Leclercq (suspension végétale) Nathalie Allaire (atelier rose: macramé et roses de tissus) Lena Kaufman (mandalas et suncatchers) Zygop (accessoires textiles yoga, méditations faits main) Pauline Métais (livres & nature)"", ""L'événement Festival connexion – Soins individuel en continu a lieu au L'autre Paradis dans la ville de Poligny. Date : le 04/07/2026 (juillet 2026) de 10h00 à 21h00. Description : >Massage assis et massage du visage (Franck, 2 mainsici&maintenant) petite plage >Ventouse et neddling (Bryan Azpurua) temple >Shiatsu (Robin Moss, Temenos santé) maison >Découverte du serrage avec le Rebozo (Justine Doula Louve) rdv à la plage, l’après midi >Tarot, annales akashiques et peinture corporelle (Mariana Barros) pelouse du temple >Pajelança: Soin chamanique brésilien (Rosieli Leal) rdv au belvédère"", 'personnes 13h30 Bain sonore (Laurence Franco)... pelouse 14h Atelier méditation olfactive (Anne Laure Jaffrelo)...atelier 14h Atelier théâtre (Julie Duquenoy)... plage 14h30 Danse méditative (Axelle Descantes)... pelouse 15h Atelier “Le code des émotions"" (Claire Morisseau)... rdv au grand bassin 15h30 Ecriture intuitive et sensible (Karine Darnet Ginot)... grand bassin 15h30 Mandala vocal (Myrtille)... pelouse 16h Atelier théâtre (Julie Duquenoy)... plage 16h Cérémonie du thé (Cécile Nguyen)...barge flottante 6 personnes 16h30 Atelier musique (Axel Lecourt)... pelouse 17h Cérémonie du thé (Cécile NGuyen)... plage 17h30 Yin yoga et violon (Kate Reeves)... pelouse 18h15 Danses universelles de la paix (Laurence Franco et Gyom)... pelouse']","Voici 1 événement :

1. **Festival Connexion** | **04/07/2026 de 10h00 à 21h00** | **L'autre Paradis, Poligny** | Plusieurs activités culturelles (ateliers, concerts, expositions, soins) se déroulent en continu sur cette plage horaire.","Le Festival Connexion a lieu à L'autre Paradis à Poligny, le 4 juillet 2026 de 10h à 21h.",0.9166666666666666,1.0,0.6374804066302238
Où se tient le Festival Jam'iyya à Montreuil le 27 juin 2026 ?,"[""L'événement FESTIVAL JAM’IYYA #4 - LE HOODIE DJS a lieu au Théâtre de Verdure de La Girandole dans la ville de Montreuil. Date : le 27/06/2026 (juin 2026) de 22h00 à 23h00. Description : 4ème ÉDITION DE LA FÊTE DES ARTS ET DES CULTURES AFRICAINES JAM’IYYA, du haoussa et arabe jam’iyya, qui veut dire «rassemblement», «association». Né en 2023 d’un désir de célébrer les arts et cultures africaines en Seine-Saint-Denis. Le festival JAM’IYYA est co organisé avec Lez’Arts dans les Murs sur une journée chaque mois de juin. C’est une journée vibrante aux sons et aux éclats des Afriques, pour un voyage immersif et poétique entre traditions et créations contemporaines. LE HOODIE DJS : SELECTA MAJAYEORIMI / DJ FÉ BLESS’ / DJ POIS’N’MEKO - SCÈNE LEZ’ARTS @lehoodie.djs Né d’une passion commune pour le"", ""L'événement FESTIVAL JAM’IYYA #4 - KANKÉLÉ a lieu au Théâtre de Verdure de La Girandole dans la ville de Montreuil. Date : le 27/06/2026 (juin 2026) de 21h30 à 22h30. Description : 4ème ÉDITION DE LA FÊTE DES ARTS ET DES CULTURES AFRICAINES JAM’IYYA, du haoussa et arabe jam’iyya, qui veut dire «rassemblement», «association». Né en 2023 d’un désir de célébrer les arts et cultures africaines en Seine-Saint-Denis. Le festival JAM’IYYA est co organisé avec Lez’Arts dans les Murs sur une journée chaque mois de juin. C’est une journée vibrante aux sons et aux éclats des Afriques, pour un voyage immersif et poétique entre traditions et créations contemporaines. KANKÉLÉ : Afrobeat mandingue, folk jazz- SCÈNE GIRANDOLE @kankele_essential.groove Kankélé fait son grand retour avec un 2e album « Bala"", ""L'événement FESTIVAL JAM’IYYA #4 - CIE L’ÊTRE-LOUVE a lieu au Théâtre de Verdure de La Girandole dans la ville de Montreuil. Date : le 27/06/2026 (juin 2026) de 15h30 à 16h30. Description : 4ème ÉDITION DE LA FÊTE DES ARTS ET DES CULTURES AFRICAINES JAM’IYYA, du haoussa et arabe jam’iyya, qui veut dire «rassemblement», «association». Né en 2023 d’un désir de célébrer les arts et cultures africaines en Seine-Saint-Denis. Le festival JAM’IYYA est co organisé avec Lez’Arts dans les Murs sur une journée chaque mois de juin. C’est une journée vibrante aux sons et aux éclats des Afriques, pour un voyage immersif et poétique entre traditions et créations contemporaines. CIE L’ÊTRE-LOUVE « À quelque part » : Danse, performance - SCÈNE GIRANDOLE @ettre_louve"", ""L'événement FESTIVAL JAM’IYYA #4 - TRINITY a lieu au Théâtre de Verdure de La Girandole dans la ville de Montreuil. Date : le 27/06/2026 (juin 2026) de 17h30 à 18h30. Description : 4ème ÉDITION DE LA FÊTE DES ARTS ET DES CULTURES AFRICAINES JAM’IYYA, du haoussa et arabe jam’iyya, qui veut dire «rassemblement», «association». Né en 2023 d’un désir de célébrer les arts et cultures africaines en Seine-Saint-Denis. Le festival JAM’IYYA est co organisé avec Lez’Arts dans les Murs sur une journée chaque mois de juin. C’est une journée vibrante aux sons et aux éclats des Afriques, pour un voyage immersif et poétique entre traditions et créations contemporaines. TRINITY : Reggae et afrobeat - SCÈNE GIRANDOLE @trinity_rebel_purple Issue d’une famille d’artistes, elle grandit en écoutant diverses"", ""L'événement FESTIVAL JAM’IYYA #4 - AMINA ANNABI a lieu au Théâtre de Verdure de La Girandole dans la ville de Montreuil. Date : le 27/06/2026 (juin 2026) de 18h30 à 19h30. Description : 4ème ÉDITION DE LA FÊTE DES ARTS ET DES CULTURES AFRICAINES JAM’IYYA, du haoussa et arabe jam’iyya, qui veut dire «rassemblement», «association». Né en 2023 d’un désir de célébrer les arts et cultures africaines en Seine-Saint-Denis. Le festival JAM’IYYA est co organisé avec Lez’Arts dans les Murs sur une journée chaque mois de juin. C’est une journée vibrante aux sons et aux éclats des Afriques, pour un voyage immersif et poétique entre traditions et créations contemporaines. AMINA ANNABI : world music/Arabo-andalou - SCÈNE LEZ’ARTS @amina.annabi.officiel Amina ou Amina Annabi est une chanteuse et actrice"", ""L'événement FESTIVAL JAM’IYYA #4 - BORIS M a lieu au Théâtre de Verdure de La Girandole dans la ville de Montreuil. Date : le 27/06/2026 (juin 2026) de 19h30 à 20h30. Description : 4ème ÉDITION DE LA FÊTE DES ARTS ET DES CULTURES AFRICAINES JAM’IYYA, du haoussa et arabe jam’iyya, qui veut dire «rassemblement», «association». Né en 2023 d’un désir de célébrer les arts et cultures africaines en Seine-Saint-Denis. Le festival JAM’IYYA est co organisé avec Lez’Arts dans les Murs sur une journée chaque mois de juin. C’est une journée vibrante aux sons et aux éclats des Afriques, pour un voyage immersif et poétique entre traditions et créations contemporaines. BORIS M - Afro Soul - SCÈNE GIRANDOLE @borism_off Boris M, c’est la soul africaine dans toute sa splendeur. Né en Côte d’Ivoire, bercé"", ""L'événement FESTIVAL JAM’IYYA #4 - MAMKO & WENBENEDO a lieu au Théâtre de Verdure de La Girandole dans la ville de Montreuil. Date : le 27/06/2026 (juin 2026) de 16h30 à 17h30. Description : 4ème ÉDITION DE LA FÊTE DES ARTS ET DES CULTURES AFRICAINES JAM’IYYA, du haoussa et arabe jam’iyya, qui veut dire «rassemblement», «association». Né en 2023 d’un désir de célébrer les arts et cultures africaines en Seine-Saint-Denis. Le festival JAM’IYYA est co organisé avec Lez’Arts dans les Murs sur une journée chaque mois de juin. C’est une journée vibrante aux sons et aux éclats des Afriques, pour un voyage immersif et poétique entre traditions et créations contemporaines. MAMKO & WENBENEDO : duo magique de Kora - SCÈNE LEZ’ARTS @mamko_officiel @the.wenbenedo Tombé amoureux de cette harpe d’Afrique"", ""L'événement FESTIVAL JAM’IYYA #4 - MANDA SIRA a lieu au Théâtre de Verdure de La Girandole dans la ville de Montreuil. Date : le 27/06/2026 (juin 2026) de 20h30 à 21h30. Description : 4ème ÉDITION DE LA FÊTE DES ARTS ET DES CULTURES AFRICAINES JAM’IYYA, du haoussa et arabe jam’iyya, qui veut dire «rassemblement», «association». Né en 2023 d’un désir de célébrer les arts et cultures africaines en Seine-Saint-Denis. Le festival JAM’IYYA est co organisé avec Lez’Arts dans les Murs sur une journée chaque mois de juin. C’est une journée vibrante aux sons et aux éclats des Afriques, pour un voyage immersif et poétique entre traditions et créations contemporaines. MANDA SIRA : Chanteuse franco-malienne aux influences musicales afro-mandingue - SCÈNE LEZ’ARTS @manda_sira Manda Sira, de son vrai"", ""L'événement Découverte guidée des Murs à Pêches a lieu au Jardin de l'Association des Murs à Pêches dans la ville de Montreuil. Date : le 07/06/2026 (juin 2026) de 16h30 à 17h00. Description : A la découverte des murs à pêches, visite déambulatoire."", ""L'événement FESTA DE SÃO JOÃO a lieu au La Finca - Montreuil dans la ville de Montreuil. Date : le 21/06/2026 (juin 2026) de 15h00 à 18h30. Description : Une après-midi brésilienne pour les enfants : contes, jeux traditionnels, goûter et concert de forró live."", ""L'événement Portes ouvertes au jardin Pouplier : Visite découverte a lieu au Jardin Pouplier dans la ville de Montreuil. Date : le 07/06/2026 (juin 2026) de 13h00 à 19h00. Description : Venez flâner dans notre magnifique jardin, en plein coeur des murs à pêches, dimanche 7 juin de 13h à 19h, et profiter de notre vente de compost biologique et de plants - potagères, aromatiques, fleurs - produites par nos soins. A 17h00, concert de la chorale des Babayagas"", ""L'événement Festival Sous Les Pêchers La Plage #16 a lieu au Théâtre de Verdure de La Girandole dans la ville de Montreuil. Dates : le 06/06/2026 (juin 2026) ; le 07/06/2026 (juin 2026). Description : Le Théâtre de Verdure de La Girandole ouvre ses portes les 6 et 7 juin pour la 16e édition de son festival « Sous les Pêchers, la Plage » , Accompagné de bonnes doses de bonheur, de partage, de vivre-ensemble et d’émotions ! Du 6 au 7 juin 2026, nous allons faire vibrer la ville aux rythmes de la musique, aux pas de la danse, aux paroles du théâtre, aux acrobaties du cirque. Pour cela, nous vous avons concocté une programmation populaire, paritaire, et surtout accessible à tous.tes. « Sous les Pêchers, la Plage #16 » c’est : deux jours de fête, une dizaine d’artistes, une cinquantaine de""]","Voici 1 événement :

1. **FESTIVAL JAM’IYYA #4** | 27/06/2026 (toute la journée) | Théâtre de Verdure de La Girandole, Montreuil | 4ème édition de la fête des arts et des cultures africaines, avec plusieurs scènes et artistes.","Le Festival Jam'iyya #4 a lieu au Théâtre de Verdure de La Girandole à Montreuil, le 27 juin 2026 de 15h30 à 16h30.",0.8888888888888888,1.0,0.5326467165181918
Quand a lieu l'exposition d'Hugo Béhérégaray à Chaussy en juin 2026 ?,"[""L'événement Exposition d'Hugo Béhérégaray a lieu au Domaine de Villarceaux dans la ville de Chaussy. Événement récurrent : 11 occurrences du 10/06/2026 au 21/06/2026. Mois concernés : juin 2026. Description : Cette exposition présente des œuvres conçues depuis janvier 2026 par quelque 200 enfants et parents du territoire du Vexin lors d'ateliers avec l’artiste Hugo Béhérégaray, en résidence au domaine de Villarceaux. Le thématique de ces créations est « Qu’est-ce qui nous nourrit ? » Une question qui invite à se demander de quelle nourriture nous avons besoin pour vivre sur le plan alimentaire, mais aussi intellectuel, culturel, spirituel... Cette opération comprenant ateliers et exposition est organisée chaque année par La Source Garouste-Villarceaux avec la Direction régionale des"", ""L'événement Construction d'un four céramique a lieu au Domaine de Villarceaux dans la ville de Chaussy. Date : le 20/06/2026 (juin 2026) de 14h00 à 22h00. Description : Judicaël Eymard , artiste en résidence à Villarceaux, vous propose d'assister à la construction puis à la toute première cuisson d’un four à bois dédié à la céramique. Cet événement en deux parties devait se dérouler intégralement le week-end des 20 et 21 juin 2026. Mais seule la première, prévue le 20 juin 2026, est maintenue, celle du 21 juin 2026 étant reportée au 4 juillet 2026 en raison de fortes chaleurs annoncées. Judicaël Eymard vous propose à chacune des deux dates un temps d’échange autour de son projet d’œuvre-refuge mené avec la Ligue de protection des oiseaux . Une expérience expérimentale au service du vivant,"", ""L'événement Atelier céramique a lieu au Domaine de Villarceaux dans la ville de Chaussy. Date : le 07/06/2026 (juin 2026) de 13h30 à 17h30. Description : Dans le cadre du programme régional de résidence d’artistes de la Région Île-de-France et en lien avec la Ligue de protection des oiseaux, Judicaël Eymard propose un atelier de poterie ouvert aux adultes et aux enfants. Ce moment de partage sera l’occasion de concevoir des petites créations autour de la question de l’œuvre‑refuge. Cela pourra être une mangeoire, un nid ou un objet ayant l’intention de devenir un refuge pour la faune ou la flore. Au-delà de la transmission des techniques de l’artiste, cet atelier sera l’occasion d’échanges autour de son projet de recherche au service du vivant. Les pièces seront ensuite cuites dans un four"", ""L'événement Les Historiques de Villarceaux a lieu au Domaine de Villarceaux dans la ville de Chaussy. Dates : le 06/06/2026 (juin 2026) ; le 07/06/2026 (juin 2026). Description : Le temps d’un week-end, les 6 et 7 juin 2026, le domaine de Villarceaux vous invite à parcourir l’Histoire, du Moyen Âge au XIXe siècle. Reconstitutions, spectacles, concerts, animations, escape game... De 11h à 18h De la tour Saint‑Nicolas au salon de musique du château du XVIIIe siècle, vous déambulerez entre reconstitution de campements, spectacles, concerts, animations en famille et démonstrations d’activités d’époque. La cour du manoir de Ninon, transformée en marché d’autrefois, accueillera échoppes d’artisans, produits de bouche, ainsi que la présentation de plusieurs métiers de l’histoire. À cette"", ""L'événement Découverte de l’apiculture a lieu au Domaine de Villarceaux dans la ville de Chaussy. Dates : le 13/06/2026 (juin 2026) ; le 27/06/2026 (juin 2026) ; le 22/08/2026 (août 2026) ; le 29/08/2026 (août 2026). Description : Le domaine de Villarceaux vous invite à découvrir le monde extraordinaire et fragile des abeilles, vigies de l’environnement et gardiennes de notre vie sur terre. En compagnie de Michel Amé, apiculteur du domaine, apprenez les étapes théoriques (en salle) et pratiques (au rucher, en petit groupe de 16 personnes). Tenues de protection fournies (taille minimum : 1,10 m). Malgré toutes les précautions prises, cette initiation ne convient pas aux personnes allergiques aux piqûres. L’atelier pourra être annulé si les conditions météorologiques ne sont pas favorables à"", ""L'événement Balade au crépuscule a lieu au Domaine de Villarceaux dans la ville de Chaussy. Date : le 20/06/2026 (juin 2026) de 21h30 à 23h00. Description : À la nuit tombante, la magie règne au domaine de Villarceaux. Dans le cadre des Nuits des forêts, Judicaël Eymard , artiste plasticien en résidence, propose « Artiste migrateur, être oiseau », une déambulation à travers les bois du domaine. Il y décrit son engagement d’artiste et le voyage qu'il a entrepris au service du vivant, et des oiseaux en particulier, avec son projet d’œuvre-refuge, développé avec la Ligue de protection des oiseaux et la Région Île-de-France. Dans les jardins du domaine. Réservation obligatoire."", ""L'événement Découverte de l’apiculture avec un apiculteur agréé a lieu au Domaine régional de Villarceaux dans la ville de Chaussy. Dates : le 27/06/2026 (juin 2026) ; le 22/08/2026 (août 2026) ; le 29/08/2026 (août 2026). Description : Le domaine de Villarceaux vous invite à découvrir le monde extraordinaire et fragile des abeilles, vigies de l’environnement et gardiennes de notre vie sur terre. En compagnie de Michel Amé, apiculteur du domaine, découvrez les étapes théoriques (en salle) et pratiques (au rucher, en petit groupe de16 personnes). Le miel de M. Amé a été médaillé d’or au concours régional des miels d’Île‑de‑France ! Tenues de protection fournies (taille minimum : 1,10 m). Malgré toutes les précautions prises, cette initiation ne convient pas aux personnes allergiques aux"", ""L'événement Visites commentées du domaine a lieu au Domaine de Villarceaux dans la ville de Chaussy. Événement récurrent : 62 occurrences du 04/04/2026 au 01/11/2026. Mois concernés : août 2026, avril 2026, juillet 2026, juin 2026, mai 2026, novembre 2026, octobre 2026, septembre 2026. Description : Chaque samedi (à 14h30) et chaque dimanche (à 14h30 et 15h30), offrez-vous une visite commentée du domaine, dont son plus beau trésor : le manoir qui abrita, pendant 3 ans au milieu du XVIIe siècle, les amours de Louis de Mornay, marquis de Villarceaux, et de Ninon de Lenclos. Des guides conférenciers vous dévoilent les secrets du manoir de Ninon, mais aussi du jardin des Sorcières ou encore de la fontaine de Jouvence. Au-delà de ces visites commentées, le domaine propose un nouveau parcours de"", ""L'événement Les Samedis à la campagne a lieu au Domaine de Villarceaux dans la ville de Chaussy. Date : le 13/06/2026 (juin 2026) de 11h00 à 22h00. Description : Les samedis à la campagne du domaine de Villarceaux, ce sont des journées qui combinent à un pique-nique divers événements tels qu'expo, spectacle ou concert... Déjeuner sur l’herbe À partir de 11h Forêts, vallons, champs de culture, grandes étendues d’herbe... : venez pique-niquer exceptionnellement dans le paysage bucolique du domaine de Villarceaux labellisé « Jardin remarquable ». Opération Villarceaux sans déchet : apportez votre pique-nique, remportez vos déchets ! Dans les jardins du domaine. Restauration sur place. Concert « Être oiseau III » - Ensemble Soundinitiative avec Grégoire Lorieux À 16h et 17h30 (durée : 45 min)"", ""L'événement ensemble soundinitiative & Grégoire Lorieux : ÊTRE OISEAU a lieu au Domaine régional de Villarceaux (Chaussy-95) dans la ville de Chaussy. Date : le 13/06/2026 (juin 2026) de 16h30 à 18h30. Description : Imaginez : vous êtes dans une forêt. Vous fermez les yeux. Autour de vous, les oiseaux chantent. Chacun a son territoire, sa place dans l'espace. Ils s'écoutent, se répondent, se déplacent. Et si, vous aussi, vous deveniez oiseau ? C'est ce que nous vous proposons : un moment magique où petits et grands se transforment en oiseaux. On vous donne un petit instrument – un triangle, un woodblock, un gong – et hop ! vous voilà avec votre propre chant. Vous choisissez votre territoire dans la forêt, vous écoutez les autres, vous leur répondez. Pendant ce temps, trois musicien.ne.s"", ""L'événement Visites commentées du domaine a lieu au Domaine régional de Villarceaux dans la ville de Chaussy. Événement récurrent : 20 occurrences du 27/06/2026 au 30/08/2026. Mois concernés : août 2026, juillet 2026, juin 2026. Description : Le manoir de Ninon, le jardin des Sorcières, les secrets cachés de la fontaine de Jouvence, nos guides vous dévoileront les mystères que recèle le domaine. Le domaine de Villarceaux vous propose également un parcours de visite du château du Haut, des aides à la visite et des plans‑parcours destinés aux enfants sont disponibles à l’accueil du domaine. Alors, suivez nos guides ! Samedi : départ de visite à 14h30 Dimanche : départs de visite à 14h30 et 15h30"", ""L'événement Ateliers de pratique artistique a lieu au Domaine régional de Villarceaux dans la ville de Chaussy. Événement récurrent : 45 occurrences du 29/06/2026 au 28/08/2026. Mois concernés : août 2026, juillet 2026, juin 2026. Description : Créée à l’initiative du peintre Gérard Garouste, La Source Garouste-Villarceaux est une association d’intérêt général à vocation sociale et éducative. Elle oeuvre en faveur des enfants, des adolescents et de leurs familles, en plaçant la création artistique au coeur du développement individuel et collectif. Elle propose une programmation d’ateliers et de stages artistiques ouverts à ces publics, tout au long de l’année et pendant les vacances scolaires. - Ateliers enfants (6-12 ans) : stages à la semaine, du lundi au vendredi, de 10h à 16h, encadrés""]","Voici 1 événement :

1. **Exposition d'Hugo Béhérégaray** | Du **10/06/2026 au 21/06/2026** (11 occurrences) | **Domaine de Villarceaux, Chaussy** | Exposition présentant des œuvres créées par 200 enfants et parents du Vexin lors d'ateliers avec l’artiste, autour du thème *« Qu’est-ce qui nous nourrit ? »*. Organisé par La Source Garouste-Villarceaux.","L'exposition d'Hugo Béhérégaray a lieu au Domaine de Villarceaux à Chaussy, du 10 au 21 juin 2026.",0.8888888888888888,1.0,0.504786021627448
"Où se déroule le spectacle ""A. V. C."" à Guyancourt ?","[""L'événement A. V. C. a lieu au Auditorium de La Batterie dans la ville de Guyancourt. Date : le 20/11/2026 (novembre 2026) de 20h30 à 21h30. Description : Fruit d’une aventure inspirante, jalonnée d’obstacles, Artistes Vivants Cabossés délivre un véritable message de résilience et d’humanité. Chutes, attaques cérébrales, isolement, traumatismes divers, coupe budgétaire, cancer. Ce spectacle ne devait pas voir le jour, la résignation devenue indépassable horizon… Et non ! Une surprenante conjugaison de désirs de vie a refusé de se faire une raison. La solidarité, protéiforme et décloisonnée, et l’enthousiasme, ce dieu qui sourd en nous, ont fait éclore un groupe, les Évadé·e·s, composés de personnes touchées par des accidents de la vie et animées de l’envie de transcender leurs séquelles en"", ""L'événement QUINTETTE ANACROUSE a lieu au Eglise Saint Victor dans la ville de Guyancourt. Date : le 14/05/2027 (mai 2027) de 20h30 à 21h30. Description : Flûte, hautbois, clarinette, basson et cor s’unissent pour créer une palette sonore riche, vive et surprenante. Héritière d’une tradition classique, cette formation devient ici un véritable terrain de jeu musical. Au programme : œuvres du répertoire, transcriptions inventives et créations contemporaines. Les cinq musiciens font dialoguer les styles, les époques et les énergies avec une belle complicité. Leur musique, à la fois accessible et exigeante, séduit tous les publics. Un concert à la fois élégant, vivant et terriblement captivant."", 'L\'événement LES PRUNEAUX ET LES PECHES a lieu au La Ferme de Bel Ebat dans la ville de Guyancourt. Date : le 14/05/2027 (mai 2027) de 19h00 à 20h00. Description : Une douzaine de voyageurs se jettent à corps perdu dans la grande aventure de Classe Départ. Une expérience artistique et humaine incomparable ! Quand la quête devient enquête, et qu’un jour, on se demande ce qui c’est passé. On cherche, on cherche le coupable, les coupables, on rassemble les preuves, on constate les dégâts. Cette histoire est celle de jeunes gens qui ne veulent pas que leur vie deviennent un cas irrésolu. ""Un Théâtre qui fait confiance à l\'homme"" - Judith Sibony, Le Monde En partenariat avec l\'Envol, la Sauvegarde des Yvelines et la Mission locale de Saint-Quentin-en-Yvelines', ""L'événement COMMENT CA SE DANSE ? a lieu au La Ferme de Bel Ebat dans la ville de Guyancourt. Date : le 21/05/2027 (mai 2027) de 20h30 à 21h30. Description : Avec humour et poésie, le spectacle célèbre l’incarnation et le plaisir d’être ensemble . Accompagnée de musique vivante, cette parole théâtrale est là pour exprimer la joie des bals trad/folk. On y évoque la danse pour raconter la mise au diapason d'une relation : en duo, en quadrette, en grand cercle. Des instantanés vus du parquet questionnent alors cet espace territoire et la puissance de l'être-ensemble. Pas à pas, un univers se déploie, invitant par d'authentiques sourires à un voyage convivial et jubilatoire. Il s’agit d’une invitation à entrer dans la ronde pour mieux parler du monde. Dans le cadre des tournées Chaînon"", ""L'événement ODYSSEE a lieu au La Batterie Grande Salle dans la ville de Guyancourt. Date : le 30/01/2027 (janvier 2027) de 20h30 à 21h30. Description : Une immersion live dans l’univers de Bowie, entre légende, énergie et émotions. Une soirée inoubliable vous attend, rythmée par ses plus grands titres ! « Ce n’est pas un concert, ce n’est pas un spectacle. Simplement un voyage… Une ODYSSÉE… Dans sa peau… Là où se croisent les marginaux, les étoiles, les débutants, les vieilles âmes, les danseurs, les peureux… » Embarquez pour un voyage musical ! À travers 17 tubes incontournables, l’appel du vide va vous donner le vertige : un plongeon spirituel, une cascade d’émotions, une exploration dans la tête d’un génie aux yeux dépareillés. On a tous un Bowie en nous ! Que vous soyez fan de la"", ""L'événement CONTE DE CROQUE CHAUSSETTES a lieu au Maison De Quartier Auguste Renoir dans la ville de Guyancourt. Date : le 18/11/2026 (novembre 2026) de 16h00 à 17h00. Description : Un spectacle musical de noël pour enfants de 4 à 14 ans et toutes les familles. Tout le monde c’est déjà demandé pourquoi les chaussettes se retrouvent tôt ou tard orpheline. Le syndrome fatal qui fait que l’on se retrouve avec une unique chaussette dont on ne sait plus quoi faire… Problème ! Mais problème bien plus grave, que se passerait-il si une des chaussettes qui disparaissait était une des chaussettes que l’on a disposé sur la cheminée pour que le père noël puisse y déposer nos cadeaux ? Plus de cadeaux ! Quelle horreur ! Il faut à tout prix démêler tout cela avant le soir tant attendu ! Des frères et"", ""L'événement MILLENIUM a lieu au La Ferme de Bel Ebat dans la ville de Guyancourt. Date : le 23/04/2027 (avril 2027) de 20h30 à 21h30. Description : Une création chorégraphique qui explore le passage au troisième millénaire à travers le corps et le mouvement. Entre mémoire et transformation, le spectacle interroge le temps, l’évolution de l’humanité et les futurs possibles. Il tisse un dialogue entre passe et avenir, chaos et harmonie, humain et machine. La danse devient un langage pour imaginer un futur plus lumineux. Un futur ou l’humanité apprend de ses erreurs pour se réinventer. Au cœur de la création : l’accueil des différences et le vivre-ensemble. Un équilibre sensible entre l’individuel et le collectif s’y dessine. Millenium propose une expérience immersive, à la fois visuelle,"", ""L'événement TOUT CONTRE LA TERRE a lieu au La Ferme de Bel Ebat dans la ville de Guyancourt. Date : le 02/04/2027 (avril 2027) de 20h30 à 21h30. Description : Inspirée du témoignage « Tu m’as laissée en vie » de Camille Beaurain, Tout contre la terre porte le récit aussi tendre que poignant de Camille et Augustin, un couple de paysan dans leur combat pour sauver leur exploitation agricole. Camille a 15 ans quand elle tombe amoureuse d'Augustin, son premier amour, éleveur de porcs. Elle s'installe avec lui à la ferme, et découvre que la vie d’éleveur est tout sauf paisible. Entre le travail aux champs, les bêtes, les imprévus sanitaires ou économiques, le couple se retrouve étranglé sous les dettes. Epuisé par ce quotidien insupportable et l’absence d’aide, Augustin met fin à ses jours."", ""L'événement LES COQUETTES a lieu au La Ferme de Bel Ebat dans la ville de Guyancourt. Date : le 11/12/2026 (décembre 2026) de 20h30 à 21h30. Description : Et si la joie n’était pas qu’un sentiment, mais un acte de résistance ? Et s’il ne nous restait plus que ça : la joie et le plaisir. Avec ce nouveau spectacle musical on cherche ensemble, à l’aveugle ou les yeux grands ouverts, le chemin de la jouissance collective. Pas pour fuir le monde. Ni pour le sauver. Mais plutôt pour le traverser en se la kiffant quand même un peu."", ""L'événement OUM PA PA ! OPUS 2 a lieu au La Ferme de Bel Ebat dans la ville de Guyancourt. Date : le 15/12/2026 (décembre 2026) de 20h30 à 21h30. Description : La rencontre ébouriffante entre le plus populaire des instruments et la musique classique, dans un spectacle plein d’humour et de poésie ! Porté par un quatuor féminin audacieux, où l’accordéon se met à rêver d’opéra dans des tableaux surprenants, Oum Pa Pa ! délivre une rencontre musicale inédite. Un récital de rêve, où Bizet côtoie Yann Tiersen et Tchaikovsky tutoie Piazzolla. La technique de haut vol des quatre musiciennes, issues des grands conservatoires nationaux, sert des partitions riches, chaleureuses et tendres. Elles y dévoilent une fantaisie réjouissante à la chorégraphie millimétrée, entre tango, airs d’opéras et"", ""L'événement ANNA G. CONTRE-ENQUETE a lieu au La Ferme de Bel Ebat dans la ville de Guyancourt. Date : le 03/11/2026 (novembre 2026) de 20h30 à 21h30. Description : Ce spectacle part d’une histoire vraie : celle d’Anna Göldi, dernière femme exécutée pour sorcellerie en Europe, en 1782. Mais plutôt que de raconter simplement son destin, le spectacle propose une plongée vivante dans une enquête pleine de zones d’ombre, de récits contradictoires et de mystère. Sur scène, deux journalistes cherchent à reconstituer l’histoire. Ils rejouent, transforment, questionnent les événements, et peu à peu, leur enquête les déplace. Les époques se mêlent, les points de vue glissent, et les spectateurs sont invités à entrer dans cette exploration, entre réalité et imagination. Entre scènes de"", ""L'événement CONSPIRATIONS a lieu au La Ferme de Bel Ebat dans la ville de Guyancourt. Date : le 29/01/2027 (janvier 2027) de 20h30 à 21h30. Description : Un spectacle Immersif unique où le public voyage au 18 siècle à travers l’art du théâtre et du mentalisme. Mystères, sorcellerie, complots… Venez vivre un fascinant voyage dans le temps au cœur d’une incroyable affaire criminelle qui bouleversera le règne de Louix XIV. Nous sommes à Paris, en juin 1709. Nicolas de La Reynie, retraité de son poste d’enquêteur principal du roi Louis XIV, écume depuis des années les salles de spectacle de France et de Navarre pour enseigner les nouvelles techniques de criminologie. Au cours d’une de ces conférences, un évènement inattendu va subitement faire surgir le passé, et confronter Nicolas de la""]","Voici 1 événement :

1. **A. V. C.** | 20/11/2026 de 20h30 à 21h30 | **Auditorium de La Batterie**, Guyancourt | Fruit d’une aventure inspirante, jalonnée d’obstacles, ce spectacle délivre un message de résilience et d’humanité à travers le récit des Évadé·e·s, des personnes touchées par des accidents de la vie.","""A. V. C."" a lieu à l'Auditorium de La Batterie à Guyancourt, le 20 novembre 2026 de 20h30 à 21h30.",0.8571428571428571,1.0,0.6461698895826247
"Quand a lieu ""Este Mundo"" de Bouchra Ouizguen à Paris ?","[""L'événement Este Mundo de Bouchra Ouizguen au Festival d'Automne a lieu au Palais de Chaillot dans la ville de Paris. Dates : le 08/10/2026 (octobre 2026) ; le 09/10/2026 (octobre 2026) ; le 10/10/2026 (octobre 2026). Description : C’est une ode à la tendresse. Avec les danseur·euses de Dançando com a Diferença, Bouchra Ouizguen compose une danse portée par les singularités. Un monde joyeux et simple—non pas naïf, mais nécessaire—qui existe par l’abandon et par l’attention, tourné vers soi, l’autre et le monde. Dans ce monde-ci, la chorégraphe marocaine invite chacun et chacune à entrer, souffle et regard apaisés. Il n’y a rien à prouver. La pièce se construit à partir de gestes simples inspirés par les éléments, et de la manière singulière dont chaque interprète habite le mouvement."", 'L\'événement ""Este Mundo"" de Bouchra Ouizguen et Dançando com a Diferença a lieu au Chaillot - Théâtre national de la Danse dans la ville de Paris. Dates : le 08/10/2026 (octobre 2026) ; le 09/10/2026 (octobre 2026) ; le 10/10/2026 (octobre 2026). Description : Pièce écrite pour 5 interprètes de la compagnie inclusive Dançando com a Diferença, Este Mundo se concentre sur le silence, le souffle et la qualité de la présence. La chorégraphe marocaine Bouchra Ouizguen y déploie une succession de situations marquées par des gestes quotidiens. Une invitation à observer, ressentir et habiter le temps. Avec un vocabulaire sobre, Este Mundo transforme des gestes quotidiens – simples, répétitifs, parfois fragiles – en les associant à des états corporels inspirés par l’air, la lumière, la chaleur, le', 'sur ce qui se transmet au-delà des mots, Este Mundo embrasse ce qui est rarement exprimé : le silence, le regard et le souffle. Avec cette pièce, la chorégraphe marocaine poursuit un travail traversé – depuis plus de 15 ans – par un rapport fort au rituel et au quotidien. Le plateau y est un espace commun où se rencontrent les singularités de chacun. Vincent Théval Bouchra Ouizguen Bouchra Ouizguen est une danseuse et chorégraphe marocaine, née en 1980 à Ouarzazate. Elle vit et travaille à Marrakech, où elle contribue activement au développement de la scène chorégraphique locale depuis 1998. Son travail est enrichi par ses intérêts pour le cinéma, la littérature et la musique. Lors de sa pièce pionnière Madame Plaza (prix Révélation Chorégraphique de la SACD), elle partage la scène avec', ""avec les sociétés qui les pratiquent et les idéologies qu’elles véhiculent. L'exposition s'accompagne d’une programmation culturelle et de médiation foisonnante, inaugurée le 4 juillet 2026 par une grande parade placée sous la direction artistique de Mohamed Bourouissa."", 'L\'événement Le Magasin du Monde a lieu au Square Marcel Sembat dans la ville de Paris. Date : le 25/07/2026 (juillet 2026) de 18h00 à 19h00. Description : Et si on suivait le fil de coton ? Si on apprenait à lire le wax ? Allez, Faisons swinguer les machines à coudre ! En avant la musique ! Et vivent le théâtre, les objets et les marionnettes pour confronter nos mémoires et accorder nos histoires ! Pourquoi le sud est-il toujours en bas ? Et si on essayait autre chose ? Polyglotte, multi-instrumental, pluri-textuel, manuel et automatisé, LE MAGASIN DU MONDE est un spectacle porté par une équipe algéro-maroco-française qui veut aujourd’hui partager un peu de son passé colonial commun. "" Pas de panique ! Pour faire entendre notre voix plurielle sur ce passé encore à vif, nous avons trouvé', ""inspirés par l’air, la lumière, la chaleur, le poids et la stabilité. Chacun des 5 interprètes de la troupe Dançando com a Diferença – composée d’une majorité d’artistes en situation de handicap – développe ainsi son propre état : à Bárbara le mouvement autour de la légèreté ; à Sofia la verticalité et la puissance ; à Sara la chaleur et l'énergie ; à Telmo le poids et la stabilité ; à Joana la suspension et l'équilibre. En dramaturge et chorégraphe attentive au jeu, au détail et aux relations entre les interprètes, Bouchra Ouizguen travaille ce qui circule entre les corps, le son et la lumière. En écho à l’attention que portait l’écrivain portugais Fernando Pessoa aux paysages intérieurs et à la réflexion du poète palestinien Mahmoud Darwich sur ce qui se transmet au-delà des mots, Este"", 'dont chaque interprète habite le mouvement. Bárbara est oiseau et nid, Sofia eau et reine, Sara soleil, Telmo terre et stabilité, Joana suspension et ange. Depuis Madère, Henrique Amoedo, directeur artistique de la compagnie Dançando com a Diferença, oeuvre à la reconnaissance des corps non normés. Avec ces interprètes, Bouchra Ouizguen a pris le temps de marcher, cuisiner, dessiner, loin du studio de danse, jusqu’à ce qu’une danse ou un chant surgisse. Avec elles et eux, elle prolonge sa recherche : être attentive aux gestes, aux souffles, aux circulations, et faire émerger des présences autant que des formes.', ""L'événement Nahl de Bouchra Ouizguen au Festival d'Automne a lieu au Le Panthéon dans la ville de Paris. Date : le 30/09/2026 (septembre 2026) de 19h00 à 19h30. Description : Au Panthéon, Bouchra Ouizguen compose la chorégraphie d’un essaim d’enfants, à l’énergie vive. Dans cet espace monumental chargé d’histoire, leurs présences mobiles et sensibles déplacent la mémoire du lieu vers l’intensité d’un présent partagé. Nahl —« abeille » en arabe—rassemble des enfants âgés de neuf à onze ans dans une expérience de danse fondée sur l’écoute et l’attention. Le monde animal devient un univers métaphorique, ouvert à leurs imaginaires et à leurs formes de présence. Comme l’abeille, qui agit sans rébellion et produit un bien qui dépasse sa propre survie, chaque enfant suit son propre rythme, entre"", ""L'événement Mode d'emploi pour metteur en scène en temps de guerre a lieu au THEATRE DU ROND POINT PARIS dans la ville de Paris. Dates : le 18/11/2026 (novembre 2026) ; le 19/11/2026 (novembre 2026) ; le 20/11/2026 (novembre 2026) ; le 21/11/2026 (novembre 2026) ; le 22/11/2026 (novembre 2026) ; le 25/11/2026 (novembre 2026) ; le 26/11/2026 (novembre 2026) ; le 27/11/2026 (novembre 2026) ; le 28/11/2026 (novembre 2026). Description : Mode d'emploi pour metteur en scène en temps de guerre En 2022, Ido Shaked et Hannan Ishay, deux metteurs en scène israéliens, l’un vivant à Tel Aviv et l’autre à Paris, reçoivent une invitation pour présenter une nouvelle création dans un festival réputé en Europe. Cependant, derrière cette opportunité éblouissante les attend une mission terrifiante :"", 'chaque enfant suit son propre rythme, entre élans, fatigue et suspensions, composant un organisme collectif en constante transformation. Ils roulent, sautent, chantent, crient, se taisent, s’immobilisent, ouverts au flux et à la circulation des énergies. Les interactions, fondées sur la disponibilité, restent réversibles : elles se font et se défont, laissent place à des assemblages fugitifs, des regroupements imprévus. Bouchra Ouizguen privilégie l’expérience immédiate d’un temps partagé, éphémère et intense. Dans ce lieu saturé de mémoire, et dans le cadre de l’exposition Vies minuscules conçue par le Centre Pompidou, ces présences circulent librement et déplacent l’attention vers ce qui échappe au récit historique.', 'et de la banlieue parisienne pour Rayane Mcirdi. Par-delà les différentes cultures, les deux expositions tendront vers la transmission d’une histoire universelle.', 'dont un grand nombre est dévoilé à Paris pour la première fois, l’exposition explore les représentations de créatures réelles et imaginaires issues de civilisations réparties sur quatre continents, du IIIe millénaire av. J.-C. au début du XXe siècle. En parallèle, le public pourra profiter de ce weekend pour admirer Astre Mobile , oeuvre présentée dans le cadre du festival Paris Design Week. Astre Mobile, conçue par le studio Maison Lacmé, est une voiture transparente transformée en œuvre d’art, entre artisanat, matière et imaginaire.']","Voici 1 événement :

1. **""Este Mundo"" de Bouchra Ouizguen et Dançando com a Diferença** | Dates : 08/10/2026, 09/10/2026 et 10/10/2026 à 18h30 | Chaillot - Théâtre national de la Danse, Paris | Pièce chorégraphique inclusive explorant le silence, le souffle et la présence, avec 5 interprètes aux singularités uniques.","""Este Mundo"" de Bouchra Ouizguen a lieu au Palais de Chaillot à Paris, les 8, 9 et 10 octobre 2026, dans le cadre du Festival d'Automne.",0.7777777777777778,1.0,0.5016609068290059
Y a-t-il une batucada Place de l'Hôtel de ville à Issy-les-Moulineaux le 21 juin 2026 ?,"[""L'événement ANNULÉ Vila Sena - batucada - Place de l'Hôtel de ville a lieu au Place de la Mairie dans la ville de Issy-les-Moulineaux. Date : le 21/06/2026 (juin 2026) de 18h05 à 18h30. Description : VILA SENA - BATUCADA La Batucada Vila Sena a été créée en 2021, et se compose d’un groupe de percussionnistes passionné.es. La talentueuse troupe performe l’art de la percussion brésilienne à merveille, et participe à des festivals, des défilés et pleins d’autres évènements culturels et/ou sportifs : une performance dynamique, colorée et captivante vous sera proposé ce 21 juin prochain ! Il sera temps de détendre ses hanches, et de se laisser transporter dans un moment envoûtant, aux accents de Carnaval do Brasil !"", ""L'événement ANNULÉ Issy Danse - Place de l'Hotel de Ville a lieu au Place de la Mairie dans la ville de Issy-les-Moulineaux. Date : le 21/06/2026 (juin 2026) de 15h45 à 16h15. Description : L’histoire d’Issy Danse débute en 2014 avec une vingtaine d’adhérents et une seule discipline : la danse de salon. Au fil des années, l’association n’a cessé de grandir, enrichissant son offre et accueillant de plus en plus de passionnés. Aujourd’hui, Issy Danse propose six disciplines : danse sportive, danse contemporaine, danse classique, hip-hop, salsa et bachata. À l’occasion de la Fête de la musique, nous avons le plaisir de vous présenter plusieurs de nos univers : la danse latine en couple et en solo, le hip-hop, la salsa, ainsi que le Solo Latin Team d’Issy Danse. Ce groupe de jeunes adolescents"", ""L'événement ANNULÉ FÊTE DE LA MUSIQUE 2026 À ISSY-LES-MOULINEAUX\u202f–\u202fUN DIMANCHE EN MUSIQUE EN VILLE a lieu au Place de la Mairie dans la ville de Issy-les-Moulineaux. Date : le 21/06/2026 (juin 2026) de 11h00 à 22h30. Description : UN DIMANCHE EN MUSIQUE EN VILLE Voici un long dimanche en ville, qui prend son temps, qui s’ouvre et qui respire, où la musique vient doucement habiter chaque rue, chaque place, chaque instant. C’est l’été ! Depuis 44 ans, la Fête de la Musique accompagne l’arrivée de l’été à Issy-les-Moulineaux. Cette fête, elle s’est construite avec celles et ceux qui la font vivre : les habitants, les artistes, les associations. Ensemble, ils en ont fait un rendez-vous simple et chaleureux, où la musique circule librement et rassemble. Peut-être aussi une manière différente"", ""L'événement Emajeur - Place de l'Hôtel de Ville a lieu au Place de la Mairie dans la ville de Issy-les-Moulineaux. Date : le 21/06/2026 (juin 2026) de 20h50 à 21h20. Description : EMAJEUR Un éclat de douceur et de révolte traverse la musique d’Emajeur. Un mot d’ordre : transformer ses tempêtes intérieures en refrains qui restent. Portée par le vent d'ouest, elle grandit entre mélodies pop, textes rap et sonorités électro, cherchant très tôt dans la musique un refuge autant qu’une arme. Elle compose ses propres prods sur le tas et l’écriture s’inscrit comme une évidence : des textes bruts écrit comme dans un journal intime. Sensible, un brin insolente, son premier EP Problèmes Minimes fait danser, en tendant un miroir à une génération qui cherche elle aussi à être vraie. iSSY-LES-MOULINEAUX"", ""L'événement ANNULÉ Chorale de Paris - Place de l'Hotel de Ville a lieu au Place de la Mairie dans la ville de Issy-les-Moulineaux. Date : le 21/06/2026 (juin 2026) de 16h20 à 16h50. Description : La Chorale de Paris, actuellement dirigée par Zuhal Karadağ, est une chorale d’Issy-les-Moulineaux qui entend promouvoir avec enthousiasme et précision la musique et la culture turques. Elle a été créée en 2017 et depuis, elle ne fait qu'accroitre son succès !"", ""L'événement Annulée -Fête de la musique annulée à Issy-Les-Moulineaux a lieu au Avenue de la République - Issy dans la ville de Issy-les-Moulineaux. Date : le 21/06/2026 (juin 2026) de 10h00 à 22h30. Description : Issy-les-Moulineaux en musique le 21 juin 2026 - Annulée !! INFORMATION CANICULE !! En raison des chaleurs extrêmes annoncées à compter de dimanche et par mesure de sécurité, l’ensemble des événements sportifs ainsi que toutes les manifestations prévues dans le cadre de la Fête de la Musique sont annulés. Nous vous remercions de votre compréhension et de votre grande vigilance."", ""L'événement ANNULÉ Boukan Bele - Place de l'Hôtel de Ville a lieu au Place de la Mairie dans la ville de Issy-les-Moulineaux. Date : le 21/06/2026 (juin 2026) de 17h30 à 18h00. Description : Créée en 1988, BOUKAN est une association, ayant pour but de promouvoir la culture afro-caribéenne à travers diverses activités socio-culturelles pour adultes et adolescents. L’association propose des ateliers de Bèlè (musique, chant et danse traditionnels de Martinique) et de carnaval antillais. Elle réalise régulièrement des prestations pour des festivals, des mariages, la retraite aux flambeaux du 13 juillet, des évènements divers. Sa philosophie : le partage, la transmission de la culture et la convivialité."", ""L'événement ANNULÉ Almass - Place de l'Hôtel de ville a lieu au Place de la Mairie dans la ville de Issy-les-Moulineaux. Date : le 21/06/2026 (juin 2026) de 15h10 à 15h40. Description : Almass est une association de danse orientale pour enfants et adultes : elle propose des cours hebdomadaires, ainsi que des stages pour tout niveau. Son objectif : faire découvrir la danse orientale avec une méthode claire, simple et efficace, et sensibiliser les élèves à la scène. Si la danse orientale exprime à la fois toute la féminité, la vitalité et la sensualité, et qu’elle permet de se dépenser tout en s'amusant sur des rythmes entrainants, la Fête de la Musique sera donc une excellente opportunité pour toutes ces danseuses en herbe ou confirmées de vous montrer ce qu’elles ont appris !"", ""L'événement ANNULÉ Cœur Tango en - Place de l'Hôtel de Ville a lieu au Place de la Mairie dans la ville de Issy-les-Moulineaux. Date : le 21/06/2026 (juin 2026) de 14h35 à 15h05. Description : Cœur Tango est une association de plus de 20 ans d’expérience dans l’apprentissage et la pratique du Tango, danse sensuelle et rythmée d’Amérique du Sud : à l’Agora ou au Duplex, l’association vous propose tout au long de l’année des cours, mais aussi des stages de pratique, et organise même des milongas, ces bals de tango argentin. C’est dans une ambiance chaleureuse et conviviale que les danseurs et danseuses de Cœur Tango vont venir se produire sur la scène associative du Réacteur, pour notre plus grand bonheur."", 'rassemble. Peut-être aussi une manière différente d’habiter le temps. Nous vous invitons à flâner, à vous arrêter, à tendre l’oreille plus longtemps. La musique accompagne les pas, prolonge les échanges, vous offre des instants suspendus. “La musique est comme une rivière. Elle traverse en vous*” Joni Mitchell * Music is like a river. It flows through you. Coordonnée par le Réacteur, cette 44 édition dessine un parcours dans la ville où les styles se croisent et les scènes apparaissent au détour d’une rue, d’une place : la promesse d’une découverte. C’est votre dimanche. Prenez le temps. La musique est partout, et la ville, aujourd’hui, se partage. Issy-les-Moulineaux en musique le 21 juin 2026 Depuis 44 ans, la Fête de la musique accompagne l’arrivée de l’été à Issy-les-Moulineaux. Cette', ""L'événement ANNULÉ  Journée musicale à la Médiathèque du centre-ville a lieu au Médiathèque centre-ville dans la ville de Issy-les-Moulineaux. Date : le 21/06/2026 (juin 2026) de 14h00 à 18h00. Description : 11h à 12h30 : « Promenades françaises » Ce café musical propose un panorama des musiques japonaises, de la scène expérimentale aux musiques populaires animé par Franck Stoffer, directeur commercial du Centre National de la Musique 14h30-15h : Jazz vocal avec le trio de Samantha Pagliaro 15h15-16h15 : « Airs d’opérettes » avec la classe de chant adultes du conservatoire Niedermeyer présentés par Anaïs Huguet-Balent, accompagnés au piano par Kiyoko Inoué 16h30-17h15 : “Roro & Co”. Roro, chanteur et poète, interprète avec ses invités quelques-uns de ses textes mis en musique et de ses"", ""L'événement Sensitivity Players a lieu au Place de la Mairie dans la ville de Issy-les-Moulineaux. Date : le 21/06/2026 (juin 2026) de 22h10 à 22h40. Description : Formé en septembre 2023, le groupe de quadras d’Issy (et d’ailleurs) s’est retrouvé sur l’envie de faire de la musique ensemble, pour se faire plaisir et le partager sur scène ! Leur playlist est composée de reprises Pop/Rock, plutôt récentes: Avicci, Lizzo, Juliette Armanet, Gossip, Olivia Rodrigo, Amy Winehouse, One Republic… Ils ont une playlist de plus de 50 titres qu'ils travaillent dans les studios du Réacteur.""]","Voici 1 événement :

1. **ANNULÉ Vila Sena - batucada - Place de l'Hôtel de ville** | 21/06/2026 de 18h05 à 18h30 | Place de la Mairie, Issy-les-Moulineaux | La Batucada Vila Sena, créée en 2021, propose une performance dynamique et colorée de percussion brésilienne, inspirée du Carnaval do Brasil.","La batucada ""Vila Sena"" prévue Place de l'Hôtel de ville à Issy-les-Moulineaux le 21 juin 2026 est annulée.",0.8571428571428571,1.0,0.471079093949623
Quand a lieu le Festival Manga à Bois-le-Roi ?,"[""L'événement Festival Manga a lieu au Médiathèque Musidora dans la ville de Bois-le-Roi. Date : le 03/10/2026 (octobre 2026) de 14h30 à 16h30. Description : Venez rencontrer Fabien Dalmasso dessinateur de BD et de Manga pour une masterclass / atelier initiation"", ""L'événement Projection Manga a lieu au Médiathèque Musidora dans la ville de Bois-le-Roi. Date : le 02/10/2026 (octobre 2026) de 20h00 à 21h30. Description : Début du festival manga avec la projection de Métropolis (2001), Film d'animation Manga librement adapté du film de Fritz Lang""]","Voici 1 événement :

1. **Festival Manga** | 03/10/2026 de 14h30 à 16h30 | Médiathèque Musidora, Bois-le-Roi | Venez rencontrer Fabien Dalmasso, dessinateur de BD et de Manga, pour une masterclass/atelier initiation.","Le Festival Manga a lieu à la Médiathèque Musidora à Bois-le-Roi, le 3 octobre 2026 de 14h30 à 16h30.",0.875,1.0,0.6072604822759027
"Où se déroule le concert ""Last miracle"" à Paris le 21 juin 2026 ?","[""L'événement Last miracle a lieu au Sur le pont croisement boulevard Port-Royal et rue Pascal dans la ville de Paris. Date : le 21/06/2026 (juin 2026) de 19h30 à 20h00. Description : Pop songs, one hit wonders & pépites de 1967 à 2026."", ""L'événement Marilou Fête la Musique a lieu au Marilou dans la ville de Paris. Date : le 21/06/2026 (juin 2026) de 14h00 à 19h30. Description : CONCERT X JAM SESSION AU MARILOU - FÊTE DE LA MUSIQUE"", ""L'événement Concert à la Maison Saint-charles a lieu au Maison Saint-Charles dans la ville de Paris. Date : le 21/06/2026 (juin 2026) de 19h00 à 21h00. Description : La Maison Saint-Charles accueillera un concert le 21 juin de 19h à 21h. Cinq artistes se succederont sur des styles variés. N'hésitez pas à nous rejoindre !"", ""L'événement Concert spatialisé a lieu au Cité des sciences et de l'Industrie dans la ville de Paris. Dates : le 19/06/2026 (juin 2026) ; le 19/06/2026 (juin 2026) ; le 19/06/2026 (juin 2026). Description : Distribution : Modulor Music / label: TD47 À l’occasion des Éclatantes, elle s’associe au musicien Julien Maillard pour spatialiser ce concert au planétarium et créer une immersion totale, visuelle et sonore. Son premier album paraîtra cette année, précédé de plusieurs singles à l’été 2026. 3 séances à 21h, 22h et 23h"", ""L'événement Musique Et Bien-Être a lieu au CENTRÉ dans la ville de Paris. Date : le 21/06/2026 (juin 2026) de 14h00 à 22h00. Description : Des instants musicaux autour du bien être..."", ""L'événement MF Room a lieu au Place de la Bastille dans la ville de Paris. Date : le 21/06/2026 (juin 2026) de 14h00 à 21h00. Description : Découvrez un concert où l’électronique live, de l’ambient à la techno, rencontre la puissance des instruments acoustiques – saxophone, guitare et synthétiseurs analogiques, conçus maison. Porté par un sound system haut de gamme, conçu sur mesure, ce voyage sonore vous plonge dans une immersion où chaque fréquence, chaque nuance, est restituée avec une précision envoûtante. Entre mélodies planantes, beats énergiques et improvisations audacieuses, le concert offre une expérience où l’électronique et l’acoustique s’entrelacent pour créer une ambiance à la fois immersive et vivante. Une fusion rare où la musique devient une aventure sensorielle."", ""L'événement Entre classique et musiques actuelles a lieu au Eglise Evangélique Libre Paris-Alésia dans la ville de Paris. Date : le 21/06/2026 (juin 2026) de 18h00 à 20h00. Description : Les musiciens de l'église protestante évangélique de Paris-Alésia vous proposent un concert varié, entre classique, jazz et pop."", ""L'événement PAAFclash2.0 a lieu au 5 rue Jean Poulmarch, 75010 Paris dans la ville de Paris. Dates : le 21/06/2026 (juin 2026) ; le 22/06/2026 (juin 2026). Description : Nous organisons un concert de musique électronique, une soirée rythmée et immersive dédiée au son et à l’énergie du live."", ""L'événement l'ACAGL14 fait son show en chantant et en dansant a lieu au Place Victor et Hélène Basch dans la ville de Paris. Date : le 21/06/2026 (juin 2026) de 17h00 à 23h59. Description : Des 17h00, une chorale viendra chanter sur le parvis de l'église Saint Pierre de Montrougede 17h à 17h30 et nous puisuivrons avec de la danse hip hop et Zumba de 17h45 à 19h15pour enchainer sur soirée musicale de chansons fransaises et varietes 19h30 à 23h00"", ""L'événement La musique est en fête ! a lieu au Kilomètre Zéro dans la ville de Paris. Date : le 21/06/2026 (juin 2026) de 14h00 à 22h00. Description : Célébrons la Fête de la Musique ! Chaque année, le 21 juin, le monde entier se réunit pour célébrer la Fête de la Musique, un événement qui met à l'honneur la diversité et la richesse des expressions musicales. Cette journée emblématique marque le début de l'été et invite les passionnés de musique, les artistes amateurs et professionnels à partager leur talent dans les rues, les parcs et les places publiques. Un Événement Universel La Fête de la Musique est bien plus qu'un simple concert ; c'est une véritable fête populaire qui transcende les frontières culturelles et linguistiques. Des milliers de musiciens, qu'ils soient solistes, groupes"", ""L'événement Jeunes Talents célèbre la musique a lieu au Archives nationales de France dans la ville de Paris. Date : le 21/06/2026 (juin 2026) de 14h30 à 18h30. Description : Célébrez la musique dans un écrin de verdure historique au coeur de Paris lors de cet évènement gratuit et en plein air. Rencontrez la nouvelle promotion des grands artistes de la musique classique de demain séléctionnés lors des auditions 2026. Du piano, du chant, de la guitare et bien d'autres instruments vous attendent pour ce jour spécial."", ""L'événement Culture Rapide a lieu au Place Fréhel 75020 dans la ville de Paris. Date : le 21/06/2026 (juin 2026) de 08h30 à 23h59. Description : Que de la bonne musique live et du spoken word""]","Voici 1 événement :

1. **Last miracle** | 21/06/2026 de 19h30 à 20h00 | Sur le pont, croisement boulevard Port-Royal et rue Pascal, Paris | Pop songs, one hit wonders & pépites de 1967 à 2026.","""Last miracle"" a lieu au croisement boulevard Port-Royal et rue Pascal à Paris, le 21 juin 2026 de 19h30 à 20h.",0.9090909090909091,1.0,0.7337877074046836
"Où se tient l'exposition virtuelle ""Regards croisés Maroc-France"" ?","[""L'événement Exposition virtuelle « Regards croisés Maroc-France » a lieu au Bibliothèque nationale de France - BnF dans la ville de Paris. Événement récurrent : 365 occurrences du 01/07/2026 au 30/06/2027. Mois concernés : août 2026, avril 2027, décembre 2026, février 2027, janvier 2027, juillet 2026, juin 2027, mai 2027, mars 2027, novembre 2026, octobre 2026, septembre 2026. Description : La Bibliothèque nationale de France (BnF) et la Bibliothèque Nationale Royale du Maroc (BNRM) s’associent autour d’un projet visant à la réalisation d’une exposition virtuelle retraçant les échanges intellectuels, artistiques et culturels entre nos deux pays à travers la valorisation des collections des deux bibliothèques nationales. Un total de 300 documents (manuscrits, estampes, cartes anciennes et"", ""(manuscrits, estampes, cartes anciennes et ouvrages rares) y seront présentés et valorisés au travers d’articles rédigés par des conservateurs et/ou des chercheurs français et marocains. Un focus sera notamment réalisé sur la Mosquée de Paris, qui célèbre son centenaire en 2026. L’exposition virtuelle n'est pas encore accessible."", 'et de la banlieue parisienne pour Rayane Mcirdi. Par-delà les différentes cultures, les deux expositions tendront vers la transmission d’une histoire universelle.', ""avec les sociétés qui les pratiquent et les idéologies qu’elles véhiculent. L'exposition s'accompagne d’une programmation culturelle et de médiation foisonnante, inaugurée le 4 juillet 2026 par une grande parade placée sous la direction artistique de Mohamed Bourouissa."", 'Une occasion originale de croiser regard artistique et réflexion citoyenne. Les visiteurs pourront également profiter de médiations flash proposées par l’équipe de médiatrices pour découvrir les coulisses du travail de l’artiste et approfondir leur lecture des œuvres. Dernière occasion de visiter l’exposition avant sa fermeture le 20 septembre.', ""000 étudiants une surface de 15 000 m², 400 000 livres et un matériel numérique de pointe. Nous vous proposons de la visiter le samedi 19 septembre de 10 h 30 à 17 h. Nous vous accueillerons autour d’un café , nous déambulerons ensemble dans les espaces publics et les magasins , et nous terminerons par l'exposition photo de l’association Diaph8 ( Déclencheur d'Initiatives en Art et Photographie de Paris 8 ) du hall d'accueil. Vous pourrez y choisir des livres sur l’étagère Dons de livres ."", 'un regard critique sur l’histoire des lieux d’exposition eux-mêmes. La séquence centrale du parcours est constituée de quatorze toiles associées à des photographies et plaques de verres originales issues des collections du musée du quai Branly – Jacques Chirac. Par l’autoportrait, l’artiste s’insère dans les scènes d’exhibitions ethnographiques du Champ-de-Mars, du Jardin d’Acclimatation ou des Folies Bergère. Le dispositif scénographique engagera directement le public : les images originales ne se dévoilent qu’à la demande, dans un jeu de reflets où le visiteur se voit en train de regarder, devenant à son tour acteur du dispositif de vision et de mise en question.', ""L'événement Mariages عرس (Algérie-Maroc-Tunisie) a lieu au Institut du monde arabe dans la ville de Paris. Événement récurrent : 108 occurrences du 29/09/2026 au 31/01/2027. Mois concernés : décembre 2026, janvier 2027, novembre 2026, octobre 2026, septembre 2026. Description : Mêlant objets patrimoniaux, créations artistiques et archives visuelles et sonores, une immersion dans ce moment pivot qu'est le mariage. Un événement qui se célèbre en grande pompe au Maghreb, où il est l’occasion de faire communauté en se rassemblant autour d’une joie collective. Une sélection exceptionnelle de costumes et parures L’exposition s’organise autour d’œuvres patrimoniales et présente une sélection d’une quarantaine de costumes et parures jamais présentée en France, issue de collections marocaines,"", ""✨ Le lieu de rendez-vous se fera au niveau de la voie 3, près de l'enseigne Relay. Visites sur inscription obligatoire, le lien d'inscription sera disponible début septembre."", 'en France, issue de collections marocaines, algériennes et tunisiennes. Ces pièces d’exception datant des XIXe et XXe siècles célèbrent la mariée et les femmes qui l’entourent tout en mettant en lumière les spécificités nationales et régionales, la richesse des héritages et les pratiques partagées notamment entre musulmans et juifs. Mettant au cœur du propos la mariée mais également le rôle des femmes lors de ces célébrations – de la constitution du trousseau à la confection des pièces ou encore à l’accompagnement de la mariée –, l’exposition cherche également à confronter ces œuvres patrimoniales aux regards d’artistes et ainsi mettre en lumière les persistances ou évolutions sociétales contemporaines. La parole à 18 artistes contemporain(e)s Afin de capter l’essence de ces fêtes dans', 'au public, deux journées d’ateliers à destination des étudiant·es de master, une exposition d’artistes arabes et méditerranéens, ainsi qu’un temps de projection et de valorisation des productions étudiantes. Elle met ainsi en lumière une approche pleinement en phase avec l’identité de Paris 8, en articulant recherche, création et dialogue avec la société.', ""L'événement Des gestes de nos mondes a lieu au Frac Île-de-France, Les Réserves dans la ville de Romainville. Événement récurrent : 37 occurrences du 13/09/2026 au 14/11/2026. Mois concernés : novembre 2026, octobre 2026, septembre 2026. Description : Des gestes de nos mondes Exposition collection en partenariat avec le 32 bis (Tunis) Co-commissariat : Hela Djobbi, directrice artistique du 32bis à Tunis, Salma Kossemtini, commissaire indépendante et Cindy Olohou, responsable collection du Frac L'exposition met en dialogue des oeuvres de la collection du Frac Île-de-France et des pratiques d’artistes de la scène artistique tunisienne autour de l’archive comme matière vivante. L’exposition explore les façons dont les artistes deviennent gardiens de récits, réactivent des mémoires fragmentées""]","Voici 1 événement :

1. **Exposition virtuelle « Regards croisés Maroc-France »** | Du 01/07/2026 au 30/06/2027 | Bibliothèque nationale de France - BnF, Paris | La Bibliothèque nationale de France (BnF) et la Bibliothèque Nationale Royale du Maroc (BNRM) s’associent pour une exposition virtuelle retraçant les échanges intellectuels, artistiques et culturels entre les deux pays, avec 300 documents (manuscrits, estampes, cartes anciennes, etc.). Un focus est réalisé sur la Mosquée de Paris, qui célèbre son centenaire en 2026.","L'exposition virtuelle ""Regards croisés Maroc-France"" a lieu à la Bibliothèque nationale de France à Paris, du 1er juillet 2026 au 30 juin 2027.",0.9090909090909091,1.0,0.46637932202592747
"Quel événement ""Musique du monde"" a lieu Placette Louis Loucheur à Paris le 21 juin 2026 ?","[""L'événement Musique du monde a lieu au Placette Louis Loucheur (angle Louis Loucheur/boulevard Bessière) dans la ville de Paris. Date : le 21/06/2026 (juin 2026) de 18h00 à 23h45. Description : 18h à 20h : danse africaine 20h à 22h : musique Maroc / Tunisie / Algérie / Kabyles / raï 22h à 23h : autres"", ""L'événement La musique est en fête ! a lieu au Kilomètre Zéro dans la ville de Paris. Date : le 21/06/2026 (juin 2026) de 14h00 à 22h00. Description : Célébrons la Fête de la Musique ! Chaque année, le 21 juin, le monde entier se réunit pour célébrer la Fête de la Musique, un événement qui met à l'honneur la diversité et la richesse des expressions musicales. Cette journée emblématique marque le début de l'été et invite les passionnés de musique, les artistes amateurs et professionnels à partager leur talent dans les rues, les parcs et les places publiques. Un Événement Universel La Fête de la Musique est bien plus qu'un simple concert ; c'est une véritable fête populaire qui transcende les frontières culturelles et linguistiques. Des milliers de musiciens, qu'ils soient solistes, groupes"", ""L'événement Quand la Musique rencontre le Mondial ⚽️🎶 a lieu au Comité Caribe - bistrot des Caraïbes colombiennes dans la ville de Paris. Date : le 21/06/2026 (juin 2026) de 14h00 à 20h00. Description : Fête de la Musique + Coupe du Monde = on ne voit ça que tous les 4 ans ⚽️🎶 Maillot Party 👕 - de foot, de rugby, de cyclisme… n’importe lequel (maillot de bain, ça marche aussi 😋👙) Street Food • Drinks • Music 📅 Dimanche 21.06 | 14h–20h LINE-UP DE LA CASA 👯 - @ponysirenatropical : Perreo - @pickheras : House - @stirred.blessings : Worldwide Club - @whosaskin : Worldwide Club Menu et timetable soon ⏰ Nos vemos el domingo 21.06 - Besos !!!"", ""L'événement 5ème édition rue du Groupe Manouchian Paris 20ème a lieu au rue du groupe Manouchian 75020 dans la ville de Paris. Date : le 21/06/2026 (juin 2026) de 16h00 à 23h59. Description : Comme cette année, la fête de la musique c'est dimanche, on vous propose une super 5ème édition : 8 groupes ou artistes varié(e)s et un DJ entre les sets ! 16h : The Silvertones (power pop post punk) 17h15 : Electro Lobo (electro rock) 17h30 : Céline Mauge (chanson folk pop) 18h45 : Rock Autopsie (tribute Bashung / Higelin / Thiefaine) 19h45 : Ludo (rock grunge) 20h : Miss J (rock pop) 21h20 : Stef2lamort Gang (compos rock français) 22h30 : Mikui (néo soul pop) 23h30: DJ set et toujours boire et à manger sur place avec les pizzas de notre chef pizzaiolo Andrea et barbecue merguez"", ""L'événement Culture Rapide a lieu au Place Fréhel 75020 dans la ville de Paris. Date : le 21/06/2026 (juin 2026) de 08h30 à 23h59. Description : Que de la bonne musique live et du spoken word"", ""L'événement Faites de la musique a lieu au Rue Julien Lacroix dans la ville de Paris. Date : le 21/06/2026 (juin 2026) de 14h30 à 19h00. Description : Prêt pour une immersion totale dans les racines de la culture club ? Le collectif « Faites de la musique » s’empare des platines pour une traversée sonore sans frontières. Oubliez les sets linéaires. L'événement est conçu comme un voyage chronologique et géographique : L’héritage US : Une sélection pointue de House originelle, entre les rythmes bruts de Chicago, la profondeur de Detroit et l'énergie vocale de New York. La touche brésilienne : Une transition vers des sonorités plus organiques et percussives, mêlant chaleur latine et rythmique électronique moderne. Ce qui vous attend : Un flux continu de pépites chinées par des passionnés, une"", ""L'événement La place Edith Piaf en musique ! a lieu au Place Edith Piaf 75020 PARIS dans la ville de Paris. Date : le 21/06/2026 (juin 2026) de 18h00 à 23h00. Description : Rendez-vous des 18h sur la si jolie Place Edith Piaf pour célébrer la fête de la Musique. Au programme, chants pour et par les enfants et concerts. Venez trinquer, danser, et chanter en famille."", ""L'événement Open Show at Hotel La Louisiane a lieu au Hotel La Louisiane dans la ville de Paris. Date : le 21/06/2026 (juin 2026) de 17h30 à 22h00. Description : L'Hotel La Louisiane, le très ancien havre des artistes parisiens, organise une soirée spéciale pour la fête de la musique. À partir de 17H30 à la récepetion de l'Hotel, une scène ouverte regroupera de nombreux artistes de Paris jusqu'à Chicago, avec notamment Nelson B Le Bronx et ses musiciens. Thème : Blues, Country, Folk"", ""L'événement Marilou Fête la Musique a lieu au Marilou dans la ville de Paris. Date : le 21/06/2026 (juin 2026) de 14h00 à 19h30. Description : CONCERT X JAM SESSION AU MARILOU - FÊTE DE LA MUSIQUE"", ""L'événement Pianocello a lieu au 6 rue Edouard Quénu dans la ville de Paris. Date : le 21/06/2026 (juin 2026) de 21h00 à 22h00. Description : Pianocello Duo piano et violoncelle de reprises de musiques contemporaines pour la Fête de la musique. Un moment élégant et sensible, mêlant émotion et modernité à travers des interprétations originales de morceaux actuels."", ""L'événement Jeunes Talents célèbre la musique a lieu au Archives nationales de France dans la ville de Paris. Date : le 21/06/2026 (juin 2026) de 14h30 à 18h30. Description : Célébrez la musique dans un écrin de verdure historique au coeur de Paris lors de cet évènement gratuit et en plein air. Rencontrez la nouvelle promotion des grands artistes de la musique classique de demain séléctionnés lors des auditions 2026. Du piano, du chant, de la guitare et bien d'autres instruments vous attendent pour ce jour spécial."", ""L'événement DUE ouvre la nuit a lieu au 18 rue du Mont Cenis dans la ville de Paris. Date : le 21/06/2026 (juin 2026) de 15h00 à 23h59. Description : En haut des escaliers de Mont Cenis, on celèbre, on regarde le soleil se coucher, on ouvre la nuit. Disco. House. Une sélection de DJs qu'on aime, des sons qu'on a choisis. La Fête de la Musique comme elle devrait toujours être : dehors, ensemble, dans la joie, le partage, l'amour. DUE vous invite à danser. Instagram : @_due_2""]","Voici 1 événement :

1. **Musique du monde** | 21/06/2026 de 18h00 à 23h45 | Placette Louis Loucheur (angle Louis Loucheur/boulevard Bessière), Paris | 18h à 20h : danse africaine / 20h à 22h : musique Maroc, Tunisie, Algérie, Kabyles, raï / 22h à 23h : autres.","""Musique du monde"" a lieu Placette Louis Loucheur à Paris, le 21 juin 2026 de 18h à 23h45.",0.8571428571428571,1.0,0.7329394701539858
Y a-t-il un concert de Taylor Swift à Paris ?,"[""L'événement JEUDI CHANSON a lieu au La Manufacture Chanson dans la ville de Paris. Date : le 15/10/2026 (octobre 2026) de 20h30 à 23h30. Description : Tous les jeudis d’octobre à juin (en dehors des vacances scolaires), une scène ouverte est organisée en entrée libre, pour découvrir de nouveaux artistes et pour présenter le travail des stagiaires de la Manufacture Chanson. Ce sont les Jeudis Chanson. Jeudi 15 octobre 2026 – Concert de la formation « Formation Auteur Compositeur Interprète » POUR RETROUVER LE PROGRAMME COMPLET, CLIQUEZ : ICI"", ""L'événement JEUDI CHANSON a lieu au La Manufacture Chanson dans la ville de Paris. Date : le 17/12/2026 (décembre 2026) de 20h30 à 23h30. Description : Tous les jeudis d’octobre à juin (en dehors des vacances scolaires), une scène ouverte est organisée en entrée libre, pour découvrir de nouveaux artistes et pour présenter le travail des stagiaires de la Manufacture Chanson. Ce sont les Jeudis Chanson. Jeudi 17 décembre 2026 – Concert de la formation « Formation Auteur Compositeur Interprète » POUR RETROUVER LE PROGRAMME COMPLET, CLIQUEZ : ICI"", ""L'événement Concert « Duo Lumières », flûte et guitare a lieu au Église orthodoxe Saint-Serge dans la ville de Paris. Dates : le 19/09/2026 (septembre 2026) ; le 19/09/2026 (septembre 2026). Description : Samedi 19 septembre 2026 16h30-17h30: concert (dans la salle sous l’église) « Duo Lumières », Akiho Nakata, flûte et Hikaru Higashi, guitare (Bach, Debussy, Ravel, de Falla, Schumann, Gounod) Autre concert de la journée : 20h30-22h : concert (dans la salle sous l’église) « La France en Russie », poèmes de Baudelaire, Hugo, Chénier, Collin, Turquety, Blanchecotte, Coppé, mis en musique par Tchaikovsky, Gretchaninov, Cui Dragana Serbanovic, mezzosoprano et Aglaya Zinchenko, piano"", ""L'événement JEUDI CHANSON a lieu au La Manufacture Chanson dans la ville de Paris. Date : le 25/03/2027 (mars 2027) de 20h30 à 23h30. Description : Tous les jeudis d’octobre à juin (en dehors des vacances scolaires), une scène ouverte est organisée en entrée libre, pour découvrir de nouveaux artistes et pour présenter le travail des stagiaires de la Manufacture Chanson. Ce sont les Jeudis Chanson. Jeudi 25 mars 2027 – Concert de la formation « Formation Auteur Compositeur Interprète » POUR RETROUVER LE PROGRAMME COMPLET, CLIQUEZ : ICI"", ': https://youtu.be/AvZMndJo2yk Site internet : https://www.leconcertextraordinaire.com/en-tournee/forever-concerts Facebook : https://www.facebook.com/leconcertextraordinaire Instagram : https://www.instagram.com/leconcertextraordinaire/', ': https://youtu.be/AvZMndJo2yk Site internet : https://www.leconcertextraordinaire.com/en-tournee/forever-concerts Facebook : https://www.facebook.com/leconcertextraordinaire Instagram : https://www.instagram.com/leconcertextraordinaire/', 'L\'événement Coccinelle a lieu au centre social dans la ville de Paris. Date : le 26/09/2026 (septembre 2026) de 11h00 à 11h30. Description : Petite Coccinelle rêve . Elle aimerait tellement s\'envoler comme les autres coccinelles de sa famille, mais elle a beau essayer d\'agiter ses ailes , rien n\'y fait , le Ciel est toujours si loin ! ""Tu es trop petite pour voler , tu n\'es encore qu\'un bébé coccinelle , pour voler , il te faut de la poussière d\'or sur tes ailes ..lui répète toujours papa et maman Coccinelle. Mais petite Coccinelle ne l\'entend pas de cette oreille . ""Je veux voler et je reviendrai en volant ! "" Ainsi , un beau matin , Coccinelle part à la recherche de cette poudre rêvée.', ""L'événement LUX Tour Paris a lieu au LUX Tour - Lancement LUX Tour dans la ville de Paris. Dates : le 11/11/2026 (novembre 2026) ; le 12/11/2026 (novembre 2026) ; le 13/11/2026 (novembre 2026) ; le 14/11/2026 (novembre 2026) ; le 15/11/2026 (novembre 2026). Description : LUX Tour La caravane s'invite à Paris pour une session au contact des visiteurs des quatre foires et festivals présents dans la capital : Paris Photo, Photo Days et PhotoSaintGermain. A l'origine du coeur, pulsation photographique. Un parcours itinérant en caravane laboratoire photographique argentique qui fera escale chez les festivals et foires membres du Réseau LUX pour proposer une expérience sensible et inédite. La caravane entièrement équipée et autonome se transforme en laboratoire argentique, pour offrir une"", ""L'événement JEUDI CHANSON a lieu au La Manufacture Chanson dans la ville de Paris. Date : le 12/11/2026 (novembre 2026) de 20h30 à 23h30. Description : Tous les jeudis d’octobre à juin (en dehors des vacances scolaires), une scène ouverte est organisée en entrée libre, pour découvrir de nouveaux artistes et pour présenter le travail des stagiaires de la Manufacture Chanson. Ce sont les Jeudis Chanson. Jeudi 12 novembre 2026 – Concert de la formation « Formation Auteur Compositeur Interprète » POUR RETROUVER LE PROGRAMME COMPLET, CLIQUEZ : ICI"", ""L'événement JEUDI CHANSON a lieu au La Manufacture Chanson dans la ville de Paris. Date : le 02/06/2027 (juin 2027) de 20h30 à 23h30. Description : Tous les jeudis d’octobre à juin (en dehors des vacances scolaires), une scène ouverte est organisée en entrée libre, pour découvrir de nouveaux artistes et pour présenter le travail des stagiaires de la Manufacture Chanson. Ce sont les Jeudis Chanson. Mercredi 2 juin 2027 – Concert de fin d’année de la formation « Formation Auteur Compositeur Interprète » POUR RETROUVER LE PROGRAMME COMPLET, CLIQUEZ : ICI"", 'L\'événement Exposition : ""La tournée"" a lieu au Poste du Louvre dans la ville de Paris. Date : le 02/06/2027 (juin 2027) de 17h00 à 20h30. Description : ""La tournée"" / Yohanne Lamoulère et Clément Charbonnier Bouet Il fut un temps où l’Île-de-France avait besoin de main d’œuvre. Dans les usines, dans les administrations mais aussi pour livrer le courrier. Il fallut attirer du monde et on a bâti, construit, monté avec des tonnes de parpaings, de béton, de briques, des milliers de logements, absorbant des arrivants de toutes les régions de France. Ils venaient du centre, de l’Est mais aussi de plus loin, des Dom, des Tom puis du monde entier. Des cités de postiers. Rangées en cercle tout autour de Paris pour bien en remplir les boîtes aux lettres tous les matins. Aujourd’hui les cartes', ""L'événement JEUDI CHANSON a lieu au La Manufacture Chanson dans la ville de Paris. Date : le 29/04/2027 (avril 2027) de 20h30 à 23h30. Description : Tous les jeudis d’octobre à juin (en dehors des vacances scolaires), une scène ouverte est organisée en entrée libre, pour découvrir de nouveaux artistes et pour présenter le travail des stagiaires de la Manufacture Chanson. Ce sont les Jeudis Chanson. Jeudi 29 avril 2027 – Concert de la formation « Formation Auteur Compositeur Interprète » POUR RETROUVER LE PROGRAMME COMPLET, CLIQUEZ : ICI""]",Je n'ai pas trouvé d'événement correspondant à votre demande.,Je n'ai pas trouvé d'événement correspondant à votre demande.,1.0,1.0,0.8499909245633961
Quels événements culturels à Marseille ce mois-ci ?,"['Un événement organisé grâce au soutien de la Région Île-de-France', ""idées et aux interactions douces et chatoyantes. Venez découvrir ce havre de bitume, ce joyau d’asphalte, ce bonheur-parpaing métamorphosé par l’équipe soukienne : nouveau décor, même énergie. ___________________________________ Programme de l'été Les samedis de juillet 04/07 - Atelier poésie parent-enfant avec Coline Farah + Atelier balade et croquis dans la ville avec Ludovic Nino 11/07 - Atelier réalisations de fleurs en aluminium avec Junseok Mo & Ciné-club courts métrages avec Belladone Production 18/07 - Promenade contée avec Tempus Ludicari & atelier cinéma d’animation avec Angèle Chiodo 25/07 - Oeuvre collective en céramique avec Gilles Remy & ciné-club courts métrages avec Belladone Production Pause estivale du 25 juillet au 29 août. Les samedis d’août & septembre 29/08 -"", ""L'événement Crée ton marque-page personnalisé avec la découpeuse laser ! a lieu au Cité des sciences et de l'Industrie dans la ville de Paris. Dates : le 24/04/2026 (avril 2026) ; le 24/07/2026 (juillet 2026). Description : Vous réaliserez vos propre marque-page en bois, découpé au laser puis personnalisé selon vos envies. Une façon ludique de créer, tout en développant un lien personnel avec la lecture."", 'dans le cadre du dispositif de La SEVE « Un été pour tous »', ""L'événement L'aquarium a lieu au Cité des sciences et de l'Industrie dans la ville de Paris. Événement récurrent : 677 occurrences du 09/12/2025 au 06/02/2028. Mois concernés : août 2026, août 2027, avril 2026, avril 2027, décembre 2025, décembre 2026, décembre 2027, février 2026, février 2027, février 2028, janvier 2026, janvier 2027, janvier 2028, juillet 2026, juillet 2027, juin 2026, juin 2027, mai 2026, mai 2027, mars 2026, mars 2027, novembre 2026, novembre 2027, octobre 2026, octobre 2027, septembre 2026, septembre 2027. Description : Venus des rivages de la Méditerranée : Corse, Sardaigne, Tunisie, Grèce... plusieurs espèces de poissons, crustacés, mollusques du littoral méditerranéen s'y côtoient."", 'L\'événement Le Magasin du Monde a lieu au Square Marcel Sembat dans la ville de Paris. Date : le 25/07/2026 (juillet 2026) de 18h00 à 19h00. Description : Et si on suivait le fil de coton ? Si on apprenait à lire le wax ? Allez, Faisons swinguer les machines à coudre ! En avant la musique ! Et vivent le théâtre, les objets et les marionnettes pour confronter nos mémoires et accorder nos histoires ! Pourquoi le sud est-il toujours en bas ? Et si on essayait autre chose ? Polyglotte, multi-instrumental, pluri-textuel, manuel et automatisé, LE MAGASIN DU MONDE est un spectacle porté par une équipe algéro-maroco-française qui veut aujourd’hui partager un peu de son passé colonial commun. "" Pas de panique ! Pour faire entendre notre voix plurielle sur ce passé encore à vif, nous avons trouvé', ""L'événement Cortège festif Raconte-moi ton mariage a lieu au Institut du monde arabe dans la ville de Paris. Date : le 04/07/2026 (juillet 2026) de 10h30 à 23h00. Description : Raconte-moi ton mariage Cortège festif Un projet initié par l’Institut du monde arabe, en collaboration avec le Grand Palais En écho à l’exposition “Mariages. Algérie-Maroc-Tunisie”, à l’Institut du monde arabe du 29/09/2026 au 31/01/2027 Orchestrée par l’artiste Mohamed Bourouissa, cette performance associe comédiens, chorégraphes et musiciens et se propose de transformer des récits de mariages recueillis préalablement auprès de personnes issues de l’immigration maghrébine, habitant des villes emblématiques de la périphérie parisienne (Gennevilliers, Saint-Ouen, Pantin, Saint-Denis…), en matière vivante de la"", 'ont marqué l’histoire du cinéma et l’imaginaire de plusieurs générations. Un concert où se rencontrent élégance, groove, émotion et improvisation, pour redécouvrir les grandes musiques du cinéma sous un nouvel éclairage jazz. **Kicca** / voix **Hugo Corbin** / guitare **Oscar Marchioni** / orgue Hammond **Mourad Benhammou** / batterie *22h30* Jam session Jazz Groove ! *Point de rencontre essentiel entre artistes émergents et confirmés, la jam session est un moment de partage où naissent les groupes de demain. Une émulsion artistique à vivre dans la salle ou sur scène !* *// Piano à queue, contrebasse & batterie sur place*', ""L'événement Contournements et détournements a lieu au Université Gustave Eiffel dans la ville de Noisy-le-Grand. Dates : le 01/07/2026 (juillet 2026) ; le 02/07/2026 (juillet 2026). Description : Il se tiendra à l’Université Gustave Eiffel, les 1er et 2 juillet 2026 Ce colloque propose d’explorer les pratiques, usages, discours ainsi que les médias et technologies à l’œuvre dans les musiques populaires actuelles par le prisme du détournement, du contournement, et de toutes autres formes suggérant la notion de mouvement, de déplacement voire de remplacement. Ces « reroutages », comme les nomment le théoricien Steve Goodman, s’inscrivent dans une longue histoire de la culture populaire jusqu’à représenter, en eux-mêmes, une véritable culture du contournement. Cette nouvelle approche"", ""L'événement Bibliothèque de la Cité des sciences et de l'industrie a lieu au Cité des sciences et de l'Industrie dans la ville de Paris. Événement récurrent : 647 occurrences du 09/12/2025 au 09/01/2028. Mois concernés : août 2026, août 2027, avril 2026, avril 2027, décembre 2025, décembre 2026, décembre 2027, février 2026, février 2027, janvier 2026, janvier 2027, janvier 2028, juillet 2026, juillet 2027, juin 2026, juin 2027, mai 2026, mai 2027, mars 2026, mars 2027, novembre 2026, novembre 2027, octobre 2026, octobre 2027, septembre 2026, septembre 2027. Description : Profitez de plus de 120 000 ressources multi-supports : livres numériques, un espace jeunesse, des salles réservables, des espaces de travail individuels ou en groupe... Le plus grand espace de coworking de Paris est à"", ""L'événement Scène ouverte dans le Jardin mandala a lieu au Campus de la Transition dans la ville de Forges. Date : le 04/07/2026 (juillet 2026) de 15h30 à 17h00. Description : Une heure et trente minutes pour venir partager des talents divers et variés... On me glisse à l’oreille qu’il y aurait des jeunes conteurs en herbe, des textes de slam, de la danse, de la musique ou autres joyeusetés qui s’inviteront !"", ""L'événement Un podcast pour faire machine arrière a lieu au Cité des sciences et de l'Industrie dans la ville de Paris. Dates : le 16/07/2026 (juillet 2026) ; le 16/07/2026 (juillet 2026) ; le 20/08/2026 (août 2026) ; le 20/08/2026 (août 2026). Description : Vous serez accompagnés par les équipes de médiation pour chacune de ces étapes dans le cadre d'une journée thématique""]",Je n'ai pas trouvé d'événement correspondant à votre demande.,Je suis spécialisé dans les événements culturels en Île-de-France.,0.0,0.0,0.7050187976351265
Quelle est la capitale de l'Italie ?,"['grands noms précédemment cités. Sous la forme de tirages papier, elles représentent à la fois des vues de Rome (monuments antiques, scènes de rue, artistes à la Villa Médicis), du Vatican, de Naples, de Pompéi, du Vésuve, de Florence ou encore de Venise. Certaines représentent également des femmes italiennes en costumes traditionnels. Pour nombre d’entre elles, le format est assez généreux (34 × 46 cm). Bien que nous ne sachions pas précisément où ces photographies ont été acquises, il est envisageable que Sanson ait côtoyé certains photographes. Cette hypothèse est étayée par la conservation d’un cliché représentant le portrait de Sanson réalisé par Giorgio Sommer et daté de 1866.', 'Bâle ou Versailles. Basé à Pontoise et dirigé par Marco Angioloni, il se consacre au répertoire italien des XVIIe et XVIIIe siècles, mettant en lumière des compositeurs rares et se produisant dans de nombreux festivals et enregistrements.', 'de la ville, au plus près des sources de son histoire.', 'de la Ville. Mais attention, si vous acceptez, de nombreux défis vous attendent en chemin. Parviendrez-vous à percer les mystères de notre Patrimoine ? Durée estimée : 1h30', 'de représenter par la musique pure, sans le secours des paroles, des éléments issus de la Nature. Le sonore et le visuel s’y entremêlent avec une dimension presque cinématographique, alors même qu’elles sont le fruit de compositeurs issus de nations rivales en musique à l’époque baroque : la France et l’Italie. Elles déploient un imaginaire très descriptif, à la fois très naïf mais sous-tendu par une grande habileté, une réelle maîtrise de composition. Ce n’est pas un hasard si Les Quatre Saisons sont l’une des oeuvres les plus célèbres de Vivaldi : elles sont à la fois très accessibles à l’auditeur et immensément savantes quand on les observe dans le détail ! C’est cette dimension paysagiste, parfois très pastorale, dont s’empare Grégoire Pont dans son dessin en direct. Autant d’univers', 'familier dont la beauté se révèle autant dans ses monuments que dans ses détails invisibles. Loin des images convenues, cette exposition propose une déambulation sensible dans la capitale. Rues, quais, lumières, silhouettes, fragments du quotidien : chaque photographie saisit l’instant imprévu, la poésie d’un regard, la vérité d’une scène ordinaire. Paris y apparaît comme une ville vivante, libre, multiple — une ville que l’on aime parcourir sans destination précise, guidé par le hasard, l’intuition et le plaisir de la découverte. À travers cette série, Jean-Yves Caillot livre une déclaration personnelle à Paris : non pas une ville idéalisée, mais une présence familière, vibrante et profondément humaine.', "": devant la fontaine face à l'entrée de l'université."", ""L'événement Penser la Méditerranée avec les jeunesses méditerranéennes d’aujourd’hui a lieu au Cité internationale universitaire de Paris dans la ville de Paris. Date : le 17/10/2026 (octobre 2026) de 10h00 à 17h00. Description : Parcours de lectures en différentes langues au sein de différents espaces de la Cité internationale (Maisons : Maroc, Egypte, Tunisie, Lucien Paye, Liban, Italie, Portugal et Théâtre de la Cité internationale) ; Concours de poésie, littérature ou essai ; Ateliers de calligraphie ; Exposition collective avec des peintres et photographes des différents pays de la Méditerranée; Soirées avec des musiques de différents pays."", 'de la Seine, autour de laquelle la ville s’est construite.', 'des oeuvres qui m’ont toujours touché par leur volonté de représenter par la musique pure, sans le secours des paroles, des éléments issus de la Nature. Le sonore et le visuel s’y entremêlent avec une dimension presque cinématographique, alors même qu’elles sont le fruit de compositeurs issus de nations rivales en musique à l’époque baroque : la France et l’Italie. Elles déploient un imaginaire très descriptif, à la fois très naïf mais sous-tendu par une grande habileté, une réelle maîtrise de composition. Ce n’est pas un hasard si Les Quatre Saisons sont l’une des oeuvres les plus célèbres de Vivaldi : elles sont à la fois très accessibles à l’auditeur et immensément savantes quand on les observe dans le détail ! C’est cette dimension paysagiste, parfois très pastorale, dont s’empare', '» et sous laquelle un dédale de souterrains accueille les lignes du Métro et du jeune RER. Une ville en chantiers, tout en démolition, construction et restructuration, dans laquelle on s’inquiète de l’expropriation comme du temps d’Haussmann. Une ville enfin où l’information et la politique se lisent dans la presse imprimée, distribuée partout, et sur les murs, couverts d’affiches et de graffitis. Aux côtés de tirages d’exposition, des Diaposcopes et une cabine de projection permettent aux visiteurs de visualiser des diapositives du fonds dans les mêmes conditions qu’en 1970. Une carte interactive donne accès à l’intégralité des photographies numérisées et permet d’explorer tous les quartiers de la capitale au printemps 1970. Venez vous imprégner de l’ambiance du Paris de 1970 en suivant', ""plus de cinquante ans. Cette démarche, à la fois accessible et exigeante, mêle exploration, enquête et regard contemporain sur la ville. Une démarche ouverte à toutes et tous Aucune expertise n’est requise pour participer. Le projet s’adresse à toutes celles et ceux qui vivent, parcourent ou observent Paris : habitantes et habitants, amateurs de photographie, étudiants, familles ou simples curieux. Chacun peut contribuer selon son regard, son quartier et son expérience, et ainsi participer à une représentation plurielle des paysages parisiens. Des rendez-vous pour explorer Paris autrement Tout au long de la campagne, des événements sont proposés pour découvrir la démarche, rencontrer d’autres participants et explorer les paysages parisiens à travers la photographie. → Plus d'informations""]",Je suis spécialisé dans les événements culturels.,Je suis spécialisé dans les événements culturels en Île-de-France.,0.5,0.0,0.6181170333025785
Recommande-moi un bon restaurant à Paris.,"['dôme (payante) récompense les efforts par une vue à 360°. Ouverte tous les jours de 6h30 à 22h30. Un incontournable pour qui visite Paris !', 'de Paris. Vous découvrirez les méthodes utilisées et les premiers résultats obtenus.', 'L\'événement Exposition ""Au bonheur des bistrots"" a lieu au Place Andre Honnorat, jardin du Luxembourg dans la ville de Paris. Dates : le 12/09/2026 (septembre 2026) ; le 13/09/2026 (septembre 2026). Description : L\'exposition ""Au bonheur des bistrots"" de Pierrick Bourgault et Pierre Josse sera présente pendant 2 jours à la Fête de Paris, il y aura également des dédicasse de livres sur les bistrots avec les auteurs : Léa Wiazemsky, Pierrick Bourgault, Laurent Bihl, Gérard Letailleur et Pierre Josse.', 'familier dont la beauté se révèle autant dans ses monuments que dans ses détails invisibles. Loin des images convenues, cette exposition propose une déambulation sensible dans la capitale. Rues, quais, lumières, silhouettes, fragments du quotidien : chaque photographie saisit l’instant imprévu, la poésie d’un regard, la vérité d’une scène ordinaire. Paris y apparaît comme une ville vivante, libre, multiple — une ville que l’on aime parcourir sans destination précise, guidé par le hasard, l’intuition et le plaisir de la découverte. À travers cette série, Jean-Yves Caillot livre une déclaration personnelle à Paris : non pas une ville idéalisée, mais une présence familière, vibrante et profondément humaine.', 'français et parisien à travers une programmation spécialement conçue pour cette édition anniversaire, avec une attention particulière portée aux archives photographiques.', ""L'événement Visite de la Manufacture - Alain Ducasse Café a lieu au Le Café Alain Ducasse - Manufacture de Café dans la ville de Paris. Dates : le 19/09/2026 (septembre 2026) ; le 19/09/2026 (septembre 2026) ; le 20/09/2026 (septembre 2026) ; le 20/09/2026 (septembre 2026). Description : À l'occasion des Journées européennes du patrimoine, Le Café Alain Ducasse vous ouvre pour la toute première fois les portes de sa Manufacture de Café, le week-end du 20 et 21 septembre. Profitez d'une visite privilégiée, commentée par nos équipes. Une occasion unique de découvrir son savoir-faire dans un lieu d'exception, inauguré en 2019. La magie de l'artisanat opère quotidiennement à la Manufacture de la rue Saint-Sabin dans le 11e arrondissement de Paris : de l’Ethiopie au Brésil en passant par la"", ""plus de cinquante ans. Cette démarche, à la fois accessible et exigeante, mêle exploration, enquête et regard contemporain sur la ville. Une démarche ouverte à toutes et tous Aucune expertise n’est requise pour participer. Le projet s’adresse à toutes celles et ceux qui vivent, parcourent ou observent Paris : habitantes et habitants, amateurs de photographie, étudiants, familles ou simples curieux. Chacun peut contribuer selon son regard, son quartier et son expérience, et ainsi participer à une représentation plurielle des paysages parisiens. Des rendez-vous pour explorer Paris autrement Tout au long de la campagne, des événements sont proposés pour découvrir la démarche, rencontrer d’autres participants et explorer les paysages parisiens à travers la photographie. → Plus d'informations"", "": 3h Tarif : 49 € Objectifs Apprendre à observer et décrire une plante pour l'identifier Mettre en éveil tous ses sens pour découvrir les saveurs originales et souvent inconnues des plantes sauvages Le lieu La balade aura lieu dans le Bois de Vincennes. Un apéro végétal, biologique et de saison ! Les préparations seront 100% végétales avec des ingrédients intégralement biologiques et de saison. Ma cuisine est colorée et empreinte de diverses influences. Des racines colombiennes, à la nouvelle cuisine française, j'intègre dans mes recettes des plantes sauvages pour les sublimer et vous régaler ! Important - Un minimum de 6 participants est requis pour le maintien de l'atelier. Si le minimum n'est pas atteint, vous pourrez reporter votre réservation à une date ultérieure. - La sortie peut"", 'avec le soutien de la Direction des Affaires Culturelles de Paris, de la Mairie de Paris et de la Fondation Hasselblad.', ""L'événement Visite guidée du réfectoire des moines a lieu au Bibliothèque centrale du Conservatoire national des arts et métiers dans la ville de Paris. Dates : le 19/09/2026 (septembre 2026) ; le 19/09/2026 (septembre 2026) ; le 19/09/2026 (septembre 2026) ; le 19/09/2026 (septembre 2026) ; le 19/09/2026 (septembre 2026). Description : Venez découvrir l’histoire d’une des plus belles bibliothèques de Paris ! À l’occasion des Journées européennes du patrimoine, venez découvrir l’histoire de l’ancien prieuré Saint-Martin des Champs et de son réfectoire construit vers 1230 dans lequel la bibliothèque centrale du Conservatoire national des arts et métiers est installée depuis 1852. Visites guidées sur inscription, toutes les demi-heures, de 9h30 à 11h30. RDV dans la cour d’honneur, au 292 rue"", 'Paris autrement • Partager un moment convivial et original • Être surpris à chaque coin de rue Prêt à vivre Paris comme un spectacle ? Que vous soyez curieux, amateur d’histoire ou simplement à la recherche d’une activité originale à Paris, Visites Spectacles vous promet une aventure inoubliable. Laissez-vous guider… et entrez dans l’histoire.', '? Que vous soyez amateur d’énigmes, passionné d’histoire ou simplement à la recherche d’une idée de sortie originale, Qui Veut Pister Paris vous promet une expérience inoubliable. Réservez votre enquête et plongez dans une aventure où chaque rue cache un indice… et chaque détail peut faire la différence.']",Je suis spécialisé dans les événements culturels.,Je suis spécialisé dans les événements culturels en Île-de-France.,1.0,0.0,0.6181170333025785
Qui a gagné la Coupe du monde 2022 ?,['Aucun contexte récupéré.'],Je suis spécialisé dans les événements culturels.,Je suis spécialisé dans les événements culturels en Île-de-France.,0.5,0.0,0.9931170333025785
